"No.","Time","Source","Destination","Protocol","Length","Info"
"1","0.000000","172.16.2.2","172.16.3.2","MPTCP","86","64173  >  22 [SYN] Seq=0 Win=65535 Len=0 MSS=1460 WS=64 SACK_PERM TSval=2042503265 TSecr=0"
"2","0.019127","172.16.3.2","172.16.2.2","MPTCP","90","22  >  64173 [SYN, ACK, ECE] Seq=0 Ack=1 Win=65535 Len=0 MSS=1460 WS=64 TSval=3456884 TSecr=2042503265"
"3","0.019181","172.16.2.2","172.16.3.2","MPTCP","90","64173  >  22 [ACK] Seq=1 Ack=1 Win=65728 Len=0 TSval=2042503285 TSecr=3456884"
"4","0.038595","172.16.3.2","172.16.2.2","TCP","66","[TCP Window Update] 22  >  64173 [ACK] Seq=1 Ack=1 Win=65728 Len=0 TSval=3456903 TSecr=2042503285"
"5","0.038611","172.16.3.2","172.16.2.2","SSH","566","Server: Encrypted packet (len=484)"
"6","0.046411","172.16.3.2","172.16.2.2","MPTCP","74","22  >  64173 [ACK] Seq=485 Ack=1 Win=65728 Len=0 TSval=3456921 TSecr=2042503285"
"7","0.073303","172.16.2.2","172.16.3.2","TCP","66","64173  >  22 [ACK] Seq=1 Ack=485 Win=65728 Len=0 TSval=2042503344 TSecr=3456903"
"8","0.099290","172.16.3.2","172.16.2.2","SSH","126","Server: Encrypted packet (len=44)"
"9","0.118640","172.16.3.2","172.16.2.2","MPTCP","74","[TCP Dup ACK 2#1] 22  >  64173 [ACK] Seq=529 Ack=1 Win=65728 Len=0 TSval=3456989 TSecr=2042503344"
"10","0.131721","172.16.2.2","172.16.3.2","TCP","66","64173  >  22 [ACK] Seq=1 Ack=529 Win=65728 Len=0 TSval=2042503402 TSecr=3456966"
"11","0.148679","172.16.3.2","172.16.2.2","SSH","542","Server: Encrypted packet (len=460)"
"12","0.156843","172.16.3.2","172.16.2.2","MPTCP","74","[TCP Dup ACK 2#2] 22  >  64173 [ACK] Seq=989 Ack=1 Win=65728 Len=0 TSval=3457030 TSecr=2042503402"
"13","0.183919","172.16.2.2","172.16.3.2","TCP","66","64173  >  22 [ACK] Seq=1 Ack=989 Win=65728 Len=0 TSval=2042503455 TSecr=3457014"
"14","0.188892","172.16.3.2","172.16.2.2","SSH","854","Server: Encrypted packet (len=768)"
"15","0.223620","172.16.2.2","172.16.3.2","TCP","66","64173  >  22 [ACK] Seq=1 Ack=1757 Win=65728 Len=0 TSval=2042503494 TSecr=3457060"
"16","0.238624","172.16.3.2","172.16.2.2","SSH","154","Server: Encrypted packet (len=72)"
"17","0.240127","172.16.2.2","172.16.3.2","SSH","126","Client: Encrypted packet (len=44)"
"18","0.257830","172.16.3.2","172.16.2.2","TCP","66","22  >  64173 [ACK] Seq=1829 Ack=45 Win=65728 Len=0 TSval=3457124 TSecr=2042503503"
"19","0.257849","172.16.3.2","172.16.2.2","SSH","118","Server: Encrypted packet (len=36)"
"20","0.291749","172.16.2.2","172.16.3.2","TCP","66","64173  >  22 [ACK] Seq=45 Ack=1865 Win=65728 Len=0 TSval=2042503563 TSecr=3457124"
"21","0.308618","172.16.3.2","172.16.2.2","SSH","126","Server: Encrypted packet (len=44)"
"22","0.316726","172.16.3.2","172.16.2.2","MPTCP","74","[TCP Dup ACK 18#1] 22  >  64173 [ACK] Seq=1909 Ack=45 Win=65728 Len=0 TSval=3457191 TSecr=2042503563"
"23","0.328009","172.16.2.2","172.16.3.2","SSH","1514","Client: Encrypted packet (len=1432)"
"24","0.328024","172.16.2.2","172.16.3.2","SSH","1514","Client: Encrypted packet (len=1432)"
"25","0.328038","172.16.2.2","172.16.3.2","SSH","1514","Client: Encrypted packet (len=1432)"
"26","0.328050","172.16.2.2","172.16.3.2","SSH","1514","Client: Encrypted packet (len=1432)"
"27","0.328161","172.16.2.2","172.16.3.2","SSH","1514","Client: Encrypted packet (len=1432)"
"28","0.328190","172.16.2.2","172.16.3.2","SSH","1150","Client: Encrypted packet (len=1068)"
"29","0.348838","172.16.3.2","172.16.2.2","TCP","66","22  >  64173 [ACK] Seq=1909 Ack=1477 Win=65728 Len=0 TSval=3457213 TSecr=2042503592"
"30","0.348858","172.16.3.2","172.16.2.2","TCP","66","22  >  64173 [ACK] Seq=1909 Ack=4341 Win=65728 Len=0 TSval=3457213 TSecr=2042503592"
"31","0.348866","172.16.3.2","172.16.2.2","TCP","66","22  >  64173 [ACK] Seq=1909 Ack=7205 Win=65728 Len=0 TSval=3457213 TSecr=2042503592"
"32","0.348872","172.16.3.2","172.16.2.2","MPTCP","74","[TCP Dup ACK 31#1] 22  >  64173 [ACK] Seq=1909 Ack=7205 Win=65728 Len=0 TSval=3457213 TSecr=2042503592"
"33","0.356067","172.16.3.2","172.16.2.2","MPTCP","74","22  >  64173 [ACK] Seq=1909 Ack=8273 Win=65728 Len=0 TSval=3457224 TSecr=2042503592"
"34","0.378973","172.16.3.2","172.16.2.2","MPTCP","74","[TCP Dup ACK 33#1] 22  >  64173 [ACK] Seq=1909 Ack=8273 Win=65728 Len=0 TSval=3457250 TSecr=2042503592"
"35","0.387112","172.16.3.2","172.16.2.2","MPTCP","74","[TCP Dup ACK 33#2] 22  >  64173 [ACK] Seq=1909 Ack=8273 Win=65728 Len=0 TSval=3457261 TSecr=2042503592"
"36","0.398572","172.16.3.2","172.16.2.2","MPTCP","74","[TCP Dup ACK 33#3] 22  >  64173 [ACK] Seq=1909 Ack=8273 Win=65728 Len=0 TSval=3457265 TSecr=2042503592"
"37","0.418615","172.16.3.2","172.16.2.2","MPTCP","74","[TCP Dup ACK 33#4] 22  >  64173 [ACK] Seq=1909 Ack=8273 Win=65728 Len=0 TSval=3457290 TSecr=2042503592"
"38","0.438624","172.16.3.2","172.16.2.2","MPTCP","74","[TCP Dup ACK 33#5] 22  >  64173 [ACK] Seq=1909 Ack=8273 Win=65728 Len=0 TSval=3457311 TSecr=2042503592"
"39","0.458128","172.16.3.2","172.16.2.2","MPTCP","74","[TCP Dup ACK 33#6] 22  >  64173 [ACK] Seq=1909 Ack=8273 Win=65728 Len=0 TSval=3457325 TSecr=2042503592"
"40","0.478507","172.16.3.2","172.16.2.2","MPTCP","74","[TCP Dup ACK 33#7] 22  >  64173 [ACK] Seq=1909 Ack=8273 Win=65728 Len=0 TSval=3457350 TSecr=2042503592"
"41","0.496718","172.16.2.2","172.16.3.2","SSH","1514","Client: Encrypted packet (len=1432)"
"42","0.496754","172.16.2.2","172.16.3.2","SSH","1514","Client: Encrypted packet (len=1432)"
"43","0.496768","172.16.2.2","172.16.3.2","SSH","1006","Client: Encrypted packet (len=924)"
"44","0.498746","172.16.3.2","172.16.2.2","MPTCP","74","[TCP Dup ACK 33#8] 22  >  64173 [ACK] Seq=1909 Ack=8273 Win=65728 Len=0 TSval=3457365 TSecr=2042503592"
"45","0.499671","172.16.3.2","172.16.2.2","TCP","66","22  >  64173 [ACK] Seq=1909 Ack=11137 Win=65728 Len=0 TSval=3457375 TSecr=2042503763"
"46","0.505288","172.16.3.2","172.16.2.2","MPTCP","74","22  >  64173 [ACK] Seq=1909 Ack=12061 Win=65728 Len=0 TSval=3457375 TSecr=2042503763"
"47","0.528614","172.16.3.2","172.16.2.2","MPTCP","74","[TCP Dup ACK 46#1] 22  >  64173 [ACK] Seq=1909 Ack=12061 Win=65728 Len=0 TSval=3457400 TSecr=2042503763"
"48","0.535811","172.16.3.2","172.16.2.2","MPTCP","74","[TCP Dup ACK 46#2] 22  >  64173 [ACK] Seq=1909 Ack=12061 Win=65728 Len=0 TSval=3457406 TSecr=2042503763"
"49","0.558085","172.16.3.2","172.16.2.2","MPTCP","74","[TCP Dup ACK 46#3] 22  >  64173 [ACK] Seq=1909 Ack=12061 Win=65728 Len=0 TSval=3457430 TSecr=2042503763"
"50","0.578633","172.16.3.2","172.16.2.2","MPTCP","74","[TCP Dup ACK 46#4] 22  >  64173 [ACK] Seq=1909 Ack=12061 Win=65728 Len=0 TSval=3457446 TSecr=2042503763"
"51","0.585577","172.16.3.2","172.16.2.2","MPTCP","74","[TCP Dup ACK 46#5] 22  >  64173 [ACK] Seq=1909 Ack=12061 Win=65728 Len=0 TSval=3457461 TSecr=2042503763"
"52","0.618695","172.16.3.2","172.16.2.2","MPTCP","74","[TCP Dup ACK 46#6] 22  >  64173 [ACK] Seq=1909 Ack=12061 Win=65728 Len=0 TSval=3457491 TSecr=2042503763"
"53","0.638704","172.16.3.2","172.16.2.2","MPTCP","74","[TCP Dup ACK 46#7] 22  >  64173 [ACK] Seq=1909 Ack=12061 Win=65728 Len=0 TSval=3457505 TSecr=2042503763"
"54","0.668045","172.16.3.2","172.16.2.2","MPTCP","74","[TCP Dup ACK 46#8] 22  >  64173 [ACK] Seq=1909 Ack=12061 Win=65728 Len=0 TSval=3457541 TSecr=2042503763"
"55","0.689008","172.16.3.2","172.16.2.2","MPTCP","74","[TCP Dup ACK 46#9] 22  >  64173 [ACK] Seq=1909 Ack=12061 Win=65728 Len=0 TSval=3457560 TSecr=2042503763"
"56","0.707893","172.16.3.2","172.16.2.2","MPTCP","74","[TCP Dup ACK 46#10] 22  >  64173 [ACK] Seq=1909 Ack=12061 Win=65728 Len=0 TSval=3457581 TSecr=2042503763"
"57","0.729023","172.16.3.2","172.16.2.2","MPTCP","74","[TCP Dup ACK 46#11] 22  >  64173 [ACK] Seq=1909 Ack=12061 Win=65728 Len=0 TSval=3457600 TSecr=2042503763"
"58","0.748936","172.16.3.2","172.16.2.2","MPTCP","74","[TCP Dup ACK 46#12] 22  >  64173 [ACK] Seq=1909 Ack=12061 Win=65728 Len=0 TSval=3457620 TSecr=2042503763"
"59","0.768172","172.16.3.2","172.16.2.2","MPTCP","74","[TCP Dup ACK 46#13] 22  >  64173 [ACK] Seq=1909 Ack=12061 Win=65728 Len=0 TSval=3457640 TSecr=2042503763"
"60","0.788750","172.16.3.2","172.16.2.2","MPTCP","74","[TCP Dup ACK 46#14] 22  >  64173 [ACK] Seq=1909 Ack=12061 Win=65728 Len=0 TSval=3457655 TSecr=2042503763"
"61","0.807861","172.16.3.2","172.16.2.2","MPTCP","74","[TCP Dup ACK 46#15] 22  >  64173 [ACK] Seq=1909 Ack=12061 Win=65728 Len=0 TSval=3457680 TSecr=2042503763"
"62","0.828667","172.16.3.2","172.16.2.2","MPTCP","74","[TCP Dup ACK 46#16] 22  >  64173 [ACK] Seq=1909 Ack=12061 Win=65728 Len=0 TSval=3457700 TSecr=2042503763"
"63","0.849259","172.16.3.2","172.16.2.2","MPTCP","74","[TCP Dup ACK 46#17] 22  >  64173 [ACK] Seq=1909 Ack=12061 Win=65728 Len=0 TSval=3457721 TSecr=2042503763"
"64","0.855400","172.16.3.2","172.16.2.2","SSH","118","Server: Encrypted packet (len=36)"
"65","0.878254","172.16.3.2","172.16.2.2","MPTCP","74","[TCP Dup ACK 46#18] 22  >  64173 [ACK] Seq=1945 Ack=12061 Win=65728 Len=0 TSval=3457751 TSecr=2042503763"
"66","0.892605","172.16.2.2","172.16.3.2","TCP","66","64173  >  22 [ACK] Seq=12061 Ack=1945 Win=65728 Len=0 TSval=2042504163 TSecr=3457730"
"67","0.898552","172.16.3.2","172.16.2.2","MPTCP","74","[TCP Dup ACK 46#19] 22  >  64173 [ACK] Seq=1945 Ack=12061 Win=65728 Len=0 TSval=3457769 TSecr=2042503763"
"68","0.918100","172.16.3.2","172.16.2.2","MPTCP","74","[TCP Dup ACK 46#20] 22  >  64173 [ACK] Seq=1945 Ack=12061 Win=65728 Len=0 TSval=3457791 TSecr=2042504163"
"69","0.938770","172.16.3.2","172.16.2.2","MPTCP","74","[TCP Dup ACK 46#21] 22  >  64173 [ACK] Seq=1945 Ack=12061 Win=65728 Len=0 TSval=3457805 TSecr=2042504163"
"70","0.939737","172.16.2.2","172.16.3.2","SSH","1514","Client: Encrypted packet (len=1432)"
"71","0.939758","172.16.2.2","172.16.3.2","SSH","1514","Client: Encrypted packet (len=1432)"
"72","0.959078","172.16.3.2","172.16.2.2","TCP","66","22  >  64173 [ACK] Seq=1945 Ack=14925 Win=65728 Len=0 TSval=3457823 TSecr=2042504203"
"73","0.959089","172.16.3.2","172.16.2.2","MPTCP","74","[TCP Dup ACK 72#1] 22  >  64173 [ACK] Seq=1945 Ack=14925 Win=65728 Len=0 TSval=3457823 TSecr=2042504203"
"74","0.978676","172.16.3.2","172.16.2.2","MPTCP","74","[TCP Dup ACK 72#2] 22  >  64173 [ACK] Seq=1945 Ack=14925 Win=65728 Len=0 TSval=3457846 TSecr=2042504203"
"75","0.999022","172.16.3.2","172.16.2.2","MPTCP","74","[TCP Dup ACK 72#3] 22  >  64173 [ACK] Seq=1945 Ack=14925 Win=65728 Len=0 TSval=3457870 TSecr=2042504203"
"76","1.005617","172.16.3.2","172.16.2.2","MPTCP","74","[TCP Dup ACK 72#4] 22  >  64173 [ACK] Seq=1945 Ack=14925 Win=65728 Len=0 TSval=3457881 TSecr=2042504203"
"77","1.028563","172.16.3.2","172.16.2.2","MPTCP","74","[TCP Dup ACK 72#5] 22  >  64173 [ACK] Seq=1945 Ack=14925 Win=65728 Len=0 TSval=3457901 TSecr=2042504203"
"78","1.048821","172.16.3.2","172.16.2.2","MPTCP","74","[TCP Dup ACK 72#6] 22  >  64173 [ACK] Seq=1945 Ack=14925 Win=65728 Len=0 TSval=3457920 TSecr=2042504203"
"79","1.068654","172.16.3.2","172.16.2.2","MPTCP","74","[TCP Dup ACK 72#7] 22  >  64173 [ACK] Seq=1945 Ack=14925 Win=65728 Len=0 TSval=3457940 TSecr=2042504203"
"80","1.088701","172.16.3.2","172.16.2.2","MPTCP","74","[TCP Dup ACK 72#8] 22  >  64173 [ACK] Seq=1945 Ack=14925 Win=65728 Len=0 TSval=3457960 TSecr=2042504203"
"81","1.095713","172.16.3.2","172.16.2.2","MPTCP","74","[TCP Dup ACK 72#9] 22  >  64173 [ACK] Seq=1945 Ack=14925 Win=65728 Len=0 TSval=3457968 TSecr=2042504203"
"82","1.118819","172.16.3.2","172.16.2.2","MPTCP","74","[TCP Dup ACK 72#10] 22  >  64173 [ACK] Seq=1945 Ack=14925 Win=65728 Len=0 TSval=3457990 TSecr=2042504203"
"83","1.137661","172.16.3.2","172.16.2.2","MPTCP","74","[TCP Dup ACK 72#11] 22  >  64173 [ACK] Seq=1945 Ack=14925 Win=65728 Len=0 TSval=3458006 TSecr=2042504203"
"84","1.157817","172.16.3.2","172.16.2.2","MPTCP","74","[TCP Dup ACK 72#12] 22  >  64173 [ACK] Seq=1945 Ack=14925 Win=65728 Len=0 TSval=3458030 TSecr=2042504203"
"85","1.178283","172.16.3.2","172.16.2.2","MPTCP","74","[TCP Dup ACK 72#13] 22  >  64173 [ACK] Seq=1945 Ack=14925 Win=65728 Len=0 TSval=3458046 TSecr=2042504203"
"86","1.198166","172.16.3.2","172.16.2.2","MPTCP","74","[TCP Dup ACK 72#14] 22  >  64173 [ACK] Seq=1945 Ack=14925 Win=65728 Len=0 TSval=3458068 TSecr=2042504203"
"87","1.218666","172.16.3.2","172.16.2.2","MPTCP","74","[TCP Dup ACK 72#15] 22  >  64173 [ACK] Seq=1945 Ack=14925 Win=65728 Len=0 TSval=3458090 TSecr=2042504203"
"88","1.218689","172.16.3.2","172.16.2.2","SSH","118","Server: Encrypted packet (len=36)"
"89","1.238726","172.16.3.2","172.16.2.2","MPTCP","74","[TCP Dup ACK 72#16] 22  >  64173 [ACK] Seq=1981 Ack=14925 Win=65728 Len=0 TSval=3458106 TSecr=2042504203"
"90","1.253514","172.16.2.2","172.16.3.2","TCP","66","64173  >  22 [ACK] Seq=14925 Ack=1981 Win=65728 Len=0 TSval=2042504522 TSecr=3458090"
"91","1.258310","172.16.3.2","172.16.2.2","MPTCP","74","[TCP Dup ACK 72#17] 22  >  64173 [ACK] Seq=1981 Ack=14925 Win=65728 Len=0 TSval=3458130 TSecr=2042504203"
"92","1.279207","172.16.3.2","172.16.2.2","MPTCP","74","[TCP Dup ACK 72#18] 22  >  64173 [ACK] Seq=1981 Ack=14925 Win=65728 Len=0 TSval=3458145 TSecr=2042504522"
"93","1.298632","172.16.3.2","172.16.2.2","MPTCP","74","[TCP Dup ACK 72#19] 22  >  64173 [ACK] Seq=1981 Ack=14925 Win=65728 Len=0 TSval=3458170 TSecr=2042504522"
"94","1.317723","172.16.3.2","172.16.2.2","MPTCP","74","[TCP Dup ACK 72#20] 22  >  64173 [ACK] Seq=1981 Ack=14925 Win=65728 Len=0 TSval=3458191 TSecr=2042504522"
"95","1.317744","172.16.3.2","172.16.2.2","MPTCP","74","[TCP Dup ACK 72#21] 22  >  64173 [ACK] Seq=1981 Ack=14925 Win=65728 Len=0 TSval=3458191 TSecr=2042504522"
"96","1.338068","172.16.3.2","172.16.2.2","MPTCP","74","[TCP Dup ACK 72#22] 22  >  64173 [ACK] Seq=1981 Ack=14925 Win=65728 Len=0 TSval=3458205 TSecr=2042504522"
"97","1.358798","172.16.3.2","172.16.2.2","MPTCP","74","[TCP Dup ACK 72#23] 22  >  64173 [ACK] Seq=1981 Ack=14925 Win=65728 Len=0 TSval=3458230 TSecr=2042504522"
"98","1.366751","172.16.3.2","172.16.2.2","MPTCP","74","[TCP Dup ACK 72#24] 22  >  64173 [ACK] Seq=1981 Ack=14925 Win=65728 Len=0 TSval=3458240 TSecr=2042504522"
"99","1.388017","172.16.3.2","172.16.2.2","MPTCP","74","[TCP Dup ACK 72#25] 22  >  64173 [ACK] Seq=1981 Ack=14925 Win=65728 Len=0 TSval=3458260 TSecr=2042504522"
"100","1.409411","172.16.3.2","172.16.2.2","MPTCP","74","[TCP Dup ACK 72#26] 22  >  64173 [ACK] Seq=1981 Ack=14925 Win=65728 Len=0 TSval=3458281 TSecr=2042504522"
"101","1.429197","172.16.3.2","172.16.2.2","MPTCP","74","[TCP Dup ACK 72#27] 22  >  64173 [ACK] Seq=1981 Ack=14925 Win=65728 Len=0 TSval=3458301 TSecr=2042504522"
"102","1.448681","172.16.3.2","172.16.2.2","MPTCP","74","[TCP Dup ACK 72#28] 22  >  64173 [ACK] Seq=1981 Ack=14925 Win=65728 Len=0 TSval=3458321 TSecr=2042504522"
"103","1.467643","172.16.3.2","172.16.2.2","MPTCP","74","[TCP Dup ACK 72#29] 22  >  64173 [ACK] Seq=1981 Ack=14925 Win=65728 Len=0 TSval=3458340 TSecr=2042504522"
"104","1.488681","172.16.3.2","172.16.2.2","MPTCP","74","[TCP Dup ACK 72#30] 22  >  64173 [ACK] Seq=1981 Ack=14925 Win=65728 Len=0 TSval=3458360 TSecr=2042504522"
"105","1.508163","172.16.3.2","172.16.2.2","MPTCP","74","[TCP Dup ACK 72#31] 22  >  64173 [ACK] Seq=1981 Ack=14925 Win=65728 Len=0 TSval=3458380 TSecr=2042504522"
"106","1.538432","172.16.3.2","172.16.2.2","MPTCP","74","[TCP Dup ACK 72#32] 22  >  64173 [ACK] Seq=1981 Ack=14925 Win=65728 Len=0 TSval=3458405 TSecr=2042504522"
"107","1.558851","172.16.3.2","172.16.2.2","MPTCP","74","[TCP Dup ACK 72#33] 22  >  64173 [ACK] Seq=1981 Ack=14925 Win=65728 Len=0 TSval=3458430 TSecr=2042504522"
"108","1.578215","172.16.3.2","172.16.2.2","MPTCP","74","[TCP Dup ACK 72#34] 22  >  64173 [ACK] Seq=1981 Ack=14925 Win=65728 Len=0 TSval=3458445 TSecr=2042504522"
"109","1.586338","172.16.3.2","172.16.2.2","MPTCP","74","[TCP Dup ACK 72#35] 22  >  64173 [ACK] Seq=1981 Ack=14925 Win=65728 Len=0 TSval=3458461 TSecr=2042504522"
"110","1.607477","172.16.3.2","172.16.2.2","MPTCP","74","[TCP Dup ACK 72#36] 22  >  64173 [ACK] Seq=1981 Ack=14925 Win=65728 Len=0 TSval=3458480 TSecr=2042504522"
"111","1.616395","172.16.3.2","172.16.2.2","MPTCP","74","[TCP Dup ACK 72#37] 22  >  64173 [ACK] Seq=1981 Ack=14925 Win=65728 Len=0 TSval=3458490 TSecr=2042504522"
"112","1.617230","172.16.2.2","172.16.3.2","SSH","1514","Client: Encrypted packet (len=1432)"
"113","1.617267","172.16.2.2","172.16.3.2","SSH","1514","Client: Encrypted packet (len=1432)"
"114","1.617279","172.16.2.2","172.16.3.2","SSH","1514","Client: Encrypted packet (len=1432)"
"115","1.637923","172.16.3.2","172.16.2.2","TCP","66","22  >  64173 [ACK] Seq=1981 Ack=17789 Win=65728 Len=0 TSval=3458504 TSecr=2042504884"
"116","1.637943","172.16.3.2","172.16.2.2","MPTCP","74","22  >  64173 [ACK] Seq=1981 Ack=19221 Win=65728 Len=0 TSval=3458504 TSecr=2042504884"
"117","1.657849","172.16.3.2","172.16.2.2","MPTCP","74","[TCP Dup ACK 116#1] 22  >  64173 [ACK] Seq=1981 Ack=19221 Win=65728 Len=0 TSval=3458525 TSecr=2042504884"
"118","1.666991","172.16.3.2","172.16.2.2","MPTCP","74","[TCP Dup ACK 116#2] 22  >  64173 [ACK] Seq=1981 Ack=19221 Win=65728 Len=0 TSval=3458541 TSecr=2042504884"
"119","1.689280","172.16.3.2","172.16.2.2","MPTCP","74","[TCP Dup ACK 116#3] 22  >  64173 [ACK] Seq=1981 Ack=19221 Win=65728 Len=0 TSval=3458560 TSecr=2042504884"
"120","1.696259","172.16.3.2","172.16.2.2","MPTCP","74","[TCP Dup ACK 116#4] 22  >  64173 [ACK] Seq=1981 Ack=19221 Win=65728 Len=0 TSval=3458566 TSecr=2042504884"
"121","1.717739","172.16.3.2","172.16.2.2","MPTCP","74","[TCP Dup ACK 116#5] 22  >  64173 [ACK] Seq=1981 Ack=19221 Win=65728 Len=0 TSval=3458590 TSecr=2042504884"
"122","1.738629","172.16.3.2","172.16.2.2","MPTCP","74","[TCP Dup ACK 116#6] 22  >  64173 [ACK] Seq=1981 Ack=19221 Win=65728 Len=0 TSval=3458610 TSecr=2042504884"
"123","1.758242","172.16.3.2","172.16.2.2","MPTCP","74","[TCP Dup ACK 116#7] 22  >  64173 [ACK] Seq=1981 Ack=19221 Win=65728 Len=0 TSval=3458625 TSecr=2042504884"
"124","1.778783","172.16.3.2","172.16.2.2","MPTCP","74","[TCP Dup ACK 116#8] 22  >  64173 [ACK] Seq=1981 Ack=19221 Win=65728 Len=0 TSval=3458650 TSecr=2042504884"
"125","1.798744","172.16.3.2","172.16.2.2","MPTCP","74","[TCP Dup ACK 116#9] 22  >  64173 [ACK] Seq=1981 Ack=19221 Win=65728 Len=0 TSval=3458666 TSecr=2042504884"
"126","1.817260","172.16.2.2","172.16.3.2","SSH","1514","Client: Encrypted packet (len=1432)"
"127","1.817295","172.16.2.2","172.16.3.2","SSH","1514","Client: Encrypted packet (len=1432)"
"128","1.817308","172.16.2.2","172.16.3.2","SSH","1514","Client: Encrypted packet (len=1432)"
"129","1.817739","172.16.3.2","172.16.2.2","MPTCP","74","[TCP Dup ACK 116#10] 22  >  64173 [ACK] Seq=1981 Ack=19221 Win=65728 Len=0 TSval=3458690 TSecr=2042504884"
"130","1.825920","172.16.3.2","172.16.2.2","MPTCP","74","[TCP Dup ACK 116#11] 22  >  64173 [ACK] Seq=1981 Ack=19221 Win=65728 Len=0 TSval=3458700 TSecr=2042504884"
"131","1.838449","172.16.3.2","172.16.2.2","TCP","66","22  >  64173 [ACK] Seq=1981 Ack=22085 Win=65728 Len=0 TSval=3458703 TSecr=2042505084"
"132","1.845556","172.16.3.2","172.16.2.2","MPTCP","74","22  >  64173 [ACK] Seq=1981 Ack=23517 Win=65728 Len=0 TSval=3458719 TSecr=2042505084"
"133","1.868793","172.16.3.2","172.16.2.2","MPTCP","74","[TCP Dup ACK 132#1] 22  >  64173 [ACK] Seq=1981 Ack=23517 Win=65728 Len=0 TSval=3458735 TSecr=2042505084"
"134","1.888808","172.16.3.2","172.16.2.2","MPTCP","74","[TCP Dup ACK 132#2] 22  >  64173 [ACK] Seq=1981 Ack=23517 Win=65728 Len=0 TSval=3458761 TSecr=2042505084"
"135","1.908642","172.16.3.2","172.16.2.2","MPTCP","74","[TCP Dup ACK 132#3] 22  >  64173 [ACK] Seq=1981 Ack=23517 Win=65728 Len=0 TSval=3458775 TSecr=2042505084"
"136","1.928649","172.16.3.2","172.16.2.2","MPTCP","74","[TCP Dup ACK 132#4] 22  >  64173 [ACK] Seq=1981 Ack=23517 Win=65728 Len=0 TSval=3458800 TSecr=2042505084"
"137","1.936275","172.16.3.2","172.16.2.2","MPTCP","74","[TCP Dup ACK 132#5] 22  >  64173 [ACK] Seq=1981 Ack=23517 Win=65728 Len=0 TSval=3458811 TSecr=2042505084"
"138","1.949039","172.16.3.2","172.16.2.2","MPTCP","74","[TCP Dup ACK 132#6] 22  >  64173 [ACK] Seq=1981 Ack=23517 Win=65728 Len=0 TSval=3458815 TSecr=2042505084"
"139","1.968661","172.16.3.2","172.16.2.2","MPTCP","74","[TCP Dup ACK 132#7] 22  >  64173 [ACK] Seq=1981 Ack=23517 Win=65728 Len=0 TSval=3458840 TSecr=2042505084"
"140","1.987711","172.16.3.2","172.16.2.2","MPTCP","74","[TCP Dup ACK 132#8] 22  >  64173 [ACK] Seq=1981 Ack=23517 Win=65728 Len=0 TSval=3458855 TSecr=2042505084"
"141","2.007941","172.16.3.2","172.16.2.2","MPTCP","74","[TCP Dup ACK 132#9] 22  >  64173 [ACK] Seq=1981 Ack=23517 Win=65728 Len=0 TSval=3458881 TSecr=2042505084"
"142","2.014717","172.16.3.2","172.16.2.2","MPTCP","74","[TCP Dup ACK 132#10] 22  >  64173 [ACK] Seq=1981 Ack=23517 Win=65728 Len=0 TSval=3458890 TSecr=2042505084"
"143","2.028085","172.16.3.2","172.16.2.2","MPTCP","74","[TCP Dup ACK 132#11] 22  >  64173 [ACK] Seq=1981 Ack=23517 Win=65728 Len=0 TSval=3458895 TSecr=2042505084"
"144","2.048244","172.16.3.2","172.16.2.2","MPTCP","74","[TCP Dup ACK 132#12] 22  >  64173 [ACK] Seq=1981 Ack=23517 Win=65728 Len=0 TSval=3458919 TSecr=2042505084"
"145","2.068264","172.16.3.2","172.16.2.2","MPTCP","74","[TCP Dup ACK 132#13] 22  >  64173 [ACK] Seq=1981 Ack=23517 Win=65728 Len=0 TSval=3458936 TSecr=2042505084"
"146","2.076201","172.16.2.2","172.16.3.2","SSH","1514","Client: Encrypted packet (len=1432)"
"147","2.076235","172.16.2.2","172.16.3.2","SSH","1514","Client: Encrypted packet (len=1432)"
"148","2.087865","172.16.3.2","172.16.2.2","TCP","66","22  >  64173 [ACK] Seq=1981 Ack=26381 Win=65728 Len=0 TSval=3458954 TSecr=2042505343"
"149","2.087884","172.16.3.2","172.16.2.2","MPTCP","74","[TCP Dup ACK 148#1] 22  >  64173 [ACK] Seq=1981 Ack=26381 Win=65728 Len=0 TSval=3458954 TSecr=2042505343"
"150","2.096036","172.16.3.2","172.16.2.2","MPTCP","74","[TCP Dup ACK 148#2] 22  >  64173 [ACK] Seq=1981 Ack=26381 Win=65728 Len=0 TSval=3458969 TSecr=2042505343"
"151","2.118531","172.16.3.2","172.16.2.2","MPTCP","74","[TCP Dup ACK 148#3] 22  >  64173 [ACK] Seq=1981 Ack=26381 Win=65728 Len=0 TSval=3458991 TSecr=2042505343"
"152","2.137699","172.16.3.2","172.16.2.2","MPTCP","74","[TCP Dup ACK 148#4] 22  >  64173 [ACK] Seq=1981 Ack=26381 Win=65728 Len=0 TSval=3459006 TSecr=2042505343"
"153","2.158591","172.16.3.2","172.16.2.2","MPTCP","74","[TCP Dup ACK 148#5] 22  >  64173 [ACK] Seq=1981 Ack=26381 Win=65728 Len=0 TSval=3459030 TSecr=2042505343"
"154","2.185514","172.16.3.2","172.16.2.2","MPTCP","74","[TCP Dup ACK 148#6] 22  >  64173 [ACK] Seq=1981 Ack=26381 Win=65728 Len=0 TSval=3459046 TSecr=2042505343"
"155","2.198934","172.16.3.2","172.16.2.2","MPTCP","74","[TCP Dup ACK 148#7] 22  >  64173 [ACK] Seq=1981 Ack=26381 Win=65728 Len=0 TSval=3459069 TSecr=2042505343"
"156","2.218333","172.16.3.2","172.16.2.2","MPTCP","74","[TCP Dup ACK 148#8] 22  >  64173 [ACK] Seq=1981 Ack=26381 Win=65728 Len=0 TSval=3459085 TSecr=2042505343"
"157","2.224903","172.16.3.2","172.16.2.2","MPTCP","74","[TCP Dup ACK 148#9] 22  >  64173 [ACK] Seq=1981 Ack=26381 Win=65728 Len=0 TSval=3459100 TSecr=2042505343"
"158","2.248367","172.16.3.2","172.16.2.2","MPTCP","74","[TCP Dup ACK 148#10] 22  >  64173 [ACK] Seq=1981 Ack=26381 Win=65728 Len=0 TSval=3459120 TSecr=2042505343"
"159","2.268756","172.16.3.2","172.16.2.2","MPTCP","74","[TCP Dup ACK 148#11] 22  >  64173 [ACK] Seq=1981 Ack=26381 Win=65728 Len=0 TSval=3459140 TSecr=2042505343"
"160","2.288309","172.16.3.2","172.16.2.2","MPTCP","74","[TCP Dup ACK 148#12] 22  >  64173 [ACK] Seq=1981 Ack=26381 Win=65728 Len=0 TSval=3459156 TSecr=2042505343"
"161","2.288341","172.16.3.2","172.16.2.2","SSH","118","Server: Encrypted packet (len=36)"
"162","2.308804","172.16.3.2","172.16.2.2","MPTCP","74","[TCP Dup ACK 148#13] 22  >  64173 [ACK] Seq=2017 Ack=26381 Win=65728 Len=0 TSval=3459180 TSecr=2042505343"
"163","2.323829","172.16.2.2","172.16.3.2","TCP","66","64173  >  22 [ACK] Seq=26381 Ack=2017 Win=65728 Len=0 TSval=2042505592 TSecr=3459156"
"164","2.329151","172.16.3.2","172.16.2.2","MPTCP","74","[TCP Dup ACK 148#14] 22  >  64173 [ACK] Seq=2017 Ack=26381 Win=65728 Len=0 TSval=3459199 TSecr=2042505343"
"165","2.347881","172.16.3.2","172.16.2.2","MPTCP","74","[TCP Dup ACK 148#15] 22  >  64173 [ACK] Seq=2017 Ack=26381 Win=65728 Len=0 TSval=3459220 TSecr=2042505592"
"166","2.356685","172.16.3.2","172.16.2.2","MPTCP","74","[TCP Dup ACK 148#16] 22  >  64173 [ACK] Seq=2017 Ack=26381 Win=65728 Len=0 TSval=3459231 TSecr=2042505592"
"167","2.369391","172.16.3.2","172.16.2.2","MPTCP","74","[TCP Dup ACK 148#17] 22  >  64173 [ACK] Seq=2017 Ack=26381 Win=65728 Len=0 TSval=3459240 TSecr=2042505592"
"168","2.375582","172.16.3.2","172.16.2.2","MPTCP","74","[TCP Dup ACK 148#18] 22  >  64173 [ACK] Seq=2017 Ack=26381 Win=65728 Len=0 TSval=3459251 TSecr=2042505592"
"169","2.398642","172.16.3.2","172.16.2.2","MPTCP","74","[TCP Dup ACK 148#19] 22  >  64173 [ACK] Seq=2017 Ack=26381 Win=65728 Len=0 TSval=3459268 TSecr=2042505592"
"170","2.406037","172.16.3.2","172.16.2.2","MPTCP","74","[TCP Dup ACK 148#20] 22  >  64173 [ACK] Seq=2017 Ack=26381 Win=65728 Len=0 TSval=3459280 TSecr=2042505592"
"171","2.428673","172.16.3.2","172.16.2.2","MPTCP","74","[TCP Dup ACK 148#21] 22  >  64173 [ACK] Seq=2017 Ack=26381 Win=65728 Len=0 TSval=3459300 TSecr=2042505592"
"172","2.435831","172.16.3.2","172.16.2.2","MPTCP","74","[TCP Dup ACK 148#22] 22  >  64173 [ACK] Seq=2017 Ack=26381 Win=65728 Len=0 TSval=3459306 TSecr=2042505592"
"173","2.458899","172.16.3.2","172.16.2.2","MPTCP","74","[TCP Dup ACK 148#23] 22  >  64173 [ACK] Seq=2017 Ack=26381 Win=65728 Len=0 TSval=3459330 TSecr=2042505592"
"174","2.478524","172.16.3.2","172.16.2.2","MPTCP","74","[TCP Dup ACK 148#24] 22  >  64173 [ACK] Seq=2017 Ack=26381 Win=65728 Len=0 TSval=3459346 TSecr=2042505592"
"175","2.497935","172.16.3.2","172.16.2.2","MPTCP","74","[TCP Dup ACK 148#25] 22  >  64173 [ACK] Seq=2017 Ack=26381 Win=65728 Len=0 TSval=3459369 TSecr=2042505592"
"176","2.505563","172.16.3.2","172.16.2.2","MPTCP","74","[TCP Dup ACK 148#26] 22  >  64173 [ACK] Seq=2017 Ack=26381 Win=65728 Len=0 TSval=3459380 TSecr=2042505592"
"177","2.528705","172.16.3.2","172.16.2.2","MPTCP","74","[TCP Dup ACK 148#27] 22  >  64173 [ACK] Seq=2017 Ack=26381 Win=65728 Len=0 TSval=3459399 TSecr=2042505592"
"178","2.548171","172.16.3.2","172.16.2.2","MPTCP","74","[TCP Dup ACK 148#28] 22  >  64173 [ACK] Seq=2017 Ack=26381 Win=65728 Len=0 TSval=3459420 TSecr=2042505592"
"179","2.568816","172.16.3.2","172.16.2.2","MPTCP","74","[TCP Dup ACK 148#29] 22  >  64173 [ACK] Seq=2017 Ack=26381 Win=65728 Len=0 TSval=3459440 TSecr=2042505592"
"180","2.576878","172.16.3.2","172.16.2.2","MPTCP","74","[TCP Dup ACK 148#30] 22  >  64173 [ACK] Seq=2017 Ack=26381 Win=65728 Len=0 TSval=3459445 TSecr=2042505592"
"181","2.597683","172.16.3.2","172.16.2.2","MPTCP","74","[TCP Dup ACK 148#31] 22  >  64173 [ACK] Seq=2017 Ack=26381 Win=65728 Len=0 TSval=3459469 TSecr=2042505592"
"182","2.618725","172.16.3.2","172.16.2.2","MPTCP","74","[TCP Dup ACK 148#32] 22  >  64173 [ACK] Seq=2017 Ack=26381 Win=65728 Len=0 TSval=3459490 TSecr=2042505592"
"183","2.638776","172.16.3.2","172.16.2.2","MPTCP","74","[TCP Dup ACK 148#33] 22  >  64173 [ACK] Seq=2017 Ack=26381 Win=65728 Len=0 TSval=3459509 TSecr=2042505592"
"184","2.645895","172.16.3.2","172.16.2.2","SSH","118","Server: Encrypted packet (len=36)"
"185","2.668285","172.16.3.2","172.16.2.2","MPTCP","74","[TCP Dup ACK 148#34] 22  >  64173 [ACK] Seq=2053 Ack=26381 Win=65728 Len=0 TSval=3459541 TSecr=2042505592"
"186","2.682932","172.16.2.2","172.16.3.2","TCP","66","64173  >  22 [ACK] Seq=26381 Ack=2053 Win=65728 Len=0 TSval=2042505954 TSecr=3459520"
"187","2.688973","172.16.3.2","172.16.2.2","MPTCP","74","[TCP Dup ACK 148#35] 22  >  64173 [ACK] Seq=2053 Ack=26381 Win=65728 Len=0 TSval=3459561 TSecr=2042505592"
"188","2.708208","172.16.3.2","172.16.2.2","MPTCP","74","[TCP Dup ACK 148#36] 22  >  64173 [ACK] Seq=2053 Ack=26381 Win=65728 Len=0 TSval=3459580 TSecr=2042505954"
"189","2.728614","172.16.3.2","172.16.2.2","MPTCP","74","[TCP Dup ACK 148#37] 22  >  64173 [ACK] Seq=2053 Ack=26381 Win=65728 Len=0 TSval=3459600 TSecr=2042505954"
"190","2.735735","172.16.3.2","172.16.2.2","MPTCP","74","[TCP Dup ACK 148#38] 22  >  64173 [ACK] Seq=2053 Ack=26381 Win=65728 Len=0 TSval=3459606 TSecr=2042505954"
"191","2.757737","172.16.3.2","172.16.2.2","MPTCP","74","[TCP Dup ACK 148#39] 22  >  64173 [ACK] Seq=2053 Ack=26381 Win=65728 Len=0 TSval=3459630 TSecr=2042505954"
"192","2.778490","172.16.3.2","172.16.2.2","MPTCP","74","[TCP Dup ACK 148#40] 22  >  64173 [ACK] Seq=2053 Ack=26381 Win=65728 Len=0 TSval=3459646 TSecr=2042505954"
"193","2.797690","172.16.3.2","172.16.2.2","MPTCP","74","[TCP Dup ACK 148#41] 22  >  64173 [ACK] Seq=2053 Ack=26381 Win=65728 Len=0 TSval=3459669 TSecr=2042505954"
"194","2.805369","172.16.3.2","172.16.2.2","MPTCP","74","[TCP Dup ACK 148#42] 22  >  64173 [ACK] Seq=2053 Ack=26381 Win=65728 Len=0 TSval=3459680 TSecr=2042505954"
"195","2.828400","172.16.3.2","172.16.2.2","MPTCP","74","[TCP Dup ACK 148#43] 22  >  64173 [ACK] Seq=2053 Ack=26381 Win=65728 Len=0 TSval=3459701 TSecr=2042505954"
"196","2.848051","172.16.3.2","172.16.2.2","MPTCP","74","[TCP Dup ACK 148#44] 22  >  64173 [ACK] Seq=2053 Ack=26381 Win=65728 Len=0 TSval=3459720 TSecr=2042505954"
"197","2.869206","172.16.3.2","172.16.2.2","MPTCP","74","[TCP Dup ACK 148#45] 22  >  64173 [ACK] Seq=2053 Ack=26381 Win=65728 Len=0 TSval=3459741 TSecr=2042505954"
"198","2.889427","172.16.3.2","172.16.2.2","MPTCP","74","[TCP Dup ACK 148#46] 22  >  64173 [ACK] Seq=2053 Ack=26381 Win=65728 Len=0 TSval=3459760 TSecr=2042505954"
"199","2.908283","172.16.3.2","172.16.2.2","MPTCP","74","[TCP Dup ACK 148#47] 22  >  64173 [ACK] Seq=2053 Ack=26381 Win=65728 Len=0 TSval=3459779 TSecr=2042505954"
"200","2.928653","172.16.3.2","172.16.2.2","MPTCP","74","[TCP Dup ACK 148#48] 22  >  64173 [ACK] Seq=2053 Ack=26381 Win=65728 Len=0 TSval=3459800 TSecr=2042505954"
"201","2.947757","172.16.3.2","172.16.2.2","MPTCP","74","[TCP Dup ACK 148#49] 22  >  64173 [ACK] Seq=2053 Ack=26381 Win=65728 Len=0 TSval=3459820 TSecr=2042505954"
"202","2.977894","172.16.3.2","172.16.2.2","MPTCP","74","[TCP Dup ACK 148#50] 22  >  64173 [ACK] Seq=2053 Ack=26381 Win=65728 Len=0 TSval=3459846 TSecr=2042505954"
"203","2.998005","172.16.3.2","172.16.2.2","MPTCP","74","[TCP Dup ACK 148#51] 22  >  64173 [ACK] Seq=2053 Ack=26381 Win=65728 Len=0 TSval=3459869 TSecr=2042505954"
"204","3.005640","172.16.3.2","172.16.2.2","MPTCP","74","[TCP Dup ACK 148#52] 22  >  64173 [ACK] Seq=2053 Ack=26381 Win=65728 Len=0 TSval=3459880 TSecr=2042505954"
"205","3.018975","172.16.3.2","172.16.2.2","SSH","118","Server: Encrypted packet (len=36)"
"206","3.038631","172.16.3.2","172.16.2.2","MPTCP","74","[TCP Dup ACK 148#53] 22  >  64173 [ACK] Seq=2089 Ack=26381 Win=65728 Len=0 TSval=3459906 TSecr=2042505954"
"207","3.052909","172.16.2.2","172.16.3.2","TCP","66","64173  >  22 [ACK] Seq=26381 Ack=2089 Win=65728 Len=0 TSval=2042506324 TSecr=3459890"
"208","3.057699","172.16.3.2","172.16.2.2","MPTCP","74","[TCP Dup ACK 148#54] 22  >  64173 [ACK] Seq=2089 Ack=26381 Win=65728 Len=0 TSval=3459931 TSecr=2042505954"
"209","3.078205","172.16.3.2","172.16.2.2","MPTCP","74","[TCP Dup ACK 148#55] 22  >  64173 [ACK] Seq=2089 Ack=26381 Win=65728 Len=0 TSval=3459945 TSecr=2042506324"
"210","3.099010","172.16.3.2","172.16.2.2","MPTCP","74","[TCP Dup ACK 148#56] 22  >  64173 [ACK] Seq=2089 Ack=26381 Win=65728 Len=0 TSval=3459969 TSecr=2042506324"
"211","3.137660","172.16.3.2","172.16.2.2","MPTCP","74","[TCP Dup ACK 148#57] 22  >  64173 [ACK] Seq=2089 Ack=26381 Win=65728 Len=0 TSval=3460006 TSecr=2042506324"
"212","3.158620","172.16.3.2","172.16.2.2","MPTCP","74","[TCP Dup ACK 148#58] 22  >  64173 [ACK] Seq=2089 Ack=26381 Win=65728 Len=0 TSval=3460030 TSecr=2042506324"
"213","3.179140","172.16.3.2","172.16.2.2","MPTCP","74","[TCP Dup ACK 148#59] 22  >  64173 [ACK] Seq=2089 Ack=26381 Win=65728 Len=0 TSval=3460046 TSecr=2042506324"
"214","3.185313","172.16.3.2","172.16.2.2","MPTCP","74","[TCP Dup ACK 148#60] 22  >  64173 [ACK] Seq=2089 Ack=26381 Win=65728 Len=0 TSval=3460060 TSecr=2042506324"
"215","3.207893","172.16.3.2","172.16.2.2","MPTCP","74","[TCP Dup ACK 148#61] 22  >  64173 [ACK] Seq=2089 Ack=26381 Win=65728 Len=0 TSval=3460080 TSecr=2042506324"
"216","3.228094","172.16.3.2","172.16.2.2","MPTCP","74","[TCP Dup ACK 148#62] 22  >  64173 [ACK] Seq=2089 Ack=26381 Win=65728 Len=0 TSval=3460100 TSecr=2042506324"
"217","3.248408","172.16.3.2","172.16.2.2","MPTCP","74","[TCP Dup ACK 148#63] 22  >  64173 [ACK] Seq=2089 Ack=26381 Win=65728 Len=0 TSval=3460120 TSecr=2042506324"
"218","3.267754","172.16.3.2","172.16.2.2","MPTCP","74","[TCP Dup ACK 148#64] 22  >  64173 [ACK] Seq=2089 Ack=26381 Win=65728 Len=0 TSval=3460136 TSecr=2042506324"
"219","3.288526","172.16.3.2","172.16.2.2","MPTCP","74","[TCP Dup ACK 148#65] 22  >  64173 [ACK] Seq=2089 Ack=26381 Win=65728 Len=0 TSval=3460161 TSecr=2042506324"
"220","3.295989","172.16.2.2","172.16.3.2","SSH","1514","Client: Encrypted packet (len=1432)"
"221","3.296019","172.16.2.2","172.16.3.2","SSH","1514","Client: Encrypted packet (len=1432)"
"222","3.309681","172.16.3.2","172.16.2.2","TCP","66","22  >  64173 [ACK] Seq=2089 Ack=29245 Win=65728 Len=0 TSval=3460174 TSecr=2042506562"
"223","3.309700","172.16.3.2","172.16.2.2","MPTCP","74","[TCP Dup ACK 222#1] 22  >  64173 [ACK] Seq=2089 Ack=29245 Win=65728 Len=0 TSval=3460174 TSecr=2042506562"
"224","3.328134","172.16.3.2","172.16.2.2","MPTCP","74","[TCP Dup ACK 222#2] 22  >  64173 [ACK] Seq=2089 Ack=29245 Win=65728 Len=0 TSval=3460195 TSecr=2042506562"
"225","3.348762","172.16.3.2","172.16.2.2","MPTCP","74","[TCP Dup ACK 222#3] 22  >  64173 [ACK] Seq=2089 Ack=29245 Win=65728 Len=0 TSval=3460220 TSecr=2042506562"
"226","3.354673","172.16.3.2","172.16.2.2","MPTCP","74","[TCP Dup ACK 222#4] 22  >  64173 [ACK] Seq=2089 Ack=29245 Win=65728 Len=0 TSval=3460229 TSecr=2042506562"
"227","3.378295","172.16.3.2","172.16.2.2","MPTCP","74","[TCP Dup ACK 222#5] 22  >  64173 [ACK] Seq=2089 Ack=29245 Win=65728 Len=0 TSval=3460249 TSecr=2042506562"
"228","3.397776","172.16.3.2","172.16.2.2","MPTCP","74","[TCP Dup ACK 222#6] 22  >  64173 [ACK] Seq=2089 Ack=29245 Win=65728 Len=0 TSval=3460270 TSecr=2042506562"
"229","3.418673","172.16.3.2","172.16.2.2","MPTCP","74","[TCP Dup ACK 222#7] 22  >  64173 [ACK] Seq=2089 Ack=29245 Win=65728 Len=0 TSval=3460290 TSecr=2042506562"
"230","3.438878","172.16.3.2","172.16.2.2","MPTCP","74","[TCP Dup ACK 222#8] 22  >  64173 [ACK] Seq=2089 Ack=29245 Win=65728 Len=0 TSval=3460305 TSecr=2042506562"
"231","3.446442","172.16.3.2","172.16.2.2","MPTCP","74","[TCP Dup ACK 222#9] 22  >  64173 [ACK] Seq=2089 Ack=29245 Win=65728 Len=0 TSval=3460320 TSecr=2042506562"
"232","3.477519","172.16.3.2","172.16.2.2","MPTCP","74","[TCP Dup ACK 222#10] 22  >  64173 [ACK] Seq=2089 Ack=29245 Win=65728 Len=0 TSval=3460345 TSecr=2042506562"
"233","3.498712","172.16.3.2","172.16.2.2","MPTCP","74","[TCP Dup ACK 222#11] 22  >  64173 [ACK] Seq=2089 Ack=29245 Win=65728 Len=0 TSval=3460368 TSecr=2042506562"
"234","3.505627","172.16.3.2","172.16.2.2","MPTCP","74","[TCP Dup ACK 222#12] 22  >  64173 [ACK] Seq=2089 Ack=29245 Win=65728 Len=0 TSval=3460379 TSecr=2042506562"
"235","3.528717","172.16.3.2","172.16.2.2","MPTCP","74","[TCP Dup ACK 222#13] 22  >  64173 [ACK] Seq=2089 Ack=29245 Win=65728 Len=0 TSval=3460400 TSecr=2042506562"
"236","3.548343","172.16.3.2","172.16.2.2","MPTCP","74","[TCP Dup ACK 222#14] 22  >  64173 [ACK] Seq=2089 Ack=29245 Win=65728 Len=0 TSval=3460421 TSecr=2042506562"
"237","3.568476","172.16.3.2","172.16.2.2","MPTCP","74","[TCP Dup ACK 222#15] 22  >  64173 [ACK] Seq=2089 Ack=29245 Win=65728 Len=0 TSval=3460435 TSecr=2042506562"
"238","3.588506","172.16.3.2","172.16.2.2","MPTCP","74","[TCP Dup ACK 222#16] 22  >  64173 [ACK] Seq=2089 Ack=29245 Win=65728 Len=0 TSval=3460459 TSecr=2042506562"
"239","3.595157","172.16.3.2","172.16.2.2","MPTCP","74","[TCP Dup ACK 222#17] 22  >  64173 [ACK] Seq=2089 Ack=29245 Win=65728 Len=0 TSval=3460468 TSecr=2042506562"
"240","3.617721","172.16.3.2","172.16.2.2","MPTCP","74","[TCP Dup ACK 222#18] 22  >  64173 [ACK] Seq=2089 Ack=29245 Win=65728 Len=0 TSval=3460490 TSecr=2042506562"
"241","3.638619","172.16.3.2","172.16.2.2","MPTCP","74","[TCP Dup ACK 222#19] 22  >  64173 [ACK] Seq=2089 Ack=29245 Win=65728 Len=0 TSval=3460505 TSecr=2042506562"
"242","3.645223","172.16.3.2","172.16.2.2","MPTCP","74","[TCP Dup ACK 222#20] 22  >  64173 [ACK] Seq=2089 Ack=29245 Win=65728 Len=0 TSval=3460520 TSecr=2042506562"
"243","3.668814","172.16.3.2","172.16.2.2","MPTCP","74","[TCP Dup ACK 222#21] 22  >  64173 [ACK] Seq=2089 Ack=29245 Win=65728 Len=0 TSval=3460540 TSecr=2042506562"
"244","3.688722","172.16.3.2","172.16.2.2","MPTCP","74","[TCP Dup ACK 222#22] 22  >  64173 [ACK] Seq=2089 Ack=29245 Win=65728 Len=0 TSval=3460560 TSecr=2042506562"
"245","3.708432","172.16.3.2","172.16.2.2","MPTCP","74","[TCP Dup ACK 222#23] 22  >  64173 [ACK] Seq=2089 Ack=29245 Win=65728 Len=0 TSval=3460580 TSecr=2042506562"
"246","3.715616","172.16.3.2","172.16.2.2","MPTCP","74","[TCP Dup ACK 222#24] 22  >  64173 [ACK] Seq=2089 Ack=29245 Win=65728 Len=0 TSval=3460590 TSecr=2042506562"
"247","3.737945","172.16.3.2","172.16.2.2","MPTCP","74","[TCP Dup ACK 222#25] 22  >  64173 [ACK] Seq=2089 Ack=29245 Win=65728 Len=0 TSval=3460605 TSecr=2042506562"
"248","3.745873","172.16.3.2","172.16.2.2","SSH","118","Server: Encrypted packet (len=36)"
"249","3.767813","172.16.3.2","172.16.2.2","MPTCP","74","[TCP Dup ACK 222#26] 22  >  64173 [ACK] Seq=2125 Ack=29245 Win=65728 Len=0 TSval=3460640 TSecr=2042506562"
"250","3.788037","172.16.2.2","172.16.3.2","TCP","66","64173  >  22 [ACK] Seq=29245 Ack=2125 Win=65728 Len=0 TSval=2042507056 TSecr=3460619"
"251","3.788104","172.16.3.2","172.16.2.2","MPTCP","74","[TCP Dup ACK 222#27] 22  >  64173 [ACK] Seq=2125 Ack=29245 Win=65728 Len=0 TSval=3460661 TSecr=2042506562"
"252","3.808774","172.16.3.2","172.16.2.2","MPTCP","74","[TCP Dup ACK 222#28] 22  >  64173 [ACK] Seq=2125 Ack=29245 Win=65728 Len=0 TSval=3460675 TSecr=2042507056"
"253","3.815168","172.16.3.2","172.16.2.2","MPTCP","74","[TCP Dup ACK 222#29] 22  >  64173 [ACK] Seq=2125 Ack=29245 Win=65728 Len=0 TSval=3460685 TSecr=2042507056"
"254","3.838315","172.16.3.2","172.16.2.2","MPTCP","74","[TCP Dup ACK 222#30] 22  >  64173 [ACK] Seq=2125 Ack=29245 Win=65728 Len=0 TSval=3460710 TSecr=2042507056"
"255","3.838337","172.16.3.2","172.16.2.2","MPTCP","74","[TCP Dup ACK 222#31] 22  >  64173 [ACK] Seq=2125 Ack=29245 Win=65728 Len=0 TSval=3460710 TSecr=2042507056"
"256","3.858740","172.16.3.2","172.16.2.2","MPTCP","74","[TCP Dup ACK 222#32] 22  >  64173 [ACK] Seq=2125 Ack=29245 Win=65728 Len=0 TSval=3460725 TSecr=2042507056"
"257","3.878247","172.16.3.2","172.16.2.2","MPTCP","74","[TCP Dup ACK 222#33] 22  >  64173 [ACK] Seq=2125 Ack=29245 Win=65728 Len=0 TSval=3460749 TSecr=2042507056"
"258","3.885345","172.16.3.2","172.16.2.2","MPTCP","74","[TCP Dup ACK 222#34] 22  >  64173 [ACK] Seq=2125 Ack=29245 Win=65728 Len=0 TSval=3460760 TSecr=2042507056"
"259","3.908739","172.16.3.2","172.16.2.2","MPTCP","74","[TCP Dup ACK 222#35] 22  >  64173 [ACK] Seq=2125 Ack=29245 Win=65728 Len=0 TSval=3460779 TSecr=2042507056"
"260","3.929045","172.16.3.2","172.16.2.2","MPTCP","74","[TCP Dup ACK 222#36] 22  >  64173 [ACK] Seq=2125 Ack=29245 Win=65728 Len=0 TSval=3460799 TSecr=2042507056"
"261","3.948918","172.16.3.2","172.16.2.2","MPTCP","74","[TCP Dup ACK 222#37] 22  >  64173 [ACK] Seq=2125 Ack=29245 Win=65728 Len=0 TSval=3460821 TSecr=2042507056"
"262","3.967657","172.16.3.2","172.16.2.2","MPTCP","74","[TCP Dup ACK 222#38] 22  >  64173 [ACK] Seq=2125 Ack=29245 Win=65728 Len=0 TSval=3460840 TSecr=2042507056"
"263","3.988090","172.16.3.2","172.16.2.2","MPTCP","74","[TCP Dup ACK 222#39] 22  >  64173 [ACK] Seq=2125 Ack=29245 Win=65728 Len=0 TSval=3460860 TSecr=2042507056"
"264","4.008217","172.16.3.2","172.16.2.2","MPTCP","74","[TCP Dup ACK 222#40] 22  >  64173 [ACK] Seq=2125 Ack=29245 Win=65728 Len=0 TSval=3460880 TSecr=2042507056"
