"No.","Time","Source","Destination","Protocol","Length","Info"
"1","0.000000","172.16.1.2","172.16.3.2","MPTCP","86","18641  >  22 [SYN] Seq=0 Win=65535 Len=0 MSS=1460 WS=64 SACK_PERM TSval=4060632602 TSecr=0"
"2","0.016170","172.16.3.2","172.16.1.2","MPTCP","86","22  >  18641 [SYN, ACK] Seq=0 Ack=1 Win=65535 Len=0 MSS=1460 WS=64 SACK_PERM TSval=1458448378 TSecr=4060632602"
"3","0.018631","172.16.1.2","172.16.3.2","MPTCP","86","18641  >  22 [ACK] Seq=1 Ack=1 Win=65728 Len=0 TSval=4060632624 TSecr=1458448378"
"4","0.019489","172.16.1.2","172.16.3.2","SSHv2","128","Client: Protocol (SSH-2.0-OpenSSH_8.8 FreeBSD-20211221)"
"5","0.065534","172.16.3.2","172.16.1.2","TCP","66","22  >  18641 [ACK] Seq=1 Ack=39 Win=65728 Len=0 TSval=1458448434 TSecr=4060632624"
"6","0.065556","172.16.3.2","172.16.1.2","SSHv2","124","Server: Protocol (SSH-2.0-OpenSSH_8.8 FreeBSD-20211221)"
"7","0.065877","172.16.1.2","172.16.3.2","MPTCP","74","18641  >  22 [ACK] Seq=39 Ack=39 Win=65728 Len=0 TSval=4060632674 TSecr=1458448434"
"8","0.066543","172.16.1.2","172.16.3.2","MPTCP","1514","18641  >  22 [ACK] Seq=39 Ack=39 Win=65728 Len=1432 TSval=4060632674 TSecr=1458448434 [TCP segment of a reassembled PDU]"
"9","0.066563","172.16.1.2","172.16.3.2","SSHv2","162","Client: Key Exchange Init"
"10","0.086215","172.16.3.2","172.16.1.2","SSHv2","1138","Server: Key Exchange Init"
"11","0.086286","172.16.3.2","172.16.1.2","TCP","66","22  >  18641 [ACK] Seq=1095 Ack=1551 Win=65728 Len=0 TSval=1458448443 TSecr=4060632674"
"12","0.090375","172.16.1.2","172.16.3.2","SSHv2","130","Client: Elliptic Curve Diffie-Hellman Key Exchange Init"
"13","0.106320","172.16.3.2","172.16.1.2","TCP","66","22  >  18641 [ACK] Seq=1095 Ack=1599 Win=65728 Len=0 TSval=1458448463 TSecr=4060632694"
"14","0.106338","172.16.3.2","172.16.1.2","SSHv2","566","Server: Elliptic Curve Diffie-Hellman Key Exchange Reply, New Keys"
"15","0.107059","172.16.1.2","172.16.3.2","MPTCP","74","18641  >  22 [ACK] Seq=1599 Ack=1579 Win=65728 Len=0 TSval=4060632714 TSecr=1458448471"
"16","0.110944","172.16.1.2","172.16.3.2","SSHv2","98","Client: New Keys"
"17","0.125457","172.16.3.2","172.16.1.2","MPTCP","74","22  >  18641 [ACK] Seq=1579 Ack=1615 Win=65728 Len=0 TSval=1458448487 TSecr=4060632714"
"18","0.125532","172.16.1.2","172.16.3.2","SSHv2","126","Client: "
"19","0.145634","172.16.3.2","172.16.1.2","SSHv2","126","Server: "
"20","0.145667","172.16.1.2","172.16.3.2","TCP","66","18641  >  22 [ACK] Seq=1659 Ack=1623 Win=65728 Len=0 TSval=4060632754 TSecr=1458448504"
"21","0.146380","172.16.1.2","172.16.3.2","MPTCP","74","[TCP Dup ACK 20#1] 18641  >  22 [ACK] Seq=1659 Ack=1623 Win=65728 Len=0 TSval=4060632754 TSecr=1458448504"
"22","0.146749","172.16.1.2","172.16.3.2","SSHv2","142","Client: "
"23","0.165349","172.16.3.2","172.16.1.2","MPTCP","74","22  >  18641 [ACK] Seq=1623 Ack=1719 Win=65728 Len=0 TSval=1458448528 TSecr=4060632754"
"24","0.172369","172.16.1.2","172.16.3.2","SSHv2","582","Client: "
"25","0.187399","172.16.3.2","172.16.1.2","MPTCP","74","22  >  18641 [ACK] Seq=1623 Ack=2219 Win=65728 Len=0 TSval=1458448545 TSecr=4060632774"
"26","0.216245","172.16.3.2","172.16.1.2","SSHv2","110","Server: "
"27","0.256562","172.16.1.2","172.16.3.2","TCP","66","18641  >  22 [ACK] Seq=2219 Ack=1651 Win=65728 Len=0 TSval=4060632865 TSecr=1458448572"
"28","0.276196","172.16.3.2","172.16.1.2","SSHv2","222","Server: "
"29","0.277111","172.16.1.2","172.16.3.2","MPTCP","74","18641  >  22 [ACK] Seq=2219 Ack=1791 Win=65728 Len=0 TSval=4060632884 TSecr=1458448638"
"30","0.296049","172.16.3.2","172.16.1.2","SSHv2","126","Server: "
"31","0.296731","172.16.1.2","172.16.3.2","MPTCP","74","18641  >  22 [ACK] Seq=2219 Ack=1835 Win=65728 Len=0 TSval=4060632904 TSecr=1458448658"
"32","0.297295","172.16.1.2","172.16.3.2","SSHv2","174","Client: "
"33","0.312638","172.16.1.2","172.16.3.2","MPTCP","74","[TCP Dup ACK 31#1] 18641  >  22 [ACK] Seq=2311 Ack=1835 Win=65728 Len=0 TSval=4060632920 TSecr=1458448658"
"34","0.316593","172.16.3.2","172.16.1.2","MPTCP","74","22  >  18641 [ACK] Seq=1835 Ack=2311 Win=65728 Len=0 TSval=1458448677 TSecr=4060632904"
"35","0.323529","172.16.3.2","172.16.1.2","MPTCP","74","[TCP Dup ACK 34#1] 22  >  18641 [ACK] Seq=1835 Ack=2311 Win=65728 Len=0 TSval=1458448693 TSecr=4060632920"
"36","0.324095","172.16.3.2","172.16.1.2","SSHv2","158","Server: "
"37","0.354182","172.16.1.2","172.16.3.2","SSHv2","150","Client: "
"38","0.365547","172.16.3.2","172.16.1.2","TCP","66","22  >  18641 [ACK] Seq=1911 Ack=2379 Win=65728 Len=0 TSval=1458448727 TSecr=4060632962"
"39","0.365568","172.16.3.2","172.16.1.2","SSHv2","126","Server: "
"40","0.368455","172.16.3.2","172.16.1.2","MPTCP","74","[TCP Dup ACK 38#1] 22  >  18641 [ACK] Seq=1955 Ack=2379 Win=65728 Len=0 TSval=1458448732 TSecr=4060632962"
"41","0.371279","172.16.1.2","172.16.3.2","MPTCP","74","18641  >  22 [ACK] Seq=2379 Ack=1955 Win=65728 Len=0 TSval=4060632973 TSecr=1458448727"
"42","0.372705","172.16.1.2","172.16.3.2","SSHv2","1514","Client: "
"43","0.372738","172.16.1.2","172.16.3.2","SSHv2","1514","Client: "
"44","0.372753","172.16.1.2","172.16.3.2","SSHv2","1514","Client: "
"45","0.372769","172.16.1.2","172.16.3.2","SSHv2","1514","Client: "
"46","0.372842","172.16.1.2","172.16.3.2","SSHv2","1514","Client: "
"47","0.372886","172.16.1.2","172.16.3.2","SSHv2","1150","Client: "
"48","0.373554","172.16.1.2","172.16.3.2","SSHv2","1514","Client: "
"49","0.373576","172.16.1.2","172.16.3.2","SSHv2","1514","Client: "
"50","0.373589","172.16.1.2","172.16.3.2","SSHv2","1514","Client: "
"51","0.373687","172.16.1.2","172.16.3.2","SSHv2","1514","Client: "
"52","0.373744","172.16.1.2","172.16.3.2","SSHv2","1514","Client: "
"53","0.373786","172.16.1.2","172.16.3.2","SSHv2","1150","Client: "
"54","0.386163","172.16.3.2","172.16.1.2","TCP","66","22  >  18641 [ACK] Seq=1955 Ack=5243 Win=65728 Len=0 TSval=1458448747 TSecr=4060632973"
"55","0.386203","172.16.1.2","172.16.3.2","SSHv2","1514","Client: "
"56","0.386238","172.16.1.2","172.16.3.2","SSHv2","1514","Client: "
"57","0.386306","172.16.1.2","172.16.3.2","SSHv2","1514","Client: "
"58","0.386342","172.16.1.2","172.16.3.2","SSHv2","1514","Client: "
"59","0.386609","172.16.3.2","172.16.1.2","TCP","66","22  >  18641 [ACK] Seq=1955 Ack=8107 Win=65728 Len=0 TSval=1458448753 TSecr=4060632973"
"60","0.386636","172.16.1.2","172.16.3.2","SSHv2","1514","Client: "
"61","0.386670","172.16.1.2","172.16.3.2","SSHv2","1150","Client: "
"62","0.386703","172.16.1.2","172.16.3.2","SSHv2","1514","Client: "
"63","0.386742","172.16.1.2","172.16.3.2","SSHv2","1514","Client: "
"64","0.386780","172.16.3.2","172.16.1.2","MPTCP","74","[TCP Dup ACK 59#1] 22  >  18641 [ACK] Seq=1955 Ack=8107 Win=65728 Len=0 TSval=1458448753 TSecr=4060632973"
"65","0.406508","172.16.3.2","172.16.1.2","TCP","66","22  >  18641 [ACK] Seq=1955 Ack=10607 Win=65728 Len=0 TSval=1458448763 TSecr=4060632973"
"66","0.406579","172.16.1.2","172.16.3.2","SSHv2","1514","Client: "
"67","0.406597","172.16.1.2","172.16.3.2","SSHv2","1514","Client: "
"68","0.407021","172.16.3.2","172.16.1.2","TCP","66","22  >  18641 [ACK] Seq=1955 Ack=13471 Win=65728 Len=0 TSval=1458448778 TSecr=4060632973"
"69","0.407036","172.16.3.2","172.16.1.2","TCP","66","22  >  18641 [ACK] Seq=1955 Ack=16335 Win=65728 Len=0 TSval=1458448778 TSecr=4060632973"
"70","0.407310","172.16.3.2","172.16.1.2","MPTCP","74","[TCP Dup ACK 69#1] 22  >  18641 [ACK] Seq=1955 Ack=16335 Win=65728 Len=0 TSval=1458448778 TSecr=4060632973"
"71","0.426457","172.16.3.2","172.16.1.2","TCP","66","22  >  18641 [ACK] Seq=1955 Ack=18835 Win=65728 Len=0 TSval=1458448782 TSecr=4060632973"
"72","0.426994","172.16.3.2","172.16.1.2","TCP","66","22  >  18641 [ACK] Seq=1955 Ack=21699 Win=65728 Len=0 TSval=1458448794 TSecr=4060632992"
"73","0.427002","172.16.3.2","172.16.1.2","MPTCP","74","22  >  18641 [ACK] Seq=1955 Ack=23131 Win=65728 Len=0 TSval=1458448794 TSecr=4060632992"
"74","0.443261","172.16.1.2","172.16.3.2","SSHv2","1514","Client: "
"75","0.443280","172.16.1.2","172.16.3.2","SSHv2","1514","Client: "
"76","0.443291","172.16.1.2","172.16.3.2","SSHv2","1514","Client: "
"77","0.443302","172.16.1.2","172.16.3.2","SSHv2","1514","Client: "
"78","0.443312","172.16.1.2","172.16.3.2","SSHv2","1514","Client: "
"79","0.443326","172.16.1.2","172.16.3.2","SSHv2","1514","Client: "
"80","0.443399","172.16.1.2","172.16.3.2","SSHv2","1514","Client: "
"81","0.443423","172.16.1.2","172.16.3.2","SSHv2","1514","Client: "
"82","0.443438","172.16.1.2","172.16.3.2","SSHv2","642","Client: "
"83","0.446558","172.16.3.2","172.16.1.2","TCP","66","22  >  18641 [ACK] Seq=1955 Ack=25995 Win=65728 Len=0 TSval=1458448803 TSecr=4060632992"
"84","0.447027","172.16.3.2","172.16.1.2","TCP","66","22  >  18641 [ACK] Seq=1955 Ack=28495 Win=65728 Len=0 TSval=1458448818 TSecr=4060632992"
"85","0.448168","172.16.1.2","172.16.3.2","SSHv2","1514","Client: "
"86","0.448187","172.16.1.2","172.16.3.2","SSHv2","1514","Client: "
"87","0.466455","172.16.3.2","172.16.1.2","TCP","66","22  >  18641 [ACK] Seq=1955 Ack=31359 Win=65728 Len=0 TSval=1458448822 TSecr=4060632992"
"88","0.466480","172.16.3.2","172.16.1.2","TCP","66","22  >  18641 [ACK] Seq=1955 Ack=34223 Win=65728 Len=0 TSval=1458448822 TSecr=4060633012"
"89","0.466487","172.16.3.2","172.16.1.2","MPTCP","74","[TCP Dup ACK 88#1] 22  >  18641 [ACK] Seq=1955 Ack=34223 Win=65728 Len=0 TSval=1458448822 TSecr=4060633012"
"90","0.467040","172.16.3.2","172.16.1.2","TCP","66","22  >  18641 [ACK] Seq=1955 Ack=37087 Win=65728 Len=0 TSval=1458448837 TSecr=4060633051"
"91","0.467182","172.16.3.2","172.16.1.2","MPTCP","74","[TCP Dup ACK 90#1] 22  >  18641 [ACK] Seq=1955 Ack=37087 Win=65728 Len=0 TSval=1458448837 TSecr=4060633051"
"92","0.469293","172.16.1.2","172.16.3.2","SSHv2","1514","Client: "
"93","0.469331","172.16.1.2","172.16.3.2","SSHv2","1514","Client: "
"94","0.486819","172.16.3.2","172.16.1.2","TCP","66","22  >  18641 [ACK] Seq=1955 Ack=39951 Win=65728 Len=0 TSval=1458448842 TSecr=4060633051"
"95","0.487293","172.16.3.2","172.16.1.2","TCP","66","22  >  18641 [ACK] Seq=1955 Ack=42815 Win=65728 Len=0 TSval=1458448852 TSecr=4060633051"
"96","0.487319","172.16.3.2","172.16.1.2","TCP","66","22  >  18641 [ACK] Seq=1955 Ack=44807 Win=65728 Len=0 TSval=1458448852 TSecr=4060633051"
"97","0.487325","172.16.3.2","172.16.1.2","MPTCP","74","[TCP Dup ACK 96#1] 22  >  18641 [ACK] Seq=1955 Ack=44807 Win=65728 Len=0 TSval=1458448852 TSecr=4060633051"
"98","0.487900","172.16.1.2","172.16.3.2","SSHv2","1514","Client: "
"99","0.487922","172.16.1.2","172.16.3.2","SSHv2","1514","Client: "
"100","0.487937","172.16.1.2","172.16.3.2","SSHv2","642","Client: "
"101","0.502238","172.16.1.2","172.16.3.2","SSHv2","1514","Client: "
"102","0.502275","172.16.1.2","172.16.3.2","SSHv2","1514","Client: "
"103","0.502289","172.16.1.2","172.16.3.2","SSHv2","1514","Client: "
"104","0.502353","172.16.1.2","172.16.3.2","SSHv2","1514","Client: "
"105","0.502385","172.16.1.2","172.16.3.2","SSHv2","1514","Client: "
"106","0.502430","172.16.1.2","172.16.3.2","SSHv2","1514","Client: "
"107","0.502460","172.16.1.2","172.16.3.2","SSHv2","1514","Client: "
"108","0.502470","172.16.1.2","172.16.3.2","SSHv2","1514","Client: "
"109","0.502480","172.16.1.2","172.16.3.2","SSHv2","1514","Client: "
"110","0.502490","172.16.1.2","172.16.3.2","SSHv2","1514","Client: "
"111","0.502519","172.16.1.2","172.16.3.2","SSHv2","1514","Client: "
"112","0.502544","172.16.1.2","172.16.3.2","SSHv2","1514","Client: "
"113","0.502574","172.16.1.2","172.16.3.2","SSHv2","1514","Client: "
"114","0.502679","172.16.1.2","172.16.3.2","SSHv2","1514","Client: "
"115","0.502695","172.16.1.2","172.16.3.2","SSHv2","1514","Client: "
"116","0.502772","172.16.1.2","172.16.3.2","SSHv2","786","Client: "
"117","0.507277","172.16.3.2","172.16.1.2","TCP","66","22  >  18641 [ACK] Seq=1955 Ack=47671 Win=65728 Len=0 TSval=1458448862 TSecr=4060633054"
"118","0.507652","172.16.3.2","172.16.1.2","TCP","66","22  >  18641 [ACK] Seq=1955 Ack=50535 Win=65728 Len=0 TSval=1458448872 TSecr=4060633075"
"119","0.509404","172.16.3.2","172.16.1.2","MPTCP","74","22  >  18641 [ACK] Seq=1955 Ack=51967 Win=65728 Len=0 TSval=1458448872 TSecr=4060633093"
"120","0.509409","172.16.1.2","172.16.3.2","SSHv2","1514","Client: "
"121","0.509452","172.16.1.2","172.16.3.2","SSHv2","1514","Client: "
"122","0.509557","172.16.1.2","172.16.3.2","SSHv2","1514","Client: "
"123","0.509608","172.16.1.2","172.16.3.2","SSHv2","1514","Client: "
"124","0.522815","172.16.1.2","172.16.3.2","SSHv2","1514","Client: "
"125","0.522853","172.16.1.2","172.16.3.2","SSHv2","1514","Client: "
"126","0.522866","172.16.1.2","172.16.3.2","SSHv2","642","Client: "
"127","0.526679","172.16.3.2","172.16.1.2","TCP","66","22  >  18641 [ACK] Seq=1955 Ack=53959 Win=65728 Len=0 TSval=1458448886 TSecr=4060633093"
"128","0.526693","172.16.3.2","172.16.1.2","SSHv2","118","Server: "
"129","0.526727","172.16.1.2","172.16.3.2","TCP","66","18641  >  22 [ACK] Seq=85295 Ack=1991 Win=65728 Len=0 TSval=4060633132 TSecr=1458448886"
"130","0.527104","172.16.3.2","172.16.1.2","TCP","66","22  >  18641 [ACK] Seq=1991 Ack=58255 Win=65728 Len=0 TSval=1458448892 TSecr=4060633110"
"131","0.527805","172.16.1.2","172.16.3.2","MPTCP","74","[TCP Dup ACK 129#1] 18641  >  22 [ACK] Seq=85295 Ack=1991 Win=65728 Len=0 TSval=4060633132 TSecr=1458448892"
"132","0.547319","172.16.3.2","172.16.1.2","TCP","66","22  >  18641 [ACK] Seq=1991 Ack=61119 Win=65728 Len=0 TSval=1458448907 TSecr=4060633110"
"133","0.547355","172.16.3.2","172.16.1.2","MPTCP","74","22  >  18641 [ACK] Seq=1991 Ack=62551 Win=65728 Len=0 TSval=1458448907 TSecr=4060633110"
"134","0.548158","172.16.3.2","172.16.1.2","TCP","66","22  >  18641 [ACK] Seq=1991 Ack=65415 Win=65728 Len=0 TSval=1458448914 TSecr=4060633110"
"135","0.548175","172.16.3.2","172.16.1.2","MPTCP","74","[TCP Dup ACK 134#1] 22  >  18641 [ACK] Seq=1991 Ack=65415 Win=65728 Len=0 TSval=1458448914 TSecr=4060633110"
"136","0.562658","172.16.1.2","172.16.3.2","SSHv2","1514","Client: "
"137","0.562678","172.16.1.2","172.16.3.2","SSHv2","1514","Client: "
"138","0.562693","172.16.1.2","172.16.3.2","SSHv2","1514","Client: "
"139","0.566839","172.16.3.2","172.16.1.2","TCP","66","22  >  18641 [ACK] Seq=1991 Ack=68279 Win=65728 Len=0 TSval=1458448923 TSecr=4060633110"
"140","0.567348","172.16.3.2","172.16.1.2","TCP","66","22  >  18641 [ACK] Seq=1991 Ack=71143 Win=65728 Len=0 TSval=1458448938 TSecr=4060633110"
"141","0.567568","172.16.3.2","172.16.1.2","MPTCP","74","22  >  18641 [ACK] Seq=1991 Ack=72575 Win=65728 Len=0 TSval=1458448938 TSecr=4060633110"
"142","0.582961","172.16.1.2","172.16.3.2","SSHv2","1514","Client: "
"143","0.582995","172.16.1.2","172.16.3.2","SSHv2","1514","Client: "
"144","0.583008","172.16.1.2","172.16.3.2","SSHv2","786","Client: "
"145","0.587232","172.16.3.2","172.16.1.2","TCP","66","22  >  18641 [ACK] Seq=1991 Ack=75439 Win=65728 Len=0 TSval=1458448943 TSecr=4060633110"
"146","0.587673","172.16.3.2","172.16.1.2","TCP","66","22  >  18641 [ACK] Seq=1991 Ack=77575 Win=65728 Len=0 TSval=1458448954 TSecr=4060633110"
"147","0.587685","172.16.3.2","172.16.1.2","TCP","66","22  >  18641 [ACK] Seq=1991 Ack=80439 Win=65728 Len=0 TSval=1458448954 TSecr=4060633114"
"148","0.587955","172.16.3.2","172.16.1.2","MPTCP","74","[TCP Dup ACK 147#1] 22  >  18641 [ACK] Seq=1991 Ack=80439 Win=65728 Len=0 TSval=1458448954 TSecr=4060633114"
"149","0.588576","172.16.1.2","172.16.3.2","SSHv2","1514","Client: "
"150","0.588615","172.16.1.2","172.16.3.2","SSHv2","1514","Client: "
"151","0.588630","172.16.1.2","172.16.3.2","SSHv2","1514","Client: "
"152","0.601534","172.16.1.2","172.16.3.2","SSHv2","1514","Client: "
"153","0.601558","172.16.1.2","172.16.3.2","SSHv2","1514","Client: "
"154","0.601696","172.16.1.2","172.16.3.2","SSHv2","1514","Client: "
"155","0.601717","172.16.1.2","172.16.3.2","SSHv2","1514","Client: "
"156","0.605590","172.16.3.2","172.16.1.2","TCP","66","22  >  18641 [ACK] Seq=1991 Ack=83303 Win=65728 Len=0 TSval=1458448963 TSecr=4060633114"
"157","0.606142","172.16.3.2","172.16.1.2","TCP","66","22  >  18641 [ACK] Seq=1991 Ack=85295 Win=65728 Len=0 TSval=1458448977 TSecr=4060633130"
"158","0.606172","172.16.3.2","172.16.1.2","MPTCP","74","22  >  18641 [ACK] Seq=1991 Ack=86727 Win=65728 Len=0 TSval=1458448977 TSecr=4060633170"
"159","0.625569","172.16.3.2","172.16.1.2","TCP","66","22  >  18641 [ACK] Seq=1991 Ack=89591 Win=65728 Len=0 TSval=1458448983 TSecr=4060633170"
"160","0.625585","172.16.3.2","172.16.1.2","MPTCP","74","22  >  18641 [ACK] Seq=1991 Ack=91023 Win=65728 Len=0 TSval=1458448983 TSecr=4060633190"
"161","0.626028","172.16.3.2","172.16.1.2","TCP","66","22  >  18641 [ACK] Seq=1991 Ack=93159 Win=65728 Len=0 TSval=1458448992 TSecr=4060633190"
"162","0.627263","172.16.1.2","172.16.3.2","SSHv2","1514","Client: "
"163","0.627287","172.16.1.2","172.16.3.2","SSHv2","1514","Client: "
"164","0.627360","172.16.1.2","172.16.3.2","SSHv2","786","Client: "
"165","0.646298","172.16.3.2","172.16.1.2","TCP","66","22  >  18641 [ACK] Seq=1991 Ack=96023 Win=65728 Len=0 TSval=1458449003 TSecr=4060633194"
"166","0.646332","172.16.3.2","172.16.1.2","MPTCP","74","22  >  18641 [ACK] Seq=1991 Ack=97455 Win=65728 Len=0 TSval=1458449003 TSecr=4060633194"
"167","0.646926","172.16.3.2","172.16.1.2","TCP","66","22  >  18641 [ACK] Seq=1991 Ack=100319 Win=65728 Len=0 TSval=1458449017 TSecr=4060633209"
"168","0.666231","172.16.3.2","172.16.1.2","TCP","66","22  >  18641 [ACK] Seq=1991 Ack=103183 Win=65728 Len=0 TSval=1458449022 TSecr=4060633209"
"169","0.666748","172.16.3.2","172.16.1.2","TCP","66","22  >  18641 [ACK] Seq=1991 Ack=106047 Win=65728 Len=0 TSval=1458449036 TSecr=4060633233"
"170","0.672742","172.16.3.2","172.16.1.2","MPTCP","74","22  >  18641 [ACK] Seq=1991 Ack=106751 Win=65728 Len=0 TSval=1458449043 TSecr=4060633233"
"171","0.686392","172.16.3.2","172.16.1.2","SSHv2","118","Server: "
"172","0.686987","172.16.1.2","172.16.3.2","MPTCP","74","18641  >  22 [ACK] Seq=106751 Ack=2027 Win=65728 Len=0 TSval=4060633293 TSecr=1458449052"
"173","0.692498","172.16.3.2","172.16.1.2","MPTCP","74","[TCP Dup ACK 170#1] 22  >  18641 [ACK] Seq=2027 Ack=106751 Win=65728 Len=0 TSval=1458449062 TSecr=4060633233"
"174","0.707146","172.16.3.2","172.16.1.2","MPTCP","74","[TCP Dup ACK 170#2] 22  >  18641 [ACK] Seq=2027 Ack=106751 Win=65728 Len=0 TSval=1458449073 TSecr=4060633293"
"175","0.712093","172.16.3.2","172.16.1.2","MPTCP","74","[TCP Dup ACK 170#3] 22  >  18641 [ACK] Seq=2027 Ack=106751 Win=65728 Len=0 TSval=1458449082 TSecr=4060633293"
"176","0.712656","172.16.1.2","172.16.3.2","SSHv2","1514","Client: "
"177","0.712699","172.16.1.2","172.16.3.2","SSHv2","1514","Client: "
"178","0.712715","172.16.1.2","172.16.3.2","SSHv2","1514","Client: "
"179","0.712736","172.16.1.2","172.16.3.2","SSHv2","1514","Client: "
"180","0.712819","172.16.1.2","172.16.3.2","SSHv2","1514","Client: "
"181","0.712865","172.16.1.2","172.16.3.2","SSHv2","786","Client: "
"182","0.722871","172.16.1.2","172.16.3.2","SSHv2","1514","Client: "
"183","0.722889","172.16.1.2","172.16.3.2","SSHv2","1514","Client: "
"184","0.722900","172.16.1.2","172.16.3.2","SSHv2","1514","Client: "
"185","0.722912","172.16.1.2","172.16.3.2","SSHv2","1514","Client: "
"186","0.722975","172.16.1.2","172.16.3.2","SSHv2","1514","Client: "
"187","0.725541","172.16.3.2","172.16.1.2","TCP","66","22  >  18641 [ACK] Seq=2027 Ack=109615 Win=65728 Len=0 TSval=1458449082 TSecr=4060633314"
"188","0.725934","172.16.3.2","172.16.1.2","TCP","66","22  >  18641 [ACK] Seq=2027 Ack=112479 Win=65728 Len=0 TSval=1458449092 TSecr=4060633314"
"189","0.732460","172.16.3.2","172.16.1.2","MPTCP","74","22  >  18641 [ACK] Seq=2027 Ack=113911 Win=65728 Len=0 TSval=1458449103 TSecr=4060633314"
"190","0.733115","172.16.1.2","172.16.3.2","SSHv2","1514","Client: "
"191","0.733134","172.16.1.2","172.16.3.2","SSHv2","1514","Client: "
"192","0.733229","172.16.1.2","172.16.3.2","SSHv2","1514","Client: "
"193","0.733258","172.16.1.2","172.16.3.2","SSHv2","1514","Client: "
"194","0.733335","172.16.1.2","172.16.3.2","SSHv2","1514","Client: "
"195","0.746604","172.16.3.2","172.16.1.2","TCP","66","22  >  18641 [ACK] Seq=2027 Ack=116047 Win=65728 Len=0 TSval=1458449103 TSecr=4060633314"
"196","0.746630","172.16.3.2","172.16.1.2","MPTCP","74","[TCP Dup ACK 195#1] 22  >  18641 [ACK] Seq=2027 Ack=116047 Win=65728 Len=0 TSval=1458449113 TSecr=4060633314"
"197","0.747042","172.16.3.2","172.16.1.2","TCP","66","22  >  18641 [ACK] Seq=2027 Ack=118911 Win=65728 Len=0 TSval=1458449113 TSecr=4060633329"
"198","0.753663","172.16.3.2","172.16.1.2","MPTCP","74","22  >  18641 [ACK] Seq=2027 Ack=120343 Win=65728 Len=0 TSval=1458449124 TSecr=4060633329"
"199","0.765467","172.16.3.2","172.16.1.2","TCP","66","22  >  18641 [ACK] Seq=2027 Ack=123207 Win=65728 Len=0 TSval=1458449124 TSecr=4060633329"
"200","0.765480","172.16.3.2","172.16.1.2","MPTCP","74","[TCP Dup ACK 199#1] 22  >  18641 [ACK] Seq=2027 Ack=123207 Win=65728 Len=0 TSval=1458449124 TSecr=4060633329"
"201","0.765902","172.16.3.2","172.16.1.2","TCP","66","22  >  18641 [ACK] Seq=2027 Ack=126071 Win=65728 Len=0 TSval=1458449132 TSecr=4060633333"
"202","0.766498","172.16.1.2","172.16.3.2","SSHv2","1514","Client: "
"203","0.766516","172.16.1.2","172.16.3.2","SSHv2","1514","Client: "
"204","0.766922","172.16.1.2","172.16.3.2","SSHv2","1514","Client: "
"205","0.766939","172.16.1.2","172.16.3.2","SSHv2","1514","Client: "
"206","0.766950","172.16.1.2","172.16.3.2","SSHv2","1514","Client: "
"207","0.786497","172.16.3.2","172.16.1.2","TCP","66","22  >  18641 [ACK] Seq=2027 Ack=128935 Win=65728 Len=0 TSval=1458449143 TSecr=4060633333"
"208","0.786514","172.16.3.2","172.16.1.2","MPTCP","74","22  >  18641 [ACK] Seq=2027 Ack=130367 Win=65728 Len=0 TSval=1458449143 TSecr=4060633373"
"209","0.786530","172.16.3.2","172.16.1.2","MPTCP","74","[TCP Dup ACK 208#1] 22  >  18641 [ACK] Seq=2027 Ack=130367 Win=65728 Len=0 TSval=1458449153 TSecr=4060633373"
"210","0.786792","172.16.3.2","172.16.1.2","TCP","66","22  >  18641 [ACK] Seq=2027 Ack=133231 Win=65728 Len=0 TSval=1458449153 TSecr=4060633373"
"211","0.806304","172.16.3.2","172.16.1.2","TCP","66","22  >  18641 [ACK] Seq=2027 Ack=136095 Win=65728 Len=0 TSval=1458449163 TSecr=4060633373"
"212","0.806316","172.16.3.2","172.16.1.2","MPTCP","74","[TCP Dup ACK 211#1] 22  >  18641 [ACK] Seq=2027 Ack=136095 Win=65728 Len=0 TSval=1458449163 TSecr=4060633373"
"213","0.812415","172.16.3.2","172.16.1.2","MPTCP","74","[TCP Dup ACK 211#2] 22  >  18641 [ACK] Seq=2027 Ack=136095 Win=65728 Len=0 TSval=1458449182 TSecr=4060633373"
"214","0.826547","172.16.3.2","172.16.1.2","MPTCP","74","[TCP Dup ACK 211#3] 22  >  18641 [ACK] Seq=2027 Ack=136095 Win=65728 Len=0 TSval=1458449193 TSecr=4060633373"
"215","0.833370","172.16.3.2","172.16.1.2","SSHv2","118","Server: "
"216","0.843111","172.16.1.2","172.16.3.2","SSHv2","1514","Client: "
"217","0.843136","172.16.1.2","172.16.3.2","SSHv2","1514","Client: "
"218","0.843151","172.16.1.2","172.16.3.2","SSHv2","1514","Client: "
"219","0.843167","172.16.1.2","172.16.3.2","SSHv2","1514","Client: "
"220","0.843201","172.16.1.2","172.16.3.2","SSHv2","1514","Client: "
"221","0.843223","172.16.1.2","172.16.3.2","SSHv2","1346","Client: "
"222","0.856838","172.16.3.2","172.16.1.2","TCP","66","22  >  18641 [ACK] Seq=2063 Ack=137527 Win=65728 Len=0 TSval=1458449214 TSecr=4060633442"
"223","0.856872","172.16.3.2","172.16.1.2","MPTCP","74","22  >  18641 [ACK] Seq=2063 Ack=138959 Win=65728 Len=0 TSval=1458449222 TSecr=4060633442"
"224","0.857232","172.16.3.2","172.16.1.2","TCP","66","22  >  18641 [ACK] Seq=2063 Ack=141823 Win=65728 Len=0 TSval=1458449222 TSecr=4060633442"
"225","0.863041","172.16.1.2","172.16.3.2","SSHv2","1514","Client: "
"226","0.863059","172.16.1.2","172.16.3.2","SSHv2","1514","Client: "
"227","0.863106","172.16.1.2","172.16.3.2","SSHv2","1514","Client: "
"228","0.863140","172.16.1.2","172.16.3.2","SSHv2","1514","Client: "
"229","0.863219","172.16.1.2","172.16.3.2","SSHv2","1514","Client: "
"230","0.876247","172.16.3.2","172.16.1.2","TCP","66","22  >  18641 [ACK] Seq=2063 Ack=144519 Win=65728 Len=0 TSval=1458449233 TSecr=4060633442"
"231","0.876294","172.16.3.2","172.16.1.2","MPTCP","74","22  >  18641 [ACK] Seq=2063 Ack=145951 Win=65728 Len=0 TSval=1458449242 TSecr=4060633465"
"232","0.876583","172.16.3.2","172.16.1.2","TCP","66","22  >  18641 [ACK] Seq=2063 Ack=148815 Win=65728 Len=0 TSval=1458449242 TSecr=4060633465"
"233","0.895447","172.16.3.2","172.16.1.2","TCP","66","22  >  18641 [ACK] Seq=2063 Ack=151679 Win=65728 Len=0 TSval=1458449253 TSecr=4060633465"
"234","0.895466","172.16.3.2","172.16.1.2","MPTCP","74","[TCP Dup ACK 233#1] 22  >  18641 [ACK] Seq=2063 Ack=151679 Win=65728 Len=0 TSval=1458449261 TSecr=4060633465"
"235","0.896281","172.16.1.2","172.16.3.2","SSHv2","1514","Client: "
"236","0.896301","172.16.1.2","172.16.3.2","SSHv2","1514","Client: "
"237","0.896312","172.16.1.2","172.16.3.2","SSHv2","1514","Client: "
"238","0.896326","172.16.1.2","172.16.3.2","SSHv2","1514","Client: "
"239","0.896401","172.16.1.2","172.16.3.2","SSHv2","1514","Client: "
"240","0.896421","172.16.1.2","172.16.3.2","SSHv2","1514","Client: "
"241","0.896439","172.16.1.2","172.16.3.2","SSHv2","1514","Client: "
"242","0.896535","172.16.1.2","172.16.3.2","SSHv2","1514","Client: "
"243","0.896552","172.16.1.2","172.16.3.2","SSHv2","1514","Client: "
"244","0.896567","172.16.1.2","172.16.3.2","SSHv2","1514","Client: "
"245","0.903269","172.16.1.2","172.16.3.2","SSHv2","1514","Client: "
"246","0.903289","172.16.1.2","172.16.3.2","SSHv2","1514","Client: "
"247","0.903302","172.16.1.2","172.16.3.2","SSHv2","1514","Client: "
"248","0.903351","172.16.1.2","172.16.3.2","SSHv2","1514","Client: "
"249","0.903373","172.16.1.2","172.16.3.2","SSHv2","1514","Client: "
"250","0.916272","172.16.3.2","172.16.1.2","TCP","66","22  >  18641 [ACK] Seq=2063 Ack=154543 Win=65728 Len=0 TSval=1458449272 TSecr=4060633503"
"251","0.916800","172.16.3.2","172.16.1.2","TCP","66","22  >  18641 [ACK] Seq=2063 Ack=157407 Win=65728 Len=0 TSval=1458449282 TSecr=4060633503"
"252","0.923220","172.16.3.2","172.16.1.2","MPTCP","74","22  >  18641 [ACK] Seq=2063 Ack=158839 Win=65728 Len=0 TSval=1458449293 TSecr=4060633503"
"253","0.924446","172.16.1.2","172.16.3.2","SSHv2","1514","Client: "
"254","0.924604","172.16.1.2","172.16.3.2","SSHv2","1514","Client: "
"255","0.936364","172.16.3.2","172.16.1.2","TCP","66","22  >  18641 [ACK] Seq=2063 Ack=161703 Win=65728 Len=0 TSval=1458449293 TSecr=4060633503"
"256","0.936389","172.16.3.2","172.16.1.2","MPTCP","74","[TCP Dup ACK 255#1] 22  >  18641 [ACK] Seq=2063 Ack=161703 Win=65728 Len=0 TSval=1458449293 TSecr=4060633503"
"257","0.936881","172.16.3.2","172.16.1.2","TCP","66","22  >  18641 [ACK] Seq=2063 Ack=164567 Win=65728 Len=0 TSval=1458449302 TSecr=4060633503"
"258","0.956341","172.16.3.2","172.16.1.2","TCP","66","22  >  18641 [ACK] Seq=2063 Ack=167431 Win=65728 Len=0 TSval=1458449313 TSecr=4060633503"
"259","0.956370","172.16.3.2","172.16.1.2","MPTCP","74","22  >  18641 [ACK] Seq=2063 Ack=168863 Win=65728 Len=0 TSval=1458449313 TSecr=4060633503"
"260","0.956813","172.16.3.2","172.16.1.2","TCP","66","22  >  18641 [ACK] Seq=2063 Ack=171727 Win=65728 Len=0 TSval=1458449322 TSecr=4060633503"
"261","0.957280","172.16.1.2","172.16.3.2","SSHv2","1514","Client: "
"262","0.957300","172.16.1.2","172.16.3.2","SSHv2","1514","Client: "
"263","0.963005","172.16.1.2","172.16.3.2","SSHv2","1514","Client: "
"264","0.963034","172.16.1.2","172.16.3.2","SSHv2","1514","Client: "
"265","0.963068","172.16.1.2","172.16.3.2","SSHv2","1514","Client: "
"266","0.963083","172.16.1.2","172.16.3.2","SSHv2","1514","Client: "
"267","0.963102","172.16.1.2","172.16.3.2","SSHv2","1514","Client: "
"268","0.963154","172.16.1.2","172.16.3.2","SSHv2","1514","Client: "
"269","0.963176","172.16.1.2","172.16.3.2","SSHv2","1514","Client: "
"270","0.963190","172.16.1.2","172.16.3.2","SSHv2","1346","Client: "
"271","0.976904","172.16.3.2","172.16.1.2","TCP","66","22  >  18641 [ACK] Seq=2063 Ack=174591 Win=65728 Len=0 TSval=1458449338 TSecr=4060633503"
"272","0.976923","172.16.3.2","172.16.1.2","MPTCP","74","22  >  18641 [ACK] Seq=2063 Ack=176023 Win=65728 Len=0 TSval=1458449338 TSecr=4060633532"
"273","0.976942","172.16.3.2","172.16.1.2","MPTCP","74","[TCP Dup ACK 272#1] 22  >  18641 [ACK] Seq=2063 Ack=176023 Win=65728 Len=0 TSval=1458449343 TSecr=4060633532"
"274","0.977389","172.16.3.2","172.16.1.2","TCP","66","22  >  18641 [ACK] Seq=2063 Ack=178887 Win=65728 Len=0 TSval=1458449343 TSecr=4060633564"
"275","0.977754","172.16.3.2","172.16.1.2","SSHv2","118","Server: "
"276","0.977785","172.16.1.2","172.16.3.2","TCP","66","18641  >  22 [ACK] Seq=190175 Ack=2099 Win=65728 Len=0 TSval=4060633583 TSecr=1458449343"
"277","0.988290","172.16.1.2","172.16.3.2","SSHv2","1514","Client: "
"278","0.988308","172.16.1.2","172.16.3.2","SSHv2","1514","Client: "
"279","0.996501","172.16.3.2","172.16.1.2","TCP","66","22  >  18641 [ACK] Seq=2099 Ack=183183 Win=65728 Len=0 TSval=1458449353 TSecr=4060633564"
"280","0.996527","172.16.3.2","172.16.1.2","MPTCP","74","[TCP Dup ACK 279#1] 22  >  18641 [ACK] Seq=2099 Ack=183183 Win=65728 Len=0 TSval=1458449363 TSecr=4060633564"
"281","0.996913","172.16.3.2","172.16.1.2","TCP","66","22  >  18641 [ACK] Seq=2099 Ack=186047 Win=65728 Len=0 TSval=1458449363 TSecr=4060633564"
"282","1.017413","172.16.3.2","172.16.1.2","TCP","66","22  >  18641 [ACK] Seq=2099 Ack=188911 Win=65728 Len=0 TSval=1458449373 TSecr=4060633564"
"283","1.017435","172.16.3.2","172.16.1.2","MPTCP","74","22  >  18641 [ACK] Seq=2099 Ack=190175 Win=65728 Len=0 TSval=1458449373 TSecr=4060633564"
"284","1.017962","172.16.3.2","172.16.1.2","TCP","66","22  >  18641 [ACK] Seq=2099 Ack=193039 Win=65728 Len=0 TSval=1458449384 TSecr=4060633596"
"285","1.018231","172.16.3.2","172.16.1.2","MPTCP","74","[TCP Dup ACK 284#1] 22  >  18641 [ACK] Seq=2099 Ack=193039 Win=65728 Len=0 TSval=1458449384 TSecr=4060633596"
"286","1.033184","172.16.1.2","172.16.3.2","SSHv2","1514","Client: "
"287","1.033222","172.16.1.2","172.16.3.2","SSHv2","1514","Client: "
"288","1.033234","172.16.1.2","172.16.3.2","SSHv2","1514","Client: "
"289","1.033324","172.16.1.2","172.16.3.2","SSHv2","1514","Client: "
"290","1.033412","172.16.1.2","172.16.3.2","SSHv2","1514","Client: "
"291","1.036405","172.16.3.2","172.16.1.2","MPTCP","74","[TCP Dup ACK 284#2] 22  >  18641 [ACK] Seq=2099 Ack=193039 Win=65728 Len=0 TSval=1458449403 TSecr=4060633596"
"292","1.037221","172.16.1.2","172.16.3.2","SSHv2","1514","Client: "
"293","1.037259","172.16.1.2","172.16.3.2","SSHv2","1514","Client: "
"294","1.037309","172.16.1.2","172.16.3.2","SSHv2","1514","Client: "
"295","1.037397","172.16.1.2","172.16.3.2","SSHv2","1514","Client: "
"296","1.037454","172.16.1.2","172.16.3.2","SSHv2","1514","Client: "
"297","1.046529","172.16.3.2","172.16.1.2","TCP","66","22  >  18641 [ACK] Seq=2099 Ack=195903 Win=65728 Len=0 TSval=1458449403 TSecr=4060633640"
"298","1.046868","172.16.3.2","172.16.1.2","TCP","66","22  >  18641 [ACK] Seq=2099 Ack=198767 Win=65728 Len=0 TSval=1458449413 TSecr=4060633640"
"299","1.053805","172.16.3.2","172.16.1.2","MPTCP","74","22  >  18641 [ACK] Seq=2099 Ack=200199 Win=65728 Len=0 TSval=1458449423 TSecr=4060633640"
"300","1.065414","172.16.3.2","172.16.1.2","TCP","66","22  >  18641 [ACK] Seq=2099 Ack=203063 Win=65728 Len=0 TSval=1458449423 TSecr=4060633643"
"301","1.065428","172.16.3.2","172.16.1.2","MPTCP","74","[TCP Dup ACK 300#1] 22  >  18641 [ACK] Seq=2099 Ack=203063 Win=65728 Len=0 TSval=1458449432 TSecr=4060633643"
"302","1.065924","172.16.3.2","172.16.1.2","TCP","66","22  >  18641 [ACK] Seq=2099 Ack=205927 Win=65728 Len=0 TSval=1458449432 TSecr=4060633643"
"303","1.072202","172.16.3.2","172.16.1.2","MPTCP","74","22  >  18641 [ACK] Seq=2099 Ack=207359 Win=65728 Len=0 TSval=1458449443 TSecr=4060633643"
"304","1.075816","172.16.1.2","172.16.3.2","SSHv2","1514","Client: "
"305","1.075845","172.16.1.2","172.16.3.2","SSHv2","1514","Client: "
"306","1.075859","172.16.1.2","172.16.3.2","SSHv2","1514","Client: "
"307","1.075977","172.16.1.2","172.16.3.2","SSHv2","1514","Client: "
"308","1.076047","172.16.1.2","172.16.3.2","SSHv2","1514","Client: "
"309","1.076073","172.16.1.2","172.16.3.2","SSHv2","1514","Client: "
"310","1.076116","172.16.1.2","172.16.3.2","SSHv2","1514","Client: "
"311","1.076159","172.16.1.2","172.16.3.2","SSHv2","1514","Client: "
"312","1.076202","172.16.1.2","172.16.3.2","SSHv2","1514","Client: "
"313","1.076231","172.16.1.2","172.16.3.2","SSHv2","1514","Client: "
"314","1.076256","172.16.1.2","172.16.3.2","SSHv2","1514","Client: "
"315","1.076329","172.16.1.2","172.16.3.2","SSHv2","1514","Client: "
"316","1.076355","172.16.1.2","172.16.3.2","SSHv2","1514","Client: "
"317","1.076369","172.16.1.2","172.16.3.2","SSHv2","1514","Client: "
"318","1.076471","172.16.1.2","172.16.3.2","SSHv2","1514","Client: "
"319","1.076544","172.16.1.2","172.16.3.2","SSHv2","1514","Client: "
"320","1.076570","172.16.1.2","172.16.3.2","SSHv2","1514","Client: "
"321","1.076583","172.16.1.2","172.16.3.2","SSHv2","1514","Client: "
"322","1.086765","172.16.3.2","172.16.1.2","MPTCP","74","[TCP Dup ACK 303#1] 22  >  18641 [ACK] Seq=2099 Ack=207359 Win=65728 Len=0 TSval=1458449443 TSecr=4060633643"
"323","1.086909","172.16.3.2","172.16.1.2","TCP","66","22  >  18641 [ACK] Seq=2099 Ack=210223 Win=65728 Len=0 TSval=1458449453 TSecr=4060633682"
"324","1.087268","172.16.3.2","172.16.1.2","MPTCP","74","[TCP Dup ACK 323#1] 22  >  18641 [ACK] Seq=2099 Ack=210223 Win=65728 Len=0 TSval=1458449453 TSecr=4060633682"
"325","1.087647","172.16.1.2","172.16.3.2","SSHv2","1514","Client: "
"326","1.087669","172.16.1.2","172.16.3.2","SSHv2","1514","Client: "
"327","1.088060","172.16.1.2","172.16.3.2","SSHv2","1514","Client: "
"328","1.088079","172.16.1.2","172.16.3.2","SSHv2","1514","Client: "
"329","1.088094","172.16.1.2","172.16.3.2","SSHv2","1514","Client: "
"330","1.088131","172.16.1.2","172.16.3.2","SSHv2","1514","Client: "
"331","1.088194","172.16.1.2","172.16.3.2","SSHv2","1346","Client: "
"332","1.106241","172.16.3.2","172.16.1.2","TCP","66","22  >  18641 [ACK] Seq=2099 Ack=213087 Win=65728 Len=0 TSval=1458449467 TSecr=4060633682"
"333","1.106678","172.16.3.2","172.16.1.2","TCP","66","22  >  18641 [ACK] Seq=2099 Ack=215951 Win=65728 Len=0 TSval=1458449473 TSecr=4060633682"
"334","1.106954","172.16.3.2","172.16.1.2","MPTCP","74","22  >  18641 [ACK] Seq=2099 Ack=217383 Win=65728 Len=0 TSval=1458449473 TSecr=4060633682"
"335","1.107692","172.16.1.2","172.16.3.2","SSHv2","1514","Client: "
"336","1.107712","172.16.1.2","172.16.3.2","SSHv2","1514","Client: "
"337","1.125540","172.16.3.2","172.16.1.2","TCP","66","22  >  18641 [ACK] Seq=2099 Ack=220247 Win=65728 Len=0 TSval=1458449488 TSecr=4060633682"
"338","1.126084","172.16.3.2","172.16.1.2","TCP","66","22  >  18641 [ACK] Seq=2099 Ack=223111 Win=65728 Len=0 TSval=1458449493 TSecr=4060633682"
"339","1.126312","172.16.3.2","172.16.1.2","MPTCP","74","22  >  18641 [ACK] Seq=2099 Ack=224543 Win=65728 Len=0 TSval=1458449493 TSecr=4060633682"
"340","1.126972","172.16.1.2","172.16.3.2","SSHv2","1514","Client: "
"341","1.126995","172.16.1.2","172.16.3.2","SSHv2","1514","Client: "
"342","1.146299","172.16.3.2","172.16.1.2","TCP","66","22  >  18641 [ACK] Seq=2099 Ack=227407 Win=65728 Len=0 TSval=1458449504 TSecr=4060633682"
"343","1.146899","172.16.3.2","172.16.1.2","TCP","66","22  >  18641 [ACK] Seq=2099 Ack=230271 Win=65728 Len=0 TSval=1458449512 TSecr=4060633682"
"344","1.147086","172.16.3.2","172.16.1.2","MPTCP","74","22  >  18641 [ACK] Seq=2099 Ack=231703 Win=65728 Len=0 TSval=1458449512 TSecr=4060633682"
"345","1.165543","172.16.3.2","172.16.1.2","TCP","66","22  >  18641 [ACK] Seq=2099 Ack=234567 Win=65728 Len=0 TSval=1458449527 TSecr=4060633682"
"346","1.165570","172.16.3.2","172.16.1.2","SSHv2","118","Server: "
"347","1.165610","172.16.1.2","172.16.3.2","TCP","66","18641  >  22 [ACK] Seq=248719 Ack=2135 Win=65728 Len=0 TSval=4060633773 TSecr=1458449527"
"348","1.165998","172.16.3.2","172.16.1.2","TCP","66","22  >  18641 [ACK] Seq=2135 Ack=238863 Win=65728 Len=0 TSval=1458449532 TSecr=4060633695"
"349","1.166353","172.16.1.2","172.16.3.2","MPTCP","74","[TCP Dup ACK 347#1] 18641  >  22 [ACK] Seq=248719 Ack=2135 Win=65728 Len=0 TSval=4060633773 TSecr=1458449532"
"350","1.186553","172.16.3.2","172.16.1.2","TCP","66","22  >  18641 [ACK] Seq=2135 Ack=241727 Win=65728 Len=0 TSval=1458449545 TSecr=4060633695"
"351","1.186590","172.16.3.2","172.16.1.2","MPTCP","74","22  >  18641 [ACK] Seq=2135 Ack=242991 Win=65728 Len=0 TSval=1458449545 TSecr=4060633695"
"352","1.186922","172.16.3.2","172.16.1.2","TCP","66","22  >  18641 [ACK] Seq=2135 Ack=245855 Win=65728 Len=0 TSval=1458449552 TSecr=4060633714"
"353","1.206308","172.16.3.2","172.16.1.2","TCP","66","22  >  18641 [ACK] Seq=2135 Ack=248719 Win=65728 Len=0 TSval=1458449563 TSecr=4060633734"
"354","1.206321","172.16.3.2","172.16.1.2","MPTCP","74","[TCP Dup ACK 353#1] 22  >  18641 [ACK] Seq=2135 Ack=248719 Win=65728 Len=0 TSval=1458449563 TSecr=4060633773"
"355","1.212964","172.16.3.2","172.16.1.2","MPTCP","74","[TCP Dup ACK 353#2] 22  >  18641 [ACK] Seq=2135 Ack=248719 Win=65728 Len=0 TSval=1458449583 TSecr=4060633773"
"356","1.222751","172.16.1.2","172.16.3.2","SSHv2","1514","Client: "
"357","1.222774","172.16.1.2","172.16.3.2","SSHv2","1514","Client: "
"358","1.223201","172.16.1.2","172.16.3.2","SSHv2","1514","Client: "
"359","1.223221","172.16.1.2","172.16.3.2","SSHv2","1514","Client: "
"360","1.223259","172.16.1.2","172.16.3.2","SSHv2","1514","Client: "
"361","1.223281","172.16.1.2","172.16.3.2","SSHv2","1514","Client: "
"362","1.223337","172.16.1.2","172.16.3.2","SSHv2","1514","Client: "
"363","1.226479","172.16.3.2","172.16.1.2","MPTCP","74","[TCP Dup ACK 353#3] 22  >  18641 [ACK] Seq=2135 Ack=248719 Win=65728 Len=0 TSval=1458449593 TSecr=4060633773"
"364","1.226847","172.16.3.2","172.16.1.2","TCP","66","22  >  18641 [ACK] Seq=2135 Ack=251583 Win=65728 Len=0 TSval=1458449593 TSecr=4060633822"
"365","1.232849","172.16.3.2","172.16.1.2","MPTCP","74","[TCP Dup ACK 364#1] 22  >  18641 [ACK] Seq=2135 Ack=251583 Win=65728 Len=0 TSval=1458449603 TSecr=4060633822"
"366","1.233555","172.16.1.2","172.16.3.2","SSHv2","1514","Client: "
"367","1.233595","172.16.1.2","172.16.3.2","SSHv2","1514","Client: "
"368","1.233636","172.16.1.2","172.16.3.2","SSHv2","1514","Client: "
"369","1.233661","172.16.1.2","172.16.3.2","SSHv2","1514","Client: "
"370","1.233817","172.16.1.2","172.16.3.2","SSHv2","1514","Client: "
"371","1.247307","172.16.3.2","172.16.1.2","TCP","66","22  >  18641 [ACK] Seq=2135 Ack=254447 Win=65728 Len=0 TSval=1458449603 TSecr=4060633822"
"372","1.247715","172.16.3.2","172.16.1.2","TCP","66","22  >  18641 [ACK] Seq=2135 Ack=257311 Win=65728 Len=0 TSval=1458449612 TSecr=4060633822"
"373","1.252281","172.16.3.2","172.16.1.2","MPTCP","74","22  >  18641 [ACK] Seq=2135 Ack=258743 Win=65728 Len=0 TSval=1458449622 TSecr=4060633822"
"374","1.263975","172.16.1.2","172.16.3.2","SSHv2","1514","Client: "
"375","1.263998","172.16.1.2","172.16.3.2","SSHv2","1514","Client: "
"376","1.264015","172.16.1.2","172.16.3.2","SSHv2","1514","Client: "
"377","1.264108","172.16.1.2","172.16.3.2","SSHv2","1514","Client: "
"378","1.264129","172.16.1.2","172.16.3.2","SSHv2","1514","Client: "
"379","1.264144","172.16.1.2","172.16.3.2","SSHv2","1514","Client: "
"380","1.264231","172.16.1.2","172.16.3.2","SSHv2","1514","Client: "
"381","1.264252","172.16.1.2","172.16.3.2","SSHv2","1514","Client: "
"382","1.264267","172.16.1.2","172.16.3.2","SSHv2","1514","Client: "
"383","1.264332","172.16.1.2","172.16.3.2","SSHv2","1514","Client: "
"384","1.264348","172.16.1.2","172.16.3.2","SSHv2","1514","Client: "
"385","1.266880","172.16.3.2","172.16.1.2","TCP","66","22  >  18641 [ACK] Seq=2135 Ack=261607 Win=65728 Len=0 TSval=1458449622 TSecr=4060633833"
"386","1.267281","172.16.3.2","172.16.1.2","TCP","66","22  >  18641 [ACK] Seq=2135 Ack=264471 Win=65728 Len=0 TSval=1458449632 TSecr=4060633833"
