"No.","Time","Source","Destination","Protocol","Length","Info"
"1","0.000000","PcsCompu_94:6e:10","Broadcast","ARP","42","Who has 172.16.2.1? Tell 172.16.2.2"
"2","0.001526","PcsCompu_9b:1a:be","PcsCompu_94:6e:10","ARP","60","172.16.2.1 is at 08:00:27:9b:1a:be"
"3","0.001541","172.16.2.2","172.16.3.2","MPTCP","86","31340  >  22 [SYN] Seq=0 Win=65535 Len=0 MSS=1460 WS=64 SACK_PERM TSval=4094246833 TSecr=0"
"4","0.019685","172.16.3.2","172.16.2.2","MPTCP","90","22  >  31340 [SYN, ACK, ECE] Seq=0 Ack=1 Win=65535 Len=0 MSS=1460 WS=64 TSval=99683 TSecr=4094246833"
"5","0.019779","172.16.2.2","172.16.3.2","MPTCP","90","31340  >  22 [ACK] Seq=1 Ack=1 Win=65728 Len=0 TSval=4094246848 TSecr=99683"
"6","0.040277","172.16.3.2","172.16.2.2","TCP","66","[TCP Window Update] 22  >  31340 [ACK] Seq=1 Ack=1 Win=65728 Len=0 TSval=99701 TSecr=4094246848"
"7","0.072482","172.16.2.2","172.16.3.2","SSH","130","Client: Encrypted packet (len=48)"
"8","0.090907","172.16.3.2","172.16.2.2","SSH","566","Server: Encrypted packet (len=484)"
"9","0.091007","172.16.2.2","172.16.3.2","TCP","66","31340  >  22 [ACK] Seq=49 Ack=485 Win=65728 Len=0 TSval=4094246924 TSecr=99752"
"10","0.092175","172.16.2.2","172.16.3.2","MPTCP","74","[TCP Dup ACK 9#1] 31340  >  22 [ACK] Seq=49 Ack=485 Win=65728 Len=0 TSval=4094246924 TSecr=99752"
"11","0.096991","172.16.2.2","172.16.3.2","SSH","98","Client: Encrypted packet (len=16)"
"12","0.111354","172.16.3.2","172.16.2.2","MPTCP","74","22  >  31340 [ACK] Seq=485 Ack=65 Win=65728 Len=0 TSval=99772 TSecr=4094246924"
"13","0.111412","172.16.2.2","172.16.3.2","SSH","126","Client: Encrypted packet (len=44)"
"14","0.130642","172.16.3.2","172.16.2.2","SSH","126","Server: Encrypted packet (len=44)"
"15","0.130670","172.16.2.2","172.16.3.2","TCP","66","31340  >  22 [ACK] Seq=109 Ack=529 Win=65728 Len=0 TSval=4094246961 TSecr=99785"
"16","0.131604","172.16.2.2","172.16.3.2","MPTCP","74","[TCP Dup ACK 15#1] 31340  >  22 [ACK] Seq=109 Ack=529 Win=65728 Len=0 TSval=4094246964 TSecr=99785"
"17","0.132418","172.16.2.2","172.16.3.2","SSH","142","Client: Encrypted packet (len=60)"
"18","0.149923","172.16.2.2","172.16.3.2","MPTCP","74","[TCP Dup ACK 15#2] 31340  >  22 [ACK] Seq=169 Ack=529 Win=65728 Len=0 TSval=4094246976 TSecr=99785"
"19","0.150041","172.16.3.2","172.16.2.2","MPTCP","74","22  >  31340 [ACK] Seq=529 Ack=169 Win=65728 Len=0 TSval=99811 TSecr=4094246964"
"20","0.150891","172.16.2.2","172.16.3.2","SSH","582","Client: Encrypted packet (len=500)"
"21","0.170402","172.16.3.2","172.16.2.2","SSH","542","Server: Encrypted packet (len=460)"
"22","0.170429","172.16.2.2","172.16.3.2","TCP","66","31340  >  22 [ACK] Seq=669 Ack=989 Win=65728 Len=0 TSval=4094246995 TSecr=99833"
"23","0.171348","172.16.2.2","172.16.3.2","MPTCP","74","[TCP Dup ACK 22#1] 31340  >  22 [ACK] Seq=669 Ack=989 Win=65728 Len=0 TSval=4094247004 TSecr=99833"
"24","0.176251","172.16.2.2","172.16.3.2","SSH","990","Client: Encrypted packet (len=908)"
"25","0.189975","172.16.3.2","172.16.2.2","MPTCP","74","22  >  31340 [ACK] Seq=989 Ack=1577 Win=65728 Len=0 TSval=99849 TSecr=4094247004"
"26","0.191254","172.16.3.2","172.16.2.2","SSH","850","Server: Encrypted packet (len=768)"
"27","0.201683","172.16.2.2","172.16.3.2","MPTCP","74","31340  >  22 [ACK] Seq=1577 Ack=1757 Win=65728 Len=0 TSval=4094247034 TSecr=99852"
"28","0.203087","172.16.2.2","172.16.3.2","SSH","194","Client: Encrypted packet (len=112)"
"29","0.220404","172.16.3.2","172.16.2.2","MPTCP","74","22  >  31340 [ACK] Seq=1757 Ack=1689 Win=65728 Len=0 TSval=99882 TSecr=4094247034"
"30","0.252068","172.16.2.2","172.16.3.2","MPTCP","74","[TCP Dup ACK 27#1] 31340  >  22 [ACK] Seq=1689 Ack=1757 Win=65728 Len=0 TSval=4094247084 TSecr=99882"
"31","0.311394","172.16.2.2","172.16.3.2","MPTCP","74","[TCP Dup ACK 27#2] 31340  >  22 [ACK] Seq=1689 Ack=1757 Win=65728 Len=0 TSval=4094247144 TSecr=99882"
"32","0.312369","172.16.2.2","172.16.3.2","SSH","174","Client: Encrypted packet (len=92)"
"33","0.331092","172.16.3.2","172.16.2.2","SSH","154","Server: Encrypted packet (len=72)"
"34","0.331117","172.16.2.2","172.16.3.2","TCP","66","31340  >  22 [ACK] Seq=1781 Ack=1829 Win=65728 Len=0 TSval=4094247164 TSecr=99992"
"35","0.332130","172.16.2.2","172.16.3.2","MPTCP","74","[TCP Dup ACK 34#1] 31340  >  22 [ACK] Seq=1781 Ack=1829 Win=65728 Len=0 TSval=4094247164 TSecr=99992"
"36","0.332803","172.16.2.2","172.16.3.2","SSH","126","Client: Encrypted packet (len=44)"
"37","0.350325","172.16.3.2","172.16.2.2","MPTCP","74","22  >  31340 [ACK] Seq=1829 Ack=1825 Win=65728 Len=0 TSval=100005 TSecr=4094247164"
"38","0.358851","172.16.3.2","172.16.2.2","SSH","158","Server: Encrypted packet (len=76)"
"39","0.359498","172.16.2.2","172.16.3.2","MPTCP","74","31340  >  22 [ACK] Seq=1825 Ack=1905 Win=65728 Len=0 TSval=4094247185 TSecr=100022"
"40","0.360134","172.16.2.2","172.16.3.2","MPTCP","74","[TCP Dup ACK 39#1] 31340  >  22 [ACK] Seq=1825 Ack=1905 Win=65728 Len=0 TSval=4094247185 TSecr=100022"
"41","0.360730","172.16.2.2","172.16.3.2","SSH","150","Client: Encrypted packet (len=68)"
"42","0.381215","172.16.3.2","172.16.2.2","MPTCP","74","22  >  31340 [ACK] Seq=1905 Ack=1893 Win=65728 Len=0 TSval=100035 TSecr=4094247194"
"43","0.382030","172.16.2.2","172.16.3.2","MPTCP","74","[TCP Dup ACK 39#2] 31340  >  22 [ACK] Seq=1893 Ack=1905 Win=65728 Len=0 TSval=4094247214 TSecr=100035"
"44","0.384527","172.16.2.2","172.16.3.2","SSH","158","Client: Encrypted packet (len=76)"
"45","0.400160","172.16.3.2","172.16.2.2","SSH","150","Server: Encrypted packet (len=68)"
"46","0.400186","172.16.2.2","172.16.3.2","TCP","66","31340  >  22 [ACK] Seq=1969 Ack=1973 Win=65728 Len=0 TSval=4094247227 TSecr=100062"
"47","0.401004","172.16.2.2","172.16.3.2","MPTCP","74","[TCP Dup ACK 46#1] 31340  >  22 [ACK] Seq=1969 Ack=1973 Win=65728 Len=0 TSval=4094247234 TSecr=100062"
"48","0.407916","172.16.2.2","172.16.3.2","SSH","1514","Client: Encrypted packet (len=1432)"
"49","0.407944","172.16.2.2","172.16.3.2","SSH","1514","Client: Encrypted packet (len=1432)"
"50","0.408133","172.16.2.2","172.16.3.2","SSH","1514","Client: Encrypted packet (len=1432)"
"51","0.408160","172.16.2.2","172.16.3.2","SSH","1514","Client: Encrypted packet (len=1432)"
"52","0.408491","172.16.2.2","172.16.3.2","SSH","1514","Client: Encrypted packet (len=1432)"
"53","0.408607","172.16.2.2","172.16.3.2","SSH","1150","Client: Encrypted packet (len=1068)"
"54","0.410036","172.16.2.2","172.16.3.2","SSH","1514","Client: Encrypted packet (len=1432)"
"55","0.410071","172.16.2.2","172.16.3.2","SSH","1514","Client: Encrypted packet (len=1432)"
"56","0.410083","172.16.2.2","172.16.3.2","SSH","1514","Client: Encrypted packet (len=1432)"
"57","0.410094","172.16.2.2","172.16.3.2","SSH","1514","Client: Encrypted packet (len=1432)"
"58","0.410112","172.16.2.2","172.16.3.2","SSH","1514","Client: Encrypted packet (len=1432)"
"59","0.420434","172.16.3.2","172.16.2.2","TCP","66","22  >  31340 [ACK] Seq=1973 Ack=4833 Win=65728 Len=0 TSval=100075 TSecr=4094247234"
"60","0.420460","172.16.2.2","172.16.3.2","SSH","1150","Client: Encrypted packet (len=1068)"
"61","0.420522","172.16.2.2","172.16.3.2","SSH","1514","Client: Encrypted packet (len=1432)"
"62","0.420571","172.16.2.2","172.16.3.2","SSH","1514","Client: Encrypted packet (len=1432)"
"63","0.420618","172.16.2.2","172.16.3.2","SSH","1514","Client: Encrypted packet (len=1432)"
"64","0.420662","172.16.3.2","172.16.2.2","MPTCP","74","[TCP Dup ACK 59#1] 22  >  31340 [ACK] Seq=1973 Ack=4833 Win=65728 Len=0 TSval=100075 TSecr=4094247234"
"65","0.420688","172.16.2.2","172.16.3.2","SSH","1514","Client: Encrypted packet (len=1432)"
"66","0.421096","172.16.3.2","172.16.2.2","TCP","66","22  >  31340 [ACK] Seq=1973 Ack=7697 Win=65728 Len=0 TSval=100090 TSecr=4094247234"
"67","0.421156","172.16.2.2","172.16.3.2","SSH","1514","Client: Encrypted packet (len=1432)"
"68","0.421663","172.16.3.2","172.16.2.2","MPTCP","74","[TCP Dup ACK 66#1] 22  >  31340 [ACK] Seq=1973 Ack=7697 Win=65728 Len=0 TSval=100090 TSecr=4094247234"
"69","0.422254","172.16.2.2","172.16.3.2","SSH","1006","Client: Encrypted packet (len=924)"
"70","0.422268","172.16.2.2","172.16.3.2","SSH","1514","Client: Encrypted packet (len=1432)"
"71","0.422278","172.16.2.2","172.16.3.2","SSH","1514","Client: Encrypted packet (len=1432)"
"72","0.440906","172.16.3.2","172.16.2.2","TCP","66","22  >  31340 [ACK] Seq=1973 Ack=10197 Win=65728 Len=0 TSval=100092 TSecr=4094247234"
"73","0.440961","172.16.2.2","172.16.3.2","SSH","1514","Client: Encrypted packet (len=1432)"
"74","0.441003","172.16.2.2","172.16.3.2","SSH","1514","Client: Encrypted packet (len=1432)"
"75","0.441028","172.16.2.2","172.16.3.2","SSH","1514","Client: Encrypted packet (len=1432)"
"76","0.441809","172.16.3.2","172.16.2.2","TCP","66","22  >  31340 [ACK] Seq=1973 Ack=13061 Win=65728 Len=0 TSval=100112 TSecr=4094247234"
"77","0.441844","172.16.2.2","172.16.3.2","SSH","1514","Client: Encrypted packet (len=1432)"
"78","0.441876","172.16.2.2","172.16.3.2","SSH","1514","Client: Encrypted packet (len=1432)"
"79","0.441935","172.16.2.2","172.16.3.2","SSH","1514","Client: Encrypted packet (len=1432)"
"80","0.441963","172.16.2.2","172.16.3.2","SSH","1514","Client: Encrypted packet (len=1432)"
"81","0.442034","172.16.3.2","172.16.2.2","TCP","66","22  >  31340 [ACK] Seq=1973 Ack=15925 Win=65728 Len=0 TSval=100112 TSecr=4094247234"
"82","0.442149","172.16.3.2","172.16.2.2","MPTCP","74","[TCP Dup ACK 81#1] 22  >  31340 [ACK] Seq=1973 Ack=15925 Win=65728 Len=0 TSval=100112 TSecr=4094247234"
"83","0.442248","172.16.2.2","172.16.3.2","SSH","1150","Client: Encrypted packet (len=1068)"
"84","0.442274","172.16.2.2","172.16.3.2","SSH","1514","Client: Encrypted packet (len=1432)"
"85","0.442311","172.16.2.2","172.16.3.2","SSH","1514","Client: Encrypted packet (len=1432)"
"86","0.443147","172.16.2.2","172.16.3.2","SSH","1150","Client: Encrypted packet (len=1068)"
"87","0.443200","172.16.2.2","172.16.3.2","SSH","1514","Client: Encrypted packet (len=1432)"
"88","0.460683","172.16.3.2","172.16.2.2","TCP","66","22  >  31340 [ACK] Seq=1973 Ack=18425 Win=65728 Len=0 TSval=100112 TSecr=4094247234"
"89","0.460756","172.16.2.2","172.16.3.2","SSH","1514","Client: Encrypted packet (len=1432)"
"90","0.460853","172.16.2.2","172.16.3.2","SSH","1514","Client: Encrypted packet (len=1432)"
"91","0.460874","172.16.2.2","172.16.3.2","SSH","1514","Client: Encrypted packet (len=1432)"
"92","0.461293","172.16.3.2","172.16.2.2","TCP","66","22  >  31340 [ACK] Seq=1973 Ack=21289 Win=65728 Len=0 TSval=100125 TSecr=4094247244"
"93","0.461552","172.16.3.2","172.16.2.2","MPTCP","74","22  >  31340 [ACK] Seq=1973 Ack=22721 Win=65728 Len=0 TSval=100125 TSecr=4094247244"
"94","0.462456","172.16.2.2","172.16.3.2","SSH","1150","Client: Encrypted packet (len=1068)"
"95","0.462490","172.16.2.2","172.16.3.2","SSH","1514","Client: Encrypted packet (len=1432)"
"96","0.462503","172.16.2.2","172.16.3.2","SSH","1514","Client: Encrypted packet (len=1432)"
"97","0.480578","172.16.3.2","172.16.2.2","TCP","66","22  >  31340 [ACK] Seq=1973 Ack=25585 Win=65728 Len=0 TSval=100142 TSecr=4094247244"
"98","0.481181","172.16.3.2","172.16.2.2","TCP","66","22  >  31340 [ACK] Seq=1973 Ack=27941 Win=65728 Len=0 TSval=100142 TSecr=4094247254"
"99","0.481439","172.16.3.2","172.16.2.2","MPTCP","74","22  >  31340 [ACK] Seq=1973 Ack=29373 Win=65728 Len=0 TSval=100142 TSecr=4094247254"
"100","0.481924","172.16.2.2","172.16.3.2","SSH","1514","Client: Encrypted packet (len=1432)"
"101","0.481944","172.16.2.2","172.16.3.2","SSH","1514","Client: Encrypted packet (len=1432)"
"102","0.481958","172.16.2.2","172.16.3.2","SSH","1514","Client: Encrypted packet (len=1432)"
"103","0.482539","172.16.2.2","172.16.3.2","SSH","1006","Client: Encrypted packet (len=924)"
"104","0.482554","172.16.2.2","172.16.3.2","SSH","1514","Client: Encrypted packet (len=1432)"
"105","0.500367","172.16.3.2","172.16.2.2","TCP","66","22  >  31340 [ACK] Seq=1973 Ack=32237 Win=65728 Len=0 TSval=100162 TSecr=4094247274"
"106","0.501035","172.16.3.2","172.16.2.2","TCP","66","22  >  31340 [ACK] Seq=1973 Ack=35101 Win=65728 Len=0 TSval=100162 TSecr=4094247274"
"107","0.501069","172.16.3.2","172.16.2.2","MPTCP","74","22  >  31340 [ACK] Seq=1973 Ack=36533 Win=65728 Len=0 TSval=100162 TSecr=4094247274"
"108","0.501683","172.16.2.2","172.16.3.2","SSH","1514","Client: Encrypted packet (len=1432)"
"109","0.501700","172.16.2.2","172.16.3.2","SSH","1514","Client: Encrypted packet (len=1432)"
"110","0.501710","172.16.2.2","172.16.3.2","SSH","1514","Client: Encrypted packet (len=1432)"
"111","0.502392","172.16.2.2","172.16.3.2","SSH","1514","Client: Encrypted packet (len=1432)"
"112","0.502408","172.16.2.2","172.16.3.2","SSH","1514","Client: Encrypted packet (len=1432)"
"113","0.520975","172.16.3.2","172.16.2.2","TCP","66","22  >  31340 [ACK] Seq=1973 Ack=39397 Win=65728 Len=0 TSval=100182 TSecr=4094247274"
"114","0.521684","172.16.3.2","172.16.2.2","TCP","66","22  >  31340 [ACK] Seq=1973 Ack=41897 Win=65728 Len=0 TSval=100182 TSecr=4094247274"
"115","0.521723","172.16.3.2","172.16.2.2","TCP","66","22  >  31340 [ACK] Seq=1973 Ack=44397 Win=65728 Len=0 TSval=100182 TSecr=4094247274"
"116","0.522047","172.16.3.2","172.16.2.2","MPTCP","74","[TCP Dup ACK 115#1] 22  >  31340 [ACK] Seq=1973 Ack=44397 Win=65728 Len=0 TSval=100192 TSecr=4094247274"
"117","0.522352","172.16.2.2","172.16.3.2","SSH","1514","Client: Encrypted packet (len=1432)"
"118","0.522369","172.16.2.2","172.16.3.2","SSH","1514","Client: Encrypted packet (len=1432)"
"119","0.522379","172.16.2.2","172.16.3.2","SSH","1514","Client: Encrypted packet (len=1432)"
"120","0.541023","172.16.3.2","172.16.2.2","TCP","66","22  >  31340 [ACK] Seq=1973 Ack=47261 Win=65728 Len=0 TSval=100192 TSecr=4094247274"
"121","0.541833","172.16.3.2","172.16.2.2","TCP","66","22  >  31340 [ACK] Seq=1973 Ack=50125 Win=65728 Len=0 TSval=100212 TSecr=4094247294"
"122","0.542116","172.16.3.2","172.16.2.2","MPTCP","74","22  >  31340 [ACK] Seq=1973 Ack=51193 Win=65728 Len=0 TSval=100212 TSecr=4094247294"
"123","0.560778","172.16.3.2","172.16.2.2","TCP","66","22  >  31340 [ACK] Seq=1973 Ack=54057 Win=65728 Len=0 TSval=100212 TSecr=4094247294"
"124","0.560805","172.16.3.2","172.16.2.2","MPTCP","74","[TCP Dup ACK 123#1] 22  >  31340 [ACK] Seq=1973 Ack=54057 Win=65728 Len=0 TSval=100212 TSecr=4094247294"
"125","0.561478","172.16.3.2","172.16.2.2","TCP","66","22  >  31340 [ACK] Seq=1973 Ack=56921 Win=65728 Len=0 TSval=100232 TSecr=4094247314"
"126","0.580880","172.16.3.2","172.16.2.2","TCP","66","22  >  31340 [ACK] Seq=1973 Ack=59277 Win=65728 Len=0 TSval=100242 TSecr=4094247314"
"127","0.580903","172.16.3.2","172.16.2.2","TCP","66","22  >  31340 [ACK] Seq=1973 Ack=62141 Win=65728 Len=0 TSval=100242 TSecr=4094247314"
"128","0.580907","172.16.3.2","172.16.2.2","MPTCP","74","[TCP Dup ACK 127#1] 22  >  31340 [ACK] Seq=1973 Ack=62141 Win=65728 Len=0 TSval=100242 TSecr=4094247314"
"129","0.581707","172.16.3.2","172.16.2.2","TCP","66","22  >  31340 [ACK] Seq=1973 Ack=65005 Win=65728 Len=0 TSval=100252 TSecr=4094247334"
"130","0.601025","172.16.3.2","172.16.2.2","TCP","66","22  >  31340 [ACK] Seq=1973 Ack=67869 Win=65728 Len=0 TSval=100252 TSecr=4094247334"
"131","0.601058","172.16.3.2","172.16.2.2","MPTCP","74","22  >  31340 [ACK] Seq=1973 Ack=69301 Win=65728 Len=0 TSval=100262 TSecr=4094247354"
"132","0.601987","172.16.3.2","172.16.2.2","TCP","66","22  >  31340 [ACK] Seq=1973 Ack=72165 Win=65728 Len=0 TSval=100262 TSecr=4094247354"
"133","0.602012","172.16.2.2","172.16.3.2","SSH","1150","Client: Encrypted packet (len=1068)"
"134","0.620708","172.16.3.2","172.16.2.2","MPTCP","74","22  >  31340 [ACK] Seq=1973 Ack=73233 Win=65728 Len=0 TSval=100282 TSecr=4094247435"
"135","0.620739","172.16.3.2","172.16.2.2","SSH","118","Server: Encrypted packet (len=36)"
"136","0.621724","172.16.2.2","172.16.3.2","SSH","1514","Client: Encrypted packet (len=1432)"
"137","0.621743","172.16.2.2","172.16.3.2","SSH","1514","Client: Encrypted packet (len=1432)"
"138","0.621754","172.16.2.2","172.16.3.2","SSH","1514","Client: Encrypted packet (len=1432)"
"139","0.621764","172.16.2.2","172.16.3.2","SSH","1514","Client: Encrypted packet (len=1432)"
"140","0.621773","172.16.2.2","172.16.3.2","SSH","1514","Client: Encrypted packet (len=1432)"
"141","0.621786","172.16.2.2","172.16.3.2","SSH","1514","Client: Encrypted packet (len=1432)"
"142","0.621920","172.16.2.2","172.16.3.2","SSH","1514","Client: Encrypted packet (len=1432)"
"143","0.621962","172.16.2.2","172.16.3.2","SSH","1514","Client: Encrypted packet (len=1432)"
"144","0.622061","172.16.2.2","172.16.3.2","SSH","1514","Client: Encrypted packet (len=1432)"
"145","0.622075","172.16.2.2","172.16.3.2","SSH","1514","Client: Encrypted packet (len=1432)"
"146","0.622115","172.16.2.2","172.16.3.2","SSH","1514","Client: Encrypted packet (len=1432)"
"147","0.622160","172.16.2.2","172.16.3.2","SSH","1514","Client: Encrypted packet (len=1432)"
"148","0.622198","172.16.2.2","172.16.3.2","SSH","1514","Client: Encrypted packet (len=1432)"
"149","0.622260","172.16.2.2","172.16.3.2","SSH","1514","Client: Encrypted packet (len=1432)"
"150","0.622311","172.16.2.2","172.16.3.2","SSH","1514","Client: Encrypted packet (len=1432)"
"151","0.622343","172.16.2.2","172.16.3.2","SSH","1514","Client: Encrypted packet (len=1432)"
"152","0.622354","172.16.2.2","172.16.3.2","SSH","1514","Client: Encrypted packet (len=1432)"
"153","0.622391","172.16.2.2","172.16.3.2","SSH","1514","Client: Encrypted packet (len=1432)"
"154","0.622431","172.16.2.2","172.16.3.2","SSH","1514","Client: Encrypted packet (len=1432)"
"155","0.622460","172.16.2.2","172.16.3.2","SSH","1514","Client: Encrypted packet (len=1432)"
"156","0.622472","172.16.2.2","172.16.3.2","SSH","1514","Client: Encrypted packet (len=1432)"
"157","0.622613","172.16.2.2","172.16.3.2","SSH","1514","Client: Encrypted packet (len=1432)"
"158","0.622651","172.16.2.2","172.16.3.2","SSH","1346","Client: Encrypted packet (len=1264)"
"159","0.640160","172.16.3.2","172.16.2.2","TCP","66","22  >  31340 [ACK] Seq=2009 Ack=74665 Win=65728 Len=0 TSval=100303 TSecr=4094247454"
"160","0.640182","172.16.3.2","172.16.2.2","MPTCP","74","22  >  31340 [ACK] Seq=2009 Ack=76097 Win=65728 Len=0 TSval=100303 TSecr=4094247454"
"161","0.640786","172.16.3.2","172.16.2.2","TCP","66","22  >  31340 [ACK] Seq=2009 Ack=78961 Win=65728 Len=0 TSval=100303 TSecr=4094247454"
"162","0.661136","172.16.3.2","172.16.2.2","TCP","66","22  >  31340 [ACK] Seq=2009 Ack=81825 Win=65728 Len=0 TSval=100316 TSecr=4094247454"
"163","0.661165","172.16.3.2","172.16.2.2","MPTCP","74","22  >  31340 [ACK] Seq=2009 Ack=83257 Win=65728 Len=0 TSval=100316 TSecr=4094247454"
"164","0.661760","172.16.3.2","172.16.2.2","TCP","66","22  >  31340 [ACK] Seq=2009 Ack=86121 Win=65728 Len=0 TSval=100322 TSecr=4094247454"
"165","0.681336","172.16.3.2","172.16.2.2","TCP","66","22  >  31340 [ACK] Seq=2009 Ack=88985 Win=65728 Len=0 TSval=100332 TSecr=4094247454"
"166","0.681351","172.16.3.2","172.16.2.2","MPTCP","74","22  >  31340 [ACK] Seq=2009 Ack=90417 Win=65728 Len=0 TSval=100332 TSecr=4094247454"
"167","0.681910","172.16.3.2","172.16.2.2","TCP","66","22  >  31340 [ACK] Seq=2009 Ack=93281 Win=65728 Len=0 TSval=100352 TSecr=4094247454"
"168","0.700807","172.16.3.2","172.16.2.2","TCP","66","22  >  31340 [ACK] Seq=2009 Ack=96145 Win=65728 Len=0 TSval=100352 TSecr=4094247454"
"169","0.700820","172.16.3.2","172.16.2.2","MPTCP","74","22  >  31340 [ACK] Seq=2009 Ack=97577 Win=65728 Len=0 TSval=100352 TSecr=4094247454"
"170","0.701378","172.16.3.2","172.16.2.2","TCP","66","22  >  31340 [ACK] Seq=2009 Ack=100441 Win=65728 Len=0 TSval=100363 TSecr=4094247454"
"171","0.701602","172.16.3.2","172.16.2.2","MPTCP","74","22  >  31340 [ACK] Seq=2009 Ack=101873 Win=65728 Len=0 TSval=100363 TSecr=4094247454"
"172","0.712326","172.16.2.2","172.16.3.2","SSH","1514","Client: Encrypted packet (len=1432)"
"173","0.720849","172.16.3.2","172.16.2.2","TCP","66","22  >  31340 [ACK] Seq=2009 Ack=104737 Win=65728 Len=0 TSval=100372 TSecr=4094247454"
"174","0.721745","172.16.3.2","172.16.2.2","TCP","66","22  >  31340 [ACK] Seq=2009 Ack=107433 Win=65728 Len=0 TSval=100389 TSecr=4094247454"
"175","0.721779","172.16.2.2","172.16.3.2","SSH","1514","Client: Encrypted packet (len=1432)"
"176","0.721790","172.16.3.2","172.16.2.2","MPTCP","74","[TCP Dup ACK 174#1] 22  >  31340 [ACK] Seq=2009 Ack=107433 Win=65728 Len=0 TSval=100389 TSecr=4094247454"
"177","0.723011","172.16.2.2","172.16.3.2","SSH","1514","Client: Encrypted packet (len=1432)"
"178","0.723046","172.16.2.2","172.16.3.2","SSH","1514","Client: Encrypted packet (len=1432)"
"179","0.723153","172.16.2.2","172.16.3.2","SSH","1514","Client: Encrypted packet (len=1432)"
"180","0.723171","172.16.2.2","172.16.3.2","SSH","1514","Client: Encrypted packet (len=1432)"
"181","0.723188","172.16.2.2","172.16.3.2","SSH","1514","Client: Encrypted packet (len=1432)"
"182","0.723198","172.16.3.2","172.16.2.2","MPTCP","74","22  >  31340 [ACK] Seq=2009 Ack=108865 Win=65728 Len=0 TSval=100392 TSecr=4094247554"
"183","0.723204","172.16.2.2","172.16.3.2","SSH","1514","Client: Encrypted packet (len=1432)"
"184","0.723291","172.16.2.2","172.16.3.2","SSH","1514","Client: Encrypted packet (len=1432)"
"185","0.723321","172.16.2.2","172.16.3.2","SSH","1514","Client: Encrypted packet (len=1432)"
"186","0.723410","172.16.2.2","172.16.3.2","SSH","1514","Client: Encrypted packet (len=1432)"
"187","0.723432","172.16.2.2","172.16.3.2","SSH","1514","Client: Encrypted packet (len=1432)"
"188","0.723452","172.16.2.2","172.16.3.2","SSH","1514","Client: Encrypted packet (len=1432)"
"189","0.723563","172.16.2.2","172.16.3.2","SSH","1514","Client: Encrypted packet (len=1432)"
"190","0.723579","172.16.2.2","172.16.3.2","SSH","1514","Client: Encrypted packet (len=1432)"
"191","0.723592","172.16.2.2","172.16.3.2","SSH","1514","Client: Encrypted packet (len=1432)"
"192","0.723608","172.16.2.2","172.16.3.2","SSH","1514","Client: Encrypted packet (len=1432)"
"193","0.723648","172.16.2.2","172.16.3.2","SSH","1514","Client: Encrypted packet (len=1432)"
"194","0.723663","172.16.2.2","172.16.3.2","SSH","1514","Client: Encrypted packet (len=1432)"
"195","0.723677","172.16.2.2","172.16.3.2","SSH","1514","Client: Encrypted packet (len=1432)"
"196","0.723761","172.16.2.2","172.16.3.2","SSH","1514","Client: Encrypted packet (len=1432)"
"197","0.723777","172.16.2.2","172.16.3.2","SSH","1514","Client: Encrypted packet (len=1432)"
"198","0.723791","172.16.2.2","172.16.3.2","SSH","1514","Client: Encrypted packet (len=1432)"
"199","0.740380","172.16.3.2","172.16.2.2","TCP","66","22  >  31340 [ACK] Seq=2009 Ack=111729 Win=65728 Len=0 TSval=100402 TSecr=4094247554"
"200","0.741341","172.16.3.2","172.16.2.2","TCP","66","22  >  31340 [ACK] Seq=2009 Ack=114593 Win=65728 Len=0 TSval=100402 TSecr=4094247554"
"201","0.741950","172.16.3.2","172.16.2.2","MPTCP","74","22  >  31340 [ACK] Seq=2009 Ack=116025 Win=65728 Len=0 TSval=100402 TSecr=4094247554"
"202","0.760678","172.16.3.2","172.16.2.2","TCP","66","22  >  31340 [ACK] Seq=2009 Ack=118889 Win=65728 Len=0 TSval=100412 TSecr=4094247554"
"203","0.761338","172.16.3.2","172.16.2.2","TCP","66","22  >  31340 [ACK] Seq=2009 Ack=121753 Win=65728 Len=0 TSval=100422 TSecr=4094247554"
"204","0.761641","172.16.3.2","172.16.2.2","MPTCP","74","22  >  31340 [ACK] Seq=2009 Ack=123185 Win=65728 Len=0 TSval=100422 TSecr=4094247554"
"205","0.781527","172.16.3.2","172.16.2.2","TCP","66","22  >  31340 [ACK] Seq=2009 Ack=126049 Win=65728 Len=0 TSval=100432 TSecr=4094247554"
"206","0.782334","172.16.3.2","172.16.2.2","TCP","66","22  >  31340 [ACK] Seq=2009 Ack=128913 Win=65728 Len=0 TSval=100445 TSecr=4094247554"
"207","0.782347","172.16.3.2","172.16.2.2","MPTCP","74","22  >  31340 [ACK] Seq=2009 Ack=130345 Win=65728 Len=0 TSval=100452 TSecr=4094247554"
"208","0.800955","172.16.3.2","172.16.2.2","TCP","66","22  >  31340 [ACK] Seq=2009 Ack=133209 Win=65728 Len=0 TSval=100452 TSecr=4094247554"
"209","0.801729","172.16.3.2","172.16.2.2","TCP","66","22  >  31340 [ACK] Seq=2009 Ack=136073 Win=65728 Len=0 TSval=100472 TSecr=4094247554"
"210","0.801926","172.16.3.2","172.16.2.2","MPTCP","74","22  >  31340 [ACK] Seq=2009 Ack=137505 Win=65728 Len=0 TSval=100472 TSecr=4094247554"
"211","0.850231","172.16.3.2","172.16.2.2","TCP","66","22  >  31340 [ACK] Seq=2009 Ack=138937 Win=65728 Len=0 TSval=100516 TSecr=4094247554"
"212","0.850265","172.16.2.2","172.16.3.2","SSH","1346","Client: Encrypted packet (len=1264)"
"213","0.870188","172.16.3.2","172.16.2.2","MPTCP","74","22  >  31340 [ACK] Seq=2009 Ack=140201 Win=65728 Len=0 TSval=100532 TSecr=4094247684"
"214","0.870218","172.16.3.2","172.16.2.2","SSH","118","Server: Encrypted packet (len=36)"
"215","0.871293","172.16.2.2","172.16.3.2","SSH","1514","Client: Encrypted packet (len=1432)"
"216","0.871331","172.16.2.2","172.16.3.2","SSH","1514","Client: Encrypted packet (len=1432)"
"217","0.871381","172.16.2.2","172.16.3.2","SSH","1514","Client: Encrypted packet (len=1432)"
"218","0.871409","172.16.2.2","172.16.3.2","SSH","1514","Client: Encrypted packet (len=1432)"
"219","0.871429","172.16.2.2","172.16.3.2","SSH","1514","Client: Encrypted packet (len=1432)"
"220","0.871457","172.16.2.2","172.16.3.2","SSH","1514","Client: Encrypted packet (len=1432)"
"221","0.871511","172.16.2.2","172.16.3.2","SSH","1514","Client: Encrypted packet (len=1432)"
"222","0.871531","172.16.2.2","172.16.3.2","SSH","1514","Client: Encrypted packet (len=1432)"
"223","0.871568","172.16.2.2","172.16.3.2","SSH","1514","Client: Encrypted packet (len=1432)"
"224","0.871655","172.16.2.2","172.16.3.2","SSH","1514","Client: Encrypted packet (len=1432)"
"225","0.871750","172.16.2.2","172.16.3.2","SSH","1514","Client: Encrypted packet (len=1432)"
"226","0.871795","172.16.2.2","172.16.3.2","SSH","1514","Client: Encrypted packet (len=1432)"
"227","0.871812","172.16.2.2","172.16.3.2","SSH","1514","Client: Encrypted packet (len=1432)"
"228","0.871837","172.16.2.2","172.16.3.2","SSH","1514","Client: Encrypted packet (len=1432)"
"229","0.871859","172.16.2.2","172.16.3.2","SSH","1514","Client: Encrypted packet (len=1432)"
"230","0.871891","172.16.2.2","172.16.3.2","SSH","1514","Client: Encrypted packet (len=1432)"
"231","0.871926","172.16.2.2","172.16.3.2","SSH","1514","Client: Encrypted packet (len=1432)"
"232","0.871946","172.16.2.2","172.16.3.2","SSH","1514","Client: Encrypted packet (len=1432)"
"233","0.871970","172.16.2.2","172.16.3.2","SSH","1514","Client: Encrypted packet (len=1432)"
"234","0.871990","172.16.2.2","172.16.3.2","SSH","1514","Client: Encrypted packet (len=1432)"
"235","0.872023","172.16.2.2","172.16.3.2","SSH","1514","Client: Encrypted packet (len=1432)"
"236","0.872057","172.16.2.2","172.16.3.2","SSH","1514","Client: Encrypted packet (len=1432)"
"237","0.872073","172.16.2.2","172.16.3.2","SSH","1346","Client: Encrypted packet (len=1264)"
"238","0.890629","172.16.3.2","172.16.2.2","TCP","66","22  >  31340 [ACK] Seq=2045 Ack=141633 Win=65728 Len=0 TSval=100552 TSecr=4094247704"
"239","0.890646","172.16.3.2","172.16.2.2","MPTCP","74","22  >  31340 [ACK] Seq=2045 Ack=143065 Win=65728 Len=0 TSval=100552 TSecr=4094247704"
"240","0.892286","172.16.3.2","172.16.2.2","TCP","66","22  >  31340 [ACK] Seq=2045 Ack=145929 Win=65728 Len=0 TSval=100562 TSecr=4094247704"
"241","0.910838","172.16.3.2","172.16.2.2","TCP","66","22  >  31340 [ACK] Seq=2045 Ack=148793 Win=65728 Len=0 TSval=100562 TSecr=4094247704"
"242","0.910849","172.16.3.2","172.16.2.2","MPTCP","74","22  >  31340 [ACK] Seq=2045 Ack=150225 Win=65728 Len=0 TSval=100562 TSecr=4094247704"
"243","0.911514","172.16.3.2","172.16.2.2","TCP","66","22  >  31340 [ACK] Seq=2045 Ack=153089 Win=65728 Len=0 TSval=100581 TSecr=4094247704"
"244","0.931449","172.16.3.2","172.16.2.2","TCP","66","22  >  31340 [ACK] Seq=2045 Ack=155953 Win=65728 Len=0 TSval=100589 TSecr=4094247704"
"245","0.931459","172.16.3.2","172.16.2.2","MPTCP","74","22  >  31340 [ACK] Seq=2045 Ack=157385 Win=65728 Len=0 TSval=100589 TSecr=4094247704"
"246","0.932051","172.16.3.2","172.16.2.2","TCP","66","22  >  31340 [ACK] Seq=2045 Ack=160249 Win=65728 Len=0 TSval=100602 TSecr=4094247704"
"247","0.951121","172.16.3.2","172.16.2.2","TCP","66","22  >  31340 [ACK] Seq=2045 Ack=163113 Win=65728 Len=0 TSval=100602 TSecr=4094247704"
"248","0.951138","172.16.3.2","172.16.2.2","MPTCP","74","22  >  31340 [ACK] Seq=2045 Ack=164545 Win=65728 Len=0 TSval=100602 TSecr=4094247704"
"249","0.952067","172.16.3.2","172.16.2.2","TCP","66","22  >  31340 [ACK] Seq=2045 Ack=167409 Win=65728 Len=0 TSval=100613 TSecr=4094247704"
"250","0.952076","172.16.3.2","172.16.2.2","MPTCP","74","22  >  31340 [ACK] Seq=2045 Ack=168841 Win=65728 Len=0 TSval=100622 TSecr=4094247704"
"251","0.970902","172.16.3.2","172.16.2.2","TCP","66","22  >  31340 [ACK] Seq=2045 Ack=171705 Win=65728 Len=0 TSval=100622 TSecr=4094247704"
"252","0.971751","172.16.3.2","172.16.2.2","MPTCP","74","22  >  31340 [ACK] Seq=2045 Ack=172969 Win=65728 Len=0 TSval=100641 TSecr=4094247704"
"253","0.974279","172.16.3.2","172.16.2.2","MPTCP","74","[TCP Dup ACK 252#1] 22  >  31340 [ACK] Seq=2045 Ack=172969 Win=65728 Len=0 TSval=100642 TSecr=4094247704"
"254","0.974951","172.16.2.2","172.16.3.2","SSH","1514","Client: Encrypted packet (len=1432)"
"255","0.974968","172.16.2.2","172.16.3.2","SSH","1514","Client: Encrypted packet (len=1432)"
"256","0.974979","172.16.2.2","172.16.3.2","SSH","1514","Client: Encrypted packet (len=1432)"
"257","0.976269","172.16.3.2","172.16.2.2","TCP","66","22  >  31340 [ACK] Seq=2045 Ack=175833 Win=65728 Len=0 TSval=100642 TSecr=4094247804"
"258","1.000920","172.16.3.2","172.16.2.2","MPTCP","74","22  >  31340 [ACK] Seq=2045 Ack=177265 Win=65728 Len=0 TSval=100655 TSecr=4094247804"
"259","1.020552","172.16.3.2","172.16.2.2","MPTCP","74","[TCP Dup ACK 258#1] 22  >  31340 [ACK] Seq=2045 Ack=177265 Win=65728 Len=0 TSval=100681 TSecr=4094247804"
"260","1.021655","172.16.2.2","172.16.3.2","SSH","1514","Client: Encrypted packet (len=1432)"
"261","1.021693","172.16.2.2","172.16.3.2","SSH","1514","Client: Encrypted packet (len=1432)"
"262","1.021705","172.16.2.2","172.16.3.2","SSH","1514","Client: Encrypted packet (len=1432)"
"263","1.021744","172.16.2.2","172.16.3.2","SSH","1514","Client: Encrypted packet (len=1432)"
"264","1.021773","172.16.2.2","172.16.3.2","SSH","1514","Client: Encrypted packet (len=1432)"
"265","1.021837","172.16.2.2","172.16.3.2","SSH","1514","Client: Encrypted packet (len=1432)"
"266","1.021870","172.16.2.2","172.16.3.2","SSH","1514","Client: Encrypted packet (len=1432)"
"267","1.021898","172.16.2.2","172.16.3.2","SSH","1346","Client: Encrypted packet (len=1264)"
"268","1.040314","172.16.3.2","172.16.2.2","MPTCP","74","[TCP Dup ACK 258#2] 22  >  31340 [ACK] Seq=2045 Ack=177265 Win=65728 Len=0 TSval=100700 TSecr=4094247804"
"269","1.040336","172.16.3.2","172.16.2.2","TCP","66","22  >  31340 [ACK] Seq=2045 Ack=180129 Win=65728 Len=0 TSval=100700 TSecr=4094247854"
"270","1.040492","172.16.3.2","172.16.2.2","MPTCP","74","[TCP Dup ACK 269#1] 22  >  31340 [ACK] Seq=2045 Ack=180129 Win=65728 Len=0 TSval=100710 TSecr=4094247854"
"271","1.041070","172.16.3.2","172.16.2.2","TCP","66","22  >  31340 [ACK] Seq=2045 Ack=182993 Win=65728 Len=0 TSval=100710 TSecr=4094247854"
"272","1.041090","172.16.3.2","172.16.2.2","MPTCP","74","22  >  31340 [ACK] Seq=2045 Ack=184425 Win=65728 Len=0 TSval=100710 TSecr=4094247854"
"273","1.059897","172.16.3.2","172.16.2.2","TCP","66","22  >  31340 [ACK] Seq=2045 Ack=187289 Win=65728 Len=0 TSval=100716 TSecr=4094247854"
"274","1.059919","172.16.3.2","172.16.2.2","MPTCP","74","[TCP Dup ACK 273#1] 22  >  31340 [ACK] Seq=2045 Ack=187289 Win=65728 Len=0 TSval=100716 TSecr=4094247854"
"275","1.059948","172.16.3.2","172.16.2.2","MPTCP","74","[TCP Dup ACK 273#2] 22  >  31340 [ACK] Seq=2045 Ack=187289 Win=65728 Len=0 TSval=100716 TSecr=4094247854"
"276","1.081000","172.16.3.2","172.16.2.2","MPTCP","74","22  >  31340 [ACK] Seq=2045 Ack=188553 Win=65728 Len=0 TSval=100740 TSecr=4094247854"
"277","1.100069","172.16.3.2","172.16.2.2","MPTCP","74","[TCP Dup ACK 276#1] 22  >  31340 [ACK] Seq=2045 Ack=188553 Win=65728 Len=0 TSval=100760 TSecr=4094247854"
"278","1.121137","172.16.3.2","172.16.2.2","MPTCP","74","[TCP Dup ACK 276#2] 22  >  31340 [ACK] Seq=2045 Ack=188553 Win=65728 Len=0 TSval=100781 TSecr=4094247854"
"279","1.122712","172.16.2.2","172.16.3.2","SSH","1514","Client: Encrypted packet (len=1432)"
"280","1.122728","172.16.2.2","172.16.3.2","SSH","1514","Client: Encrypted packet (len=1432)"
"281","1.122738","172.16.2.2","172.16.3.2","SSH","1514","Client: Encrypted packet (len=1432)"
"282","1.122747","172.16.2.2","172.16.3.2","SSH","1514","Client: Encrypted packet (len=1432)"
"283","1.122758","172.16.2.2","172.16.3.2","SSH","1514","Client: Encrypted packet (len=1432)"
"284","1.140674","172.16.3.2","172.16.2.2","MPTCP","74","[TCP Dup ACK 276#3] 22  >  31340 [ACK] Seq=2045 Ack=188553 Win=65728 Len=0 TSval=100795 TSecr=4094247854"
"285","1.140707","172.16.3.2","172.16.2.2","TCP","66","22  >  31340 [ACK] Seq=2045 Ack=191417 Win=65728 Len=0 TSval=100795 TSecr=4094247955"
"286","1.141557","172.16.3.2","172.16.2.2","TCP","66","22  >  31340 [ACK] Seq=2045 Ack=194281 Win=65728 Len=0 TSval=100811 TSecr=4094247955"
"287","1.160930","172.16.3.2","172.16.2.2","MPTCP","74","22  >  31340 [ACK] Seq=2045 Ack=195713 Win=65728 Len=0 TSval=100821 TSecr=4094247955"
"288","1.180635","172.16.3.2","172.16.2.2","MPTCP","74","[TCP Dup ACK 287#1] 22  >  31340 [ACK] Seq=2045 Ack=195713 Win=65728 Len=0 TSval=100836 TSecr=4094247955"
"289","1.201043","172.16.3.2","172.16.2.2","MPTCP","74","[TCP Dup ACK 287#2] 22  >  31340 [ACK] Seq=2045 Ack=195713 Win=65728 Len=0 TSval=100861 TSecr=4094247955"
"290","1.220725","172.16.3.2","172.16.2.2","MPTCP","74","[TCP Dup ACK 287#3] 22  >  31340 [ACK] Seq=2045 Ack=195713 Win=65728 Len=0 TSval=100876 TSecr=4094247955"
"291","1.220746","172.16.3.2","172.16.2.2","MPTCP","74","[TCP Dup ACK 287#4] 22  >  31340 [ACK] Seq=2045 Ack=195713 Win=65728 Len=0 TSval=100889 TSecr=4094247955"
"292","1.221176","172.16.2.2","172.16.3.2","MPTCP","74","[TCP Dup ACK 215#1] 31340  >  22 [ACK] Seq=195713 Ack=2045 Win=65728 Len=0 TSval=4094248054 TSecr=100889"
"293","1.222421","172.16.2.2","172.16.3.2","SSH","1514","Client: Encrypted packet (len=1432)"
"294","1.222500","172.16.2.2","172.16.3.2","SSH","1514","Client: Encrypted packet (len=1432)"
"295","1.222550","172.16.2.2","172.16.3.2","SSH","1514","Client: Encrypted packet (len=1432)"
"296","1.222632","172.16.2.2","172.16.3.2","SSH","1514","Client: Encrypted packet (len=1432)"
"297","1.222656","172.16.2.2","172.16.3.2","SSH","1514","Client: Encrypted packet (len=1432)"
"298","1.222731","172.16.2.2","172.16.3.2","SSH","1514","Client: Encrypted packet (len=1432)"
"299","1.222798","172.16.2.2","172.16.3.2","SSH","1514","Client: Encrypted packet (len=1432)"
"300","1.222846","172.16.2.2","172.16.3.2","SSH","1514","Client: Encrypted packet (len=1432)"
"301","1.222930","172.16.2.2","172.16.3.2","SSH","1514","Client: Encrypted packet (len=1432)"
"302","1.222985","172.16.2.2","172.16.3.2","SSH","1346","Client: Encrypted packet (len=1264)"
"303","1.240297","172.16.3.2","172.16.2.2","TCP","66","22  >  31340 [ACK] Seq=2045 Ack=198577 Win=65728 Len=0 TSval=100900 TSecr=4094248054"
"304","1.240798","172.16.3.2","172.16.2.2","TCP","66","22  >  31340 [ACK] Seq=2045 Ack=201441 Win=65728 Len=0 TSval=100910 TSecr=4094248054"
"305","1.260163","172.16.3.2","172.16.2.2","TCP","66","22  >  31340 [ACK] Seq=2045 Ack=204305 Win=65728 Len=0 TSval=100916 TSecr=4094248054"
"306","1.260170","172.16.3.2","172.16.2.2","MPTCP","74","22  >  31340 [ACK] Seq=2045 Ack=205737 Win=65728 Len=0 TSval=100916 TSecr=4094248054"
"307","1.260933","172.16.3.2","172.16.2.2","TCP","66","22  >  31340 [ACK] Seq=2045 Ack=208601 Win=65728 Len=0 TSval=100922 TSecr=4094248054"
"308","1.280463","172.16.3.2","172.16.2.2","MPTCP","74","22  >  31340 [ACK] Seq=2045 Ack=209865 Win=65728 Len=0 TSval=100941 TSecr=4094248054"
"309","1.281432","172.16.3.2","172.16.2.2","MPTCP","74","[TCP Dup ACK 308#1] 22  >  31340 [ACK] Seq=2045 Ack=209865 Win=65728 Len=0 TSval=100951 TSecr=4094248054"
"310","1.281500","172.16.2.2","172.16.3.2","SSH","1514","Client: Encrypted packet (len=1432)"
"311","1.281530","172.16.2.2","172.16.3.2","SSH","1514","Client: Encrypted packet (len=1432)"
"312","1.281544","172.16.2.2","172.16.3.2","SSH","1514","Client: Encrypted packet (len=1432)"
"313","1.281560","172.16.2.2","172.16.3.2","SSH","1514","Client: Encrypted packet (len=1432)"
"314","1.281585","172.16.2.2","172.16.3.2","SSH","1514","Client: Encrypted packet (len=1432)"
"315","1.300905","172.16.3.2","172.16.2.2","TCP","66","22  >  31340 [ACK] Seq=2045 Ack=212729 Win=65728 Len=0 TSval=100962 TSecr=4094248114"
"316","1.300942","172.16.3.2","172.16.2.2","MPTCP","74","[TCP Dup ACK 315#1] 22  >  31340 [ACK] Seq=2045 Ack=212729 Win=65728 Len=0 TSval=100962 TSecr=4094248114"
"317","1.301566","172.16.3.2","172.16.2.2","TCP","66","22  >  31340 [ACK] Seq=2045 Ack=215593 Win=65728 Len=0 TSval=100962 TSecr=4094248114"
"318","1.330674","172.16.3.2","172.16.2.2","MPTCP","74","22  >  31340 [ACK] Seq=2045 Ack=217025 Win=65728 Len=0 TSval=100989 TSecr=4094248114"
"319","1.331921","172.16.2.2","172.16.3.2","SSH","1514","Client: Encrypted packet (len=1432)"
"320","1.331958","172.16.2.2","172.16.3.2","SSH","1514","Client: Encrypted packet (len=1432)"
"321","1.331984","172.16.2.2","172.16.3.2","SSH","1514","Client: Encrypted packet (len=1432)"
"322","1.332127","172.16.2.2","172.16.3.2","SSH","1514","Client: Encrypted packet (len=1432)"
"323","1.332165","172.16.2.2","172.16.3.2","SSH","1514","Client: Encrypted packet (len=1432)"
"324","1.350950","172.16.3.2","172.16.2.2","MPTCP","74","[TCP Dup ACK 318#1] 22  >  31340 [ACK] Seq=2045 Ack=217025 Win=65728 Len=0 TSval=101005 TSecr=4094248114"
"325","1.351003","172.16.3.2","172.16.2.2","TCP","66","22  >  31340 [ACK] Seq=2045 Ack=219889 Win=65728 Len=0 TSval=101005 TSecr=4094248164"
"326","1.351692","172.16.3.2","172.16.2.2","TCP","66","22  >  31340 [ACK] Seq=2045 Ack=222753 Win=65728 Len=0 TSval=101021 TSecr=4094248164"
"327","1.370855","172.16.3.2","172.16.2.2","MPTCP","74","22  >  31340 [ACK] Seq=2045 Ack=224185 Win=65728 Len=0 TSval=101032 TSecr=4094248164"
"328","1.370887","172.16.3.2","172.16.2.2","MPTCP","74","[TCP Dup ACK 327#1] 22  >  31340 [ACK] Seq=2045 Ack=224185 Win=65728 Len=0 TSval=101032 TSecr=4094248164"
"329","1.381412","172.16.2.2","172.16.3.2","SSH","1514","Client: Encrypted packet (len=1432)"
"330","1.381489","172.16.2.2","172.16.3.2","SSH","1514","Client: Encrypted packet (len=1432)"
"331","1.389662","172.16.3.2","172.16.2.2","MPTCP","74","[TCP Dup ACK 327#2] 22  >  31340 [ACK] Seq=2045 Ack=224185 Win=65728 Len=0 TSval=101045 TSecr=4094248164"
"332","1.390570","172.16.3.2","172.16.2.2","MPTCP","74","[TCP Dup ACK 327#3] 22  >  31340 [ACK] Seq=2045 Ack=224185 Win=65728 Len=0 TSval=101061 TSecr=4094248164"
"333","1.390612","172.16.3.2","172.16.2.2","TCP","66","22  >  31340 [ACK] Seq=2045 Ack=227049 Win=65728 Len=0 TSval=101061 TSecr=4094248214"
"334","1.391756","172.16.2.2","172.16.3.2","SSH","1514","Client: Encrypted packet (len=1432)"
"335","1.391773","172.16.2.2","172.16.3.2","SSH","1514","Client: Encrypted packet (len=1432)"
"336","1.391783","172.16.2.2","172.16.3.2","SSH","1514","Client: Encrypted packet (len=1432)"
"337","1.409940","172.16.3.2","172.16.2.2","TCP","66","22  >  31340 [ACK] Seq=2045 Ack=229913 Win=65728 Len=0 TSval=101070 TSecr=4094248224"
"338","1.409955","172.16.3.2","172.16.2.2","MPTCP","74","22  >  31340 [ACK] Seq=2045 Ack=231345 Win=65728 Len=0 TSval=101080 TSecr=4094248224"
"339","1.410784","172.16.2.2","172.16.3.2","SSH","1514","Client: Encrypted packet (len=1432)"
"340","1.410818","172.16.2.2","172.16.3.2","SSH","1514","Client: Encrypted packet (len=1432)"
"341","1.410913","172.16.2.2","172.16.3.2","SSH","1514","Client: Encrypted packet (len=1432)"
