"No.","Time","Source","Destination","Protocol","Length","Info"
"1","0.000000","172.16.2.2","172.16.3.2","MPTCP","86","33921  >  22 [SYN] Seq=0 Win=65535 Len=0 MSS=1460 WS=64 SACK_PERM TSval=1819614038 TSecr=0"
"2","0.019177","172.16.3.2","172.16.2.2","MPTCP","90","22  >  33921 [SYN, ACK, ECE] Seq=0 Ack=1 Win=65535 Len=0 MSS=1460 WS=64 TSval=4990811 TSecr=1819614038"
"3","0.019370","172.16.2.2","172.16.3.2","MPTCP","90","33921  >  22 [ACK] Seq=1 Ack=1 Win=65728 Len=0 TSval=1819614055 TSecr=4990811"
"4","0.039094","172.16.3.2","172.16.2.2","TCP","66","[TCP Window Update] 22  >  33921 [ACK] Seq=1 Ack=1 Win=65728 Len=0 TSval=4990831 TSecr=1819614055"
"5","0.039109","172.16.3.2","172.16.2.2","MPTCP","74","[TCP Dup ACK 2#1] 22  >  33921 [ACK] Seq=1 Ack=1 Win=65728 Len=0 TSval=4990835 TSecr=1819614055"
"6","0.079126","172.16.3.2","172.16.2.2","MPTCP","74","22  >  33921 [ACK] Seq=1 Ack=1 Win=65728 Len=0 TSval=4990873 TSecr=1819614055"
"7","0.109850","172.16.3.2","172.16.2.2","SSH","150","Server: Encrypted packet (len=68)"
"8","0.111420","172.16.2.2","172.16.3.2","SSH","582","Client: Encrypted packet (len=500)"
"9","0.129105","172.16.3.2","172.16.2.2","TCP","66","22  >  33921 [ACK] Seq=69 Ack=501 Win=65728 Len=0 TSval=4990918 TSecr=1819614148"
"10","0.129123","172.16.3.2","172.16.2.2","MPTCP","74","[TCP Dup ACK 9#1] 22  >  33921 [ACK] Seq=69 Ack=501 Win=65728 Len=0 TSval=4990918 TSecr=1819614148"
"11","0.130771","172.16.2.2","172.16.3.2","MPTCP","74","[TCP Dup ACK 8#1] 33921  >  22 [ACK] Seq=501 Ack=69 Win=65728 Len=0 TSval=1819614163 TSecr=4990918"
"12","0.169451","172.16.3.2","172.16.2.2","SSH","110","Server: Encrypted packet (len=28)"
"13","0.171660","172.16.2.2","172.16.3.2","SSH","194","Client: Encrypted packet (len=112)"
"14","0.188797","172.16.3.2","172.16.2.2","SSH","222","Server: Encrypted packet (len=140)"
"15","0.188839","172.16.2.2","172.16.3.2","TCP","66","33921  >  22 [ACK] Seq=613 Ack=237 Win=65728 Len=0 TSval=1819614227 TSecr=4990981"
"16","0.207775","172.16.3.2","172.16.2.2","SSH","126","Server: Encrypted packet (len=44)"
"17","0.208613","172.16.2.2","172.16.3.2","MPTCP","74","33921  >  22 [ACK] Seq=613 Ack=281 Win=65728 Len=0 TSval=1819614242 TSecr=4991002"
"18","0.209247","172.16.2.2","172.16.3.2","SSH","174","Client: Encrypted packet (len=92)"
"19","0.228694","172.16.3.2","172.16.2.2","MPTCP","74","22  >  33921 [ACK] Seq=281 Ack=705 Win=65728 Len=0 TSval=4991022 TSecr=1819614242"
"20","0.230235","172.16.2.2","172.16.3.2","MPTCP","74","[TCP Dup ACK 17#1] 33921  >  22 [ACK] Seq=705 Ack=281 Win=65728 Len=0 TSval=1819614262 TSecr=4991022"
"21","0.230984","172.16.3.2","172.16.2.2","SSH","126","Server: Encrypted packet (len=44)"
"22","0.252508","172.16.2.2","172.16.3.2","SSH","150","Client: Encrypted packet (len=68)"
"23","0.268618","172.16.3.2","172.16.2.2","SSH","158","Server: Encrypted packet (len=76)"
"24","0.268674","172.16.2.2","172.16.3.2","TCP","66","33921  >  22 [ACK] Seq=773 Ack=401 Win=65728 Len=0 TSval=1819614302 TSecr=4991055"
"25","0.270443","172.16.2.2","172.16.3.2","MPTCP","74","[TCP Dup ACK 24#1] 33921  >  22 [ACK] Seq=773 Ack=401 Win=65728 Len=0 TSval=1819614302 TSecr=4991055"
"26","0.289558","172.16.3.2","172.16.2.2","SSH","126","Server: Encrypted packet (len=44)"
"27","0.308549","172.16.3.2","172.16.2.2","MPTCP","74","[TCP Dup ACK 23#1] 22  >  33921 [ACK] Seq=445 Ack=773 Win=65728 Len=0 TSval=4991103 TSecr=1819614302"
"28","0.312714","172.16.2.2","172.16.3.2","SSH","1514","Client: Encrypted packet (len=1432)"
"29","0.312750","172.16.2.2","172.16.3.2","SSH","1514","Client: Encrypted packet (len=1432)"
"30","0.312778","172.16.2.2","172.16.3.2","SSH","1514","Client: Encrypted packet (len=1432)"
"31","0.312811","172.16.2.2","172.16.3.2","SSH","1514","Client: Encrypted packet (len=1432)"
"32","0.312828","172.16.2.2","172.16.3.2","SSH","1514","Client: Encrypted packet (len=1432)"
"33","0.312888","172.16.2.2","172.16.3.2","SSH","1150","Client: Encrypted packet (len=1068)"
"34","0.327753","172.16.3.2","172.16.2.2","TCP","66","22  >  33921 [ACK] Seq=445 Ack=2205 Win=65728 Len=0 TSval=4991122 TSecr=1819614342"
"35","0.327776","172.16.3.2","172.16.2.2","MPTCP","74","22  >  33921 [ACK] Seq=445 Ack=3637 Win=65728 Len=0 TSval=4991122 TSecr=1819614342"
"36","0.328571","172.16.3.2","172.16.2.2","TCP","66","22  >  33921 [ACK] Seq=445 Ack=6501 Win=65728 Len=0 TSval=4991122 TSecr=1819614342"
"37","0.331414","172.16.2.2","172.16.3.2","SSH","1514","Client: Encrypted packet (len=1432)"
"38","0.331450","172.16.2.2","172.16.3.2","SSH","1514","Client: Encrypted packet (len=1432)"
"39","0.350014","172.16.3.2","172.16.2.2","TCP","66","22  >  33921 [ACK] Seq=445 Ack=9001 Win=65728 Len=0 TSval=4991132 TSecr=1819614342"
"40","0.350024","172.16.3.2","172.16.2.2","MPTCP","74","22  >  33921 [ACK] Seq=445 Ack=10433 Win=65728 Len=0 TSval=4991132 TSecr=1819614361"
"41","0.350794","172.16.3.2","172.16.2.2","MPTCP","74","22  >  33921 [ACK] Seq=445 Ack=11865 Win=65728 Len=0 TSval=4991152 TSecr=1819614361"
"42","0.350822","172.16.2.2","172.16.3.2","SSH","1514","Client: Encrypted packet (len=1432)"
"43","0.351779","172.16.3.2","172.16.2.2","MPTCP","74","22  >  33921 [ACK] Seq=445 Ack=13297 Win=65728 Len=0 TSval=4991152 TSecr=1819614381"
"44","0.352825","172.16.3.2","172.16.2.2","MPTCP","74","[TCP Dup ACK 43#1] 22  >  33921 [ACK] Seq=445 Ack=13297 Win=65728 Len=0 TSval=4991152 TSecr=1819614381"
"45","0.378676","172.16.3.2","172.16.2.2","MPTCP","74","[TCP Dup ACK 43#2] 22  >  33921 [ACK] Seq=445 Ack=13297 Win=65728 Len=0 TSval=4991173 TSecr=1819614381"
"46","0.380429","172.16.3.2","172.16.2.2","MPTCP","74","[TCP Dup ACK 43#3] 22  >  33921 [ACK] Seq=445 Ack=13297 Win=65728 Len=0 TSval=4991183 TSecr=1819614381"
"47","0.399351","172.16.3.2","172.16.2.2","MPTCP","74","[TCP Dup ACK 43#4] 22  >  33921 [ACK] Seq=445 Ack=13297 Win=65728 Len=0 TSval=4991193 TSecr=1819614381"
"48","0.401191","172.16.3.2","172.16.2.2","MPTCP","74","[TCP Dup ACK 43#5] 22  >  33921 [ACK] Seq=445 Ack=13297 Win=65728 Len=0 TSval=4991203 TSecr=1819614381"
"49","0.401873","172.16.2.2","172.16.3.2","SSH","1514","Client: Encrypted packet (len=1432)"
"50","0.401898","172.16.2.2","172.16.3.2","SSH","1514","Client: Encrypted packet (len=1432)"
"51","0.401958","172.16.2.2","172.16.3.2","SSH","1514","Client: Encrypted packet (len=1432)"
"52","0.401979","172.16.2.2","172.16.3.2","SSH","1514","Client: Encrypted packet (len=1432)"
"53","0.402040","172.16.2.2","172.16.3.2","SSH","1514","Client: Encrypted packet (len=1432)"
"54","0.402072","172.16.2.2","172.16.3.2","SSH","1514","Client: Encrypted packet (len=1432)"
"55","0.402105","172.16.2.2","172.16.3.2","SSH","1514","Client: Encrypted packet (len=1432)"
"56","0.402165","172.16.2.2","172.16.3.2","SSH","278","Client: Encrypted packet (len=196)"
"57","0.411573","172.16.2.2","172.16.3.2","SSH","1514","Client: Encrypted packet (len=1432)"
"58","0.411597","172.16.2.2","172.16.3.2","SSH","1514","Client: Encrypted packet (len=1432)"
"59","0.411614","172.16.2.2","172.16.3.2","SSH","1514","Client: Encrypted packet (len=1432)"
"60","0.411633","172.16.2.2","172.16.3.2","SSH","1514","Client: Encrypted packet (len=1432)"
"61","0.411670","172.16.2.2","172.16.3.2","SSH","1514","Client: Encrypted packet (len=1432)"
"62","0.411714","172.16.2.2","172.16.3.2","SSH","1514","Client: Encrypted packet (len=1432)"
"63","0.411744","172.16.2.2","172.16.3.2","SSH","1514","Client: Encrypted packet (len=1432)"
"64","0.419531","172.16.3.2","172.16.2.2","TCP","66","22  >  33921 [ACK] Seq=445 Ack=16161 Win=65728 Len=0 TSval=4991212 TSecr=1819614437"
"65","0.419557","172.16.3.2","172.16.2.2","MPTCP","74","[TCP Dup ACK 64#1] 22  >  33921 [ACK] Seq=445 Ack=16161 Win=65728 Len=0 TSval=4991212 TSecr=1819614437"
"66","0.420201","172.16.3.2","172.16.2.2","MPTCP","74","[TCP Dup ACK 64#2] 22  >  33921 [ACK] Seq=445 Ack=16161 Win=65728 Len=0 TSval=4991212 TSecr=1819614437"
"67","0.420437","172.16.3.2","172.16.2.2","TCP","66","22  >  33921 [ACK] Seq=445 Ack=19025 Win=65728 Len=0 TSval=4991223 TSecr=1819614437"
"68","0.421387","172.16.2.2","172.16.3.2","SSH","1150","Client: Encrypted packet (len=1068)"
"69","0.421408","172.16.2.2","172.16.3.2","SSH","1514","Client: Encrypted packet (len=1432)"
"70","0.421422","172.16.2.2","172.16.3.2","SSH","1514","Client: Encrypted packet (len=1432)"
"71","0.421442","172.16.2.2","172.16.3.2","SSH","1514","Client: Encrypted packet (len=1432)"
"72","0.421483","172.16.2.2","172.16.3.2","SSH","1514","Client: Encrypted packet (len=1432)"
"73","0.421531","172.16.2.2","172.16.3.2","SSH","1514","Client: Encrypted packet (len=1432)"
"74","0.421581","172.16.2.2","172.16.3.2","SSH","1514","Client: Encrypted packet (len=1432)"
"75","0.438669","172.16.3.2","172.16.2.2","TCP","66","22  >  33921 [ACK] Seq=445 Ack=21889 Win=65728 Len=0 TSval=4991223 TSecr=1819614437"
"76","0.438710","172.16.3.2","172.16.2.2","TCP","66","22  >  33921 [ACK] Seq=445 Ack=23517 Win=65728 Len=0 TSval=4991223 TSecr=1819614437"
"77","0.438721","172.16.3.2","172.16.2.2","MPTCP","74","[TCP Dup ACK 76#1] 22  >  33921 [ACK] Seq=445 Ack=23517 Win=65728 Len=0 TSval=4991223 TSecr=1819614437"
"78","0.439461","172.16.3.2","172.16.2.2","TCP","66","22  >  33921 [ACK] Seq=445 Ack=26381 Win=65728 Len=0 TSval=4991232 TSecr=1819614447"
"79","0.439633","172.16.3.2","172.16.2.2","MPTCP","74","[TCP Dup ACK 78#1] 22  >  33921 [ACK] Seq=445 Ack=26381 Win=65728 Len=0 TSval=4991242 TSecr=1819614447"
"80","0.458735","172.16.3.2","172.16.2.2","TCP","66","22  >  33921 [ACK] Seq=445 Ack=29245 Win=65728 Len=0 TSval=4991253 TSecr=1819614447"
"81","0.459368","172.16.3.2","172.16.2.2","TCP","66","22  >  33921 [ACK] Seq=445 Ack=32109 Win=65728 Len=0 TSval=4991253 TSecr=1819614447"
"82","0.459394","172.16.3.2","172.16.2.2","TCP","66","22  >  33921 [ACK] Seq=445 Ack=34609 Win=65728 Len=0 TSval=4991253 TSecr=1819614447"
"83","0.459539","172.16.3.2","172.16.2.2","MPTCP","74","[TCP Dup ACK 82#1] 22  >  33921 [ACK] Seq=445 Ack=34609 Win=65728 Len=0 TSval=4991253 TSecr=1819614447"
"84","0.459553","172.16.2.2","172.16.3.2","SSH","1514","Client: Encrypted packet (len=1432)"
"85","0.459577","172.16.2.2","172.16.3.2","SSH","1514","Client: Encrypted packet (len=1432)"
"86","0.459636","172.16.2.2","172.16.3.2","SSH","1514","Client: Encrypted packet (len=1432)"
"87","0.478370","172.16.3.2","172.16.2.2","TCP","66","22  >  33921 [ACK] Seq=445 Ack=37473 Win=65728 Len=0 TSval=4991272 TSecr=1819614451"
"88","0.479146","172.16.3.2","172.16.2.2","TCP","66","22  >  33921 [ACK] Seq=445 Ack=40337 Win=65728 Len=0 TSval=4991272 TSecr=1819614451"
"89","0.479165","172.16.3.2","172.16.2.2","MPTCP","74","22  >  33921 [ACK] Seq=445 Ack=41769 Win=65728 Len=0 TSval=4991272 TSecr=1819614451"
"90","0.480211","172.16.2.2","172.16.3.2","SSH","1514","Client: Encrypted packet (len=1432)"
"91","0.480233","172.16.2.2","172.16.3.2","SSH","1514","Client: Encrypted packet (len=1432)"
"92","0.498520","172.16.3.2","172.16.2.2","TCP","66","22  >  33921 [ACK] Seq=445 Ack=44633 Win=65728 Len=0 TSval=4991292 TSecr=1819614451"
"93","0.499405","172.16.3.2","172.16.2.2","TCP","66","22  >  33921 [ACK] Seq=445 Ack=47497 Win=65728 Len=0 TSval=4991292 TSecr=1819614493"
"94","0.499588","172.16.3.2","172.16.2.2","MPTCP","74","22  >  33921 [ACK] Seq=445 Ack=48929 Win=65728 Len=0 TSval=4991292 TSecr=1819614513"
"95","0.499783","172.16.2.2","172.16.3.2","SSH","1514","Client: Encrypted packet (len=1432)"
"96","0.499803","172.16.2.2","172.16.3.2","SSH","1514","Client: Encrypted packet (len=1432)"
"97","0.499815","172.16.2.2","172.16.3.2","SSH","1514","Client: Encrypted packet (len=1432)"
"98","0.499832","172.16.2.2","172.16.3.2","SSH","1514","Client: Encrypted packet (len=1432)"
"99","0.499861","172.16.2.2","172.16.3.2","SSH","1514","Client: Encrypted packet (len=1432)"
"100","0.499915","172.16.2.2","172.16.3.2","SSH","1514","Client: Encrypted packet (len=1432)"
"101","0.499976","172.16.2.2","172.16.3.2","SSH","1514","Client: Encrypted packet (len=1432)"
"102","0.500006","172.16.2.2","172.16.3.2","SSH","1514","Client: Encrypted packet (len=1432)"
"103","0.500038","172.16.2.2","172.16.3.2","SSH","1514","Client: Encrypted packet (len=1432)"
"104","0.500082","172.16.2.2","172.16.3.2","SSH","1514","Client: Encrypted packet (len=1432)"
"105","0.500118","172.16.2.2","172.16.3.2","SSH","1514","Client: Encrypted packet (len=1432)"
"106","0.500149","172.16.2.2","172.16.3.2","SSH","1514","Client: Encrypted packet (len=1432)"
"107","0.500194","172.16.2.2","172.16.3.2","SSH","1514","Client: Encrypted packet (len=1432)"
"108","0.518818","172.16.3.2","172.16.2.2","TCP","66","22  >  33921 [ACK] Seq=445 Ack=51793 Win=65728 Len=0 TSval=4991302 TSecr=1819614513"
"109","0.519704","172.16.3.2","172.16.2.2","TCP","66","22  >  33921 [ACK] Seq=445 Ack=54657 Win=65728 Len=0 TSval=4991319 TSecr=1819614532"
"110","0.519890","172.16.3.2","172.16.2.2","MPTCP","74","22  >  33921 [ACK] Seq=445 Ack=56089 Win=65728 Len=0 TSval=4991319 TSecr=1819614532"
"111","0.520256","172.16.2.2","172.16.3.2","SSH","278","Client: Encrypted packet (len=196)"
"112","0.520288","172.16.2.2","172.16.3.2","SSH","1514","Client: Encrypted packet (len=1432)"
"113","0.520346","172.16.2.2","172.16.3.2","SSH","1514","Client: Encrypted packet (len=1432)"
"114","0.520455","172.16.2.2","172.16.3.2","SSH","1514","Client: Encrypted packet (len=1432)"
"115","0.520479","172.16.2.2","172.16.3.2","SSH","1514","Client: Encrypted packet (len=1432)"
"116","0.538886","172.16.3.2","172.16.2.2","TCP","66","22  >  33921 [ACK] Seq=445 Ack=58953 Win=65728 Len=0 TSval=4991332 TSecr=1819614532"
"117","0.538913","172.16.3.2","172.16.2.2","SSH","118","Server: Encrypted packet (len=36)"
"118","0.539895","172.16.3.2","172.16.2.2","TCP","66","22  >  33921 [ACK] Seq=481 Ack=61817 Win=65728 Len=0 TSval=4991342 TSecr=1819614532"
"119","0.539919","172.16.3.2","172.16.2.2","MPTCP","74","22  >  33921 [ACK] Seq=481 Ack=63249 Win=65728 Len=0 TSval=4991342 TSecr=1819614532"
"120","0.541606","172.16.2.2","172.16.3.2","SSH","1514","Client: Encrypted packet (len=1432)"
"121","0.541683","172.16.2.2","172.16.3.2","SSH","1514","Client: Encrypted packet (len=1432)"
"122","0.541719","172.16.2.2","172.16.3.2","SSH","1514","Client: Encrypted packet (len=1432)"
"123","0.541751","172.16.2.2","172.16.3.2","SSH","1514","Client: Encrypted packet (len=1432)"
"124","0.541785","172.16.2.2","172.16.3.2","SSH","1514","Client: Encrypted packet (len=1432)"
"125","0.559358","172.16.3.2","172.16.2.2","TCP","66","22  >  33921 [ACK] Seq=481 Ack=66113 Win=65728 Len=0 TSval=4991342 TSecr=1819614532"
"126","0.559383","172.16.3.2","172.16.2.2","MPTCP","74","[TCP Dup ACK 125#1] 22  >  33921 [ACK] Seq=481 Ack=66113 Win=65728 Len=0 TSval=4991342 TSecr=1819614532"
"127","0.560058","172.16.3.2","172.16.2.2","TCP","66","22  >  33921 [ACK] Seq=481 Ack=68977 Win=65728 Len=0 TSval=4991355 TSecr=1819614532"
"128","0.560249","172.16.3.2","172.16.2.2","MPTCP","74","22  >  33921 [ACK] Seq=481 Ack=69173 Win=65728 Len=0 TSval=4991362 TSecr=1819614553"
"129","0.560984","172.16.2.2","172.16.3.2","SSH","1514","Client: Encrypted packet (len=1432)"
"130","0.561001","172.16.2.2","172.16.3.2","SSH","1514","Client: Encrypted packet (len=1432)"
"131","0.561102","172.16.2.2","172.16.3.2","SSH","1514","Client: Encrypted packet (len=1432)"
"132","0.561123","172.16.2.2","172.16.3.2","SSH","1514","Client: Encrypted packet (len=1432)"
"133","0.561238","172.16.2.2","172.16.3.2","SSH","1514","Client: Encrypted packet (len=1432)"
"134","0.561258","172.16.2.2","172.16.3.2","SSH","1514","Client: Encrypted packet (len=1432)"
"135","0.561320","172.16.2.2","172.16.3.2","SSH","1514","Client: Encrypted packet (len=1432)"
"136","0.561341","172.16.2.2","172.16.3.2","SSH","1514","Client: Encrypted packet (len=1432)"
"137","0.579209","172.16.3.2","172.16.2.2","TCP","66","22  >  33921 [ACK] Seq=481 Ack=72037 Win=65728 Len=0 TSval=4991362 TSecr=1819614553"
"138","0.580094","172.16.3.2","172.16.2.2","TCP","66","22  >  33921 [ACK] Seq=481 Ack=74901 Win=65728 Len=0 TSval=4991372 TSecr=1819614553"
"139","0.580120","172.16.3.2","172.16.2.2","TCP","66","22  >  33921 [ACK] Seq=481 Ack=76333 Win=65728 Len=0 TSval=4991382 TSecr=1819614577"
"140","0.580542","172.16.3.2","172.16.2.2","MPTCP","74","[TCP Dup ACK 139#1] 22  >  33921 [ACK] Seq=481 Ack=76333 Win=65728 Len=0 TSval=4991382 TSecr=1819614577"
"141","0.580555","172.16.2.2","172.16.3.2","SSH","1346","Client: Encrypted packet (len=1264)"
"142","0.580591","172.16.2.2","172.16.3.2","SSH","1514","Client: Encrypted packet (len=1432)"
"143","0.580688","172.16.2.2","172.16.3.2","SSH","1514","Client: Encrypted packet (len=1432)"
"144","0.598562","172.16.3.2","172.16.2.2","TCP","66","22  >  33921 [ACK] Seq=481 Ack=79197 Win=65728 Len=0 TSval=4991382 TSecr=1819614577"
"145","0.599370","172.16.3.2","172.16.2.2","TCP","66","22  >  33921 [ACK] Seq=481 Ack=82061 Win=65728 Len=0 TSval=4991392 TSecr=1819614577"
"146","0.599566","172.16.3.2","172.16.2.2","MPTCP","74","22  >  33921 [ACK] Seq=481 Ack=83493 Win=65728 Len=0 TSval=4991392 TSecr=1819614592"
"147","0.600161","172.16.2.2","172.16.3.2","SSH","1514","Client: Encrypted packet (len=1432)"
"148","0.600181","172.16.2.2","172.16.3.2","SSH","1514","Client: Encrypted packet (len=1432)"
"149","0.600271","172.16.2.2","172.16.3.2","SSH","1514","Client: Encrypted packet (len=1432)"
"150","0.600768","172.16.2.2","172.16.3.2","SSH","1514","Client: Encrypted packet (len=1432)"
"151","0.600794","172.16.2.2","172.16.3.2","SSH","1514","Client: Encrypted packet (len=1432)"
"152","0.600954","172.16.2.2","172.16.3.2","SSH","1514","Client: Encrypted packet (len=1432)"
"153","0.600984","172.16.2.2","172.16.3.2","SSH","1514","Client: Encrypted packet (len=1432)"
"154","0.619175","172.16.3.2","172.16.2.2","TCP","66","22  >  33921 [ACK] Seq=481 Ack=86357 Win=65728 Len=0 TSval=4991411 TSecr=1819614592"
"155","0.619928","172.16.3.2","172.16.2.2","TCP","66","22  >  33921 [ACK] Seq=481 Ack=89221 Win=65728 Len=0 TSval=4991423 TSecr=1819614592"
"156","0.619940","172.16.3.2","172.16.2.2","MPTCP","74","22  >  33921 [ACK] Seq=481 Ack=90653 Win=65728 Len=0 TSval=4991423 TSecr=1819614592"
"157","0.620711","172.16.2.2","172.16.3.2","SSH","1514","Client: Encrypted packet (len=1432)"
"158","0.620778","172.16.2.2","172.16.3.2","SSH","1514","Client: Encrypted packet (len=1432)"
"159","0.639734","172.16.3.2","172.16.2.2","TCP","66","22  >  33921 [ACK] Seq=481 Ack=93517 Win=65728 Len=0 TSval=4991423 TSecr=1819614592"
"160","0.640562","172.16.3.2","172.16.2.2","TCP","66","22  >  33921 [ACK] Seq=481 Ack=96213 Win=65728 Len=0 TSval=4991443 TSecr=1819614614"
"161","0.640574","172.16.3.2","172.16.2.2","TCP","66","22  >  33921 [ACK] Seq=481 Ack=99077 Win=65728 Len=0 TSval=4991443 TSecr=1819614614"
"162","0.640580","172.16.3.2","172.16.2.2","MPTCP","74","[TCP Dup ACK 161#1] 22  >  33921 [ACK] Seq=481 Ack=99077 Win=65728 Len=0 TSval=4991443 TSecr=1819614614"
"163","0.658715","172.16.3.2","172.16.2.2","TCP","66","22  >  33921 [ACK] Seq=481 Ack=101941 Win=65728 Len=0 TSval=4991443 TSecr=1819614633"
"164","0.659667","172.16.2.2","172.16.3.2","SSH","1514","Client: Encrypted packet (len=1432)"
"165","0.659707","172.16.2.2","172.16.3.2","SSH","1514","Client: Encrypted packet (len=1432)"
"166","0.659782","172.16.3.2","172.16.2.2","TCP","66","22  >  33921 [ACK] Seq=481 Ack=104805 Win=65728 Len=0 TSval=4991462 TSecr=1819614633"
"167","0.659792","172.16.3.2","172.16.2.2","MPTCP","74","22  >  33921 [ACK] Seq=481 Ack=106237 Win=65728 Len=0 TSval=4991462 TSecr=1819614633"
"168","0.678839","172.16.3.2","172.16.2.2","TCP","66","22  >  33921 [ACK] Seq=481 Ack=109101 Win=65728 Len=0 TSval=4991462 TSecr=1819614633"
"169","0.678886","172.16.3.2","172.16.2.2","MPTCP","74","[TCP Dup ACK 168#1] 22  >  33921 [ACK] Seq=481 Ack=109101 Win=65728 Len=0 TSval=4991462 TSecr=1819614633"
"170","0.679640","172.16.3.2","172.16.2.2","TCP","66","22  >  33921 [ACK] Seq=481 Ack=111965 Win=65728 Len=0 TSval=4991472 TSecr=1819614652"
"171","0.679828","172.16.2.2","172.16.3.2","SSH","1514","Client: Encrypted packet (len=1432)"
"172","0.679849","172.16.2.2","172.16.3.2","SSH","1514","Client: Encrypted packet (len=1432)"
"173","0.679865","172.16.2.2","172.16.3.2","SSH","1514","Client: Encrypted packet (len=1432)"
"174","0.679890","172.16.2.2","172.16.3.2","SSH","1514","Client: Encrypted packet (len=1432)"
"175","0.679958","172.16.2.2","172.16.3.2","SSH","1514","Client: Encrypted packet (len=1432)"
"176","0.698606","172.16.3.2","172.16.2.2","TCP","66","22  >  33921 [ACK] Seq=481 Ack=114829 Win=65728 Len=0 TSval=4991482 TSecr=1819614697"
"177","0.700590","172.16.3.2","172.16.2.2","TCP","66","22  >  33921 [ACK] Seq=481 Ack=117693 Win=65728 Len=0 TSval=4991492 TSecr=1819614714"
"178","0.700605","172.16.3.2","172.16.2.2","TCP","66","22  >  33921 [ACK] Seq=481 Ack=120557 Win=65728 Len=0 TSval=4991492 TSecr=1819614714"
"179","0.700629","172.16.2.2","172.16.3.2","SSH","1514","Client: Encrypted packet (len=1432)"
"180","0.700641","172.16.3.2","172.16.2.2","MPTCP","74","[TCP Dup ACK 178#1] 22  >  33921 [ACK] Seq=481 Ack=120557 Win=65728 Len=0 TSval=4991492 TSecr=1819614714"
"181","0.701493","172.16.2.2","172.16.3.2","SSH","1514","Client: Encrypted packet (len=1432)"
"182","0.701533","172.16.2.2","172.16.3.2","SSH","1514","Client: Encrypted packet (len=1432)"
"183","0.719211","172.16.3.2","172.16.2.2","TCP","66","22  >  33921 [ACK] Seq=481 Ack=123421 Win=65728 Len=0 TSval=4991512 TSecr=1819614732"
"184","0.720601","172.16.3.2","172.16.2.2","MPTCP","74","22  >  33921 [ACK] Seq=481 Ack=124853 Win=65728 Len=0 TSval=4991522 TSecr=1819614732"
"185","0.720634","172.16.2.2","172.16.3.2","SSH","1514","Client: Encrypted packet (len=1432)"
"186","0.738365","172.16.3.2","172.16.2.2","MPTCP","74","22  >  33921 [ACK] Seq=481 Ack=126285 Win=65728 Len=0 TSval=4991533 TSecr=1819614751"
"187","0.740292","172.16.3.2","172.16.2.2","MPTCP","74","[TCP Dup ACK 186#1] 22  >  33921 [ACK] Seq=481 Ack=126285 Win=65728 Len=0 TSval=4991542 TSecr=1819614751"
"188","0.740921","172.16.2.2","172.16.3.2","SSH","1514","Client: Encrypted packet (len=1432)"
"189","0.741056","172.16.2.2","172.16.3.2","SSH","1514","Client: Encrypted packet (len=1432)"
"190","0.741079","172.16.2.2","172.16.3.2","SSH","1514","Client: Encrypted packet (len=1432)"
"191","0.741192","172.16.2.2","172.16.3.2","SSH","1514","Client: Encrypted packet (len=1432)"
"192","0.741212","172.16.2.2","172.16.3.2","SSH","1346","Client: Encrypted packet (len=1264)"
"193","0.758510","172.16.3.2","172.16.2.2","TCP","66","22  >  33921 [ACK] Seq=481 Ack=129149 Win=65728 Len=0 TSval=4991542 TSecr=1819614776"
"194","0.758530","172.16.3.2","172.16.2.2","MPTCP","74","[TCP Dup ACK 193#1] 22  >  33921 [ACK] Seq=481 Ack=129149 Win=65728 Len=0 TSval=4991552 TSecr=1819614776"
"195","0.759458","172.16.3.2","172.16.2.2","TCP","66","22  >  33921 [ACK] Seq=481 Ack=132013 Win=65728 Len=0 TSval=4991552 TSecr=1819614776"
"196","0.771586","172.16.2.2","172.16.3.2","SSH","1514","Client: Encrypted packet (len=1432)"
"197","0.771631","172.16.2.2","172.16.3.2","SSH","1514","Client: Encrypted packet (len=1432)"
"198","0.771712","172.16.2.2","172.16.3.2","SSH","1514","Client: Encrypted packet (len=1432)"
"199","0.771752","172.16.2.2","172.16.3.2","SSH","1514","Client: Encrypted packet (len=1432)"
"200","0.771824","172.16.2.2","172.16.3.2","SSH","1514","Client: Encrypted packet (len=1432)"
"201","0.771864","172.16.2.2","172.16.3.2","SSH","1514","Client: Encrypted packet (len=1432)"
"202","0.771973","172.16.2.2","172.16.3.2","SSH","1514","Client: Encrypted packet (len=1432)"
"203","0.772158","172.16.2.2","172.16.3.2","SSH","1514","Client: Encrypted packet (len=1432)"
"204","0.772195","172.16.2.2","172.16.3.2","SSH","1514","Client: Encrypted packet (len=1432)"
"205","0.772265","172.16.2.2","172.16.3.2","SSH","1514","Client: Encrypted packet (len=1432)"
"206","0.772304","172.16.2.2","172.16.3.2","SSH","1514","Client: Encrypted packet (len=1432)"
"207","0.772385","172.16.2.2","172.16.3.2","SSH","1514","Client: Encrypted packet (len=1432)"
"208","0.773212","172.16.2.2","172.16.3.2","SSH","1346","Client: Encrypted packet (len=1264)"
"209","0.773256","172.16.2.2","172.16.3.2","SSH","1514","Client: Encrypted packet (len=1432)"
"210","0.773443","172.16.2.2","172.16.3.2","SSH","1514","Client: Encrypted packet (len=1432)"
"211","0.773485","172.16.2.2","172.16.3.2","SSH","1514","Client: Encrypted packet (len=1432)"
"212","0.773572","172.16.2.2","172.16.3.2","SSH","1514","Client: Encrypted packet (len=1432)"
"213","0.773592","172.16.2.2","172.16.3.2","SSH","1514","Client: Encrypted packet (len=1432)"
"214","0.773690","172.16.2.2","172.16.3.2","SSH","1514","Client: Encrypted packet (len=1432)"
"215","0.773780","172.16.2.2","172.16.3.2","SSH","1514","Client: Encrypted packet (len=1432)"
"216","0.789219","172.16.3.2","172.16.2.2","TCP","66","22  >  33921 [ACK] Seq=481 Ack=134709 Win=65728 Len=0 TSval=4991573 TSecr=1819614776"
"217","0.789241","172.16.3.2","172.16.2.2","MPTCP","74","22  >  33921 [ACK] Seq=481 Ack=136141 Win=65728 Len=0 TSval=4991573 TSecr=1819614803"
"218","0.790017","172.16.3.2","172.16.2.2","TCP","66","22  >  33921 [ACK] Seq=481 Ack=139005 Win=65728 Len=0 TSval=4991592 TSecr=1819614803"
"219","0.790123","172.16.3.2","172.16.2.2","MPTCP","74","22  >  33921 [ACK] Seq=481 Ack=140437 Win=65728 Len=0 TSval=4991592 TSecr=1819614803"
"220","0.790260","172.16.2.2","172.16.3.2","SSH","1514","Client: Encrypted packet (len=1432)"
"221","0.790297","172.16.2.2","172.16.3.2","SSH","1514","Client: Encrypted packet (len=1432)"
"222","0.790310","172.16.2.2","172.16.3.2","SSH","1514","Client: Encrypted packet (len=1432)"
"223","0.790386","172.16.2.2","172.16.3.2","SSH","1514","Client: Encrypted packet (len=1432)"
"224","0.809746","172.16.3.2","172.16.2.2","TCP","66","22  >  33921 [ACK] Seq=481 Ack=143301 Win=65728 Len=0 TSval=4991595 TSecr=1819614803"
"225","0.810477","172.16.3.2","172.16.2.2","TCP","66","22  >  33921 [ACK] Seq=481 Ack=146165 Win=65728 Len=0 TSval=4991612 TSecr=1819614803"
"226","0.810489","172.16.3.2","172.16.2.2","MPTCP","74","22  >  33921 [ACK] Seq=481 Ack=147597 Win=65728 Len=0 TSval=4991612 TSecr=1819614803"
"227","0.811165","172.16.2.2","172.16.3.2","SSH","1514","Client: Encrypted packet (len=1432)"
"228","0.811199","172.16.2.2","172.16.3.2","SSH","1514","Client: Encrypted packet (len=1432)"
"229","0.811216","172.16.2.2","172.16.3.2","SSH","1514","Client: Encrypted packet (len=1432)"
"230","0.829121","172.16.3.2","172.16.2.2","TCP","66","22  >  33921 [ACK] Seq=481 Ack=150461 Win=65728 Len=0 TSval=4991612 TSecr=1819614803"
"231","0.829906","172.16.3.2","172.16.2.2","TCP","66","22  >  33921 [ACK] Seq=481 Ack=153157 Win=65728 Len=0 TSval=4991632 TSecr=1819614811"
"232","0.830108","172.16.3.2","172.16.2.2","MPTCP","74","22  >  33921 [ACK] Seq=481 Ack=154589 Win=65728 Len=0 TSval=4991632 TSecr=1819614811"
"233","0.830288","172.16.2.2","172.16.3.2","SSH","1514","Client: Encrypted packet (len=1432)"
"234","0.830308","172.16.2.2","172.16.3.2","SSH","1514","Client: Encrypted packet (len=1432)"
"235","0.830734","172.16.2.2","172.16.3.2","SSH","1514","Client: Encrypted packet (len=1432)"
"236","0.830752","172.16.2.2","172.16.3.2","SSH","1514","Client: Encrypted packet (len=1432)"
"237","0.830773","172.16.2.2","172.16.3.2","SSH","1514","Client: Encrypted packet (len=1432)"
"238","0.849684","172.16.3.2","172.16.2.2","TCP","66","22  >  33921 [ACK] Seq=481 Ack=157453 Win=65728 Len=0 TSval=4991632 TSecr=1819614811"
"239","0.849704","172.16.3.2","172.16.2.2","MPTCP","74","[TCP Dup ACK 238#1] 22  >  33921 [ACK] Seq=481 Ack=157453 Win=65728 Len=0 TSval=4991632 TSecr=1819614811"
"240","0.849983","172.16.3.2","172.16.2.2","TCP","66","22  >  33921 [ACK] Seq=481 Ack=160317 Win=65728 Len=0 TSval=4991652 TSecr=1819614811"
"241","0.868902","172.16.3.2","172.16.2.2","TCP","66","22  >  33921 [ACK] Seq=481 Ack=163181 Win=65728 Len=0 TSval=4991652 TSecr=1819614811"
"242","0.868929","172.16.3.2","172.16.2.2","MPTCP","74","22  >  33921 [ACK] Seq=481 Ack=164613 Win=65728 Len=0 TSval=4991652 TSecr=1819614827"
"243","0.869653","172.16.3.2","172.16.2.2","TCP","66","22  >  33921 [ACK] Seq=481 Ack=167477 Win=65728 Len=0 TSval=4991663 TSecr=1819614827"
"244","0.869733","172.16.2.2","172.16.3.2","SSH","1346","Client: Encrypted packet (len=1264)"
"245","0.869766","172.16.2.2","172.16.3.2","SSH","1514","Client: Encrypted packet (len=1432)"
"246","0.870125","172.16.3.2","172.16.2.2","SSH","118","Server: Encrypted packet (len=36)"
"247","0.870167","172.16.2.2","172.16.3.2","SSH","1514","Client: Encrypted packet (len=1432)"
"248","0.888742","172.16.3.2","172.16.2.2","TCP","66","22  >  33921 [ACK] Seq=517 Ack=171773 Win=65728 Len=0 TSval=4991672 TSecr=1819614843"
"249","0.889697","172.16.3.2","172.16.2.2","TCP","66","22  >  33921 [ACK] Seq=517 Ack=174637 Win=65728 Len=0 TSval=4991683 TSecr=1819614863"
"250","0.901299","172.16.2.2","172.16.3.2","SSH","1514","Client: Encrypted packet (len=1432)"
"251","0.901326","172.16.2.2","172.16.3.2","SSH","1514","Client: Encrypted packet (len=1432)"
"252","0.909241","172.16.3.2","172.16.2.2","TCP","66","22  >  33921 [ACK] Seq=517 Ack=177501 Win=65728 Len=0 TSval=4991692 TSecr=1819614863"
"253","0.909262","172.16.3.2","172.16.2.2","MPTCP","74","22  >  33921 [ACK] Seq=517 Ack=178933 Win=65728 Len=0 TSval=4991692 TSecr=1819614863"
"254","0.909927","172.16.3.2","172.16.2.2","TCP","66","22  >  33921 [ACK] Seq=517 Ack=181629 Win=65728 Len=0 TSval=4991712 TSecr=1819614902"
"255","0.910080","172.16.3.2","172.16.2.2","TCP","66","22  >  33921 [ACK] Seq=517 Ack=183061 Win=65728 Len=0 TSval=4991712 TSecr=1819614902"
"256","0.919999","172.16.2.2","172.16.3.2","SSH","1514","Client: Encrypted packet (len=1432)"
"257","0.920030","172.16.2.2","172.16.3.2","SSH","1514","Client: Encrypted packet (len=1432)"
"258","0.920099","172.16.2.2","172.16.3.2","SSH","1514","Client: Encrypted packet (len=1432)"
"259","0.920128","172.16.2.2","172.16.3.2","SSH","1514","Client: Encrypted packet (len=1432)"
"260","0.920243","172.16.2.2","172.16.3.2","SSH","1514","Client: Encrypted packet (len=1432)"
"261","0.920326","172.16.2.2","172.16.3.2","SSH","1514","Client: Encrypted packet (len=1432)"
"262","0.920365","172.16.2.2","172.16.3.2","SSH","1514","Client: Encrypted packet (len=1432)"
"263","0.920447","172.16.2.2","172.16.3.2","SSH","1514","Client: Encrypted packet (len=1432)"
"264","0.920485","172.16.2.2","172.16.3.2","SSH","1514","Client: Encrypted packet (len=1432)"
"265","0.920565","172.16.2.2","172.16.3.2","SSH","1514","Client: Encrypted packet (len=1432)"
"266","0.920604","172.16.2.2","172.16.3.2","SSH","1514","Client: Encrypted packet (len=1432)"
"267","0.920683","172.16.2.2","172.16.3.2","SSH","1514","Client: Encrypted packet (len=1432)"
"268","0.920722","172.16.2.2","172.16.3.2","SSH","1514","Client: Encrypted packet (len=1432)"
"269","0.920790","172.16.2.2","172.16.3.2","SSH","1514","Client: Encrypted packet (len=1432)"
"270","0.920829","172.16.2.2","172.16.3.2","SSH","1514","Client: Encrypted packet (len=1432)"
"271","0.920898","172.16.2.2","172.16.3.2","SSH","1514","Client: Encrypted packet (len=1432)"
"272","0.920938","172.16.2.2","172.16.3.2","SSH","1514","Client: Encrypted packet (len=1432)"
"273","0.921009","172.16.2.2","172.16.3.2","SSH","1514","Client: Encrypted packet (len=1432)"
"274","0.929303","172.16.3.2","172.16.2.2","TCP","66","22  >  33921 [ACK] Seq=517 Ack=185925 Win=65728 Len=0 TSval=4991712 TSecr=1819614932"
"275","0.930357","172.16.3.2","172.16.2.2","TCP","66","22  >  33921 [ACK] Seq=517 Ack=188789 Win=65728 Len=0 TSval=4991732 TSecr=1819614952"
"276","0.930399","172.16.3.2","172.16.2.2","MPTCP","74","22  >  33921 [ACK] Seq=517 Ack=190221 Win=65728 Len=0 TSval=4991732 TSecr=1819614952"
"277","0.931395","172.16.2.2","172.16.3.2","SSH","1346","Client: Encrypted packet (len=1264)"
"278","0.931449","172.16.2.2","172.16.3.2","SSH","1514","Client: Encrypted packet (len=1432)"
"279","0.931539","172.16.2.2","172.16.3.2","SSH","1514","Client: Encrypted packet (len=1432)"
"280","0.931567","172.16.2.2","172.16.3.2","SSH","1514","Client: Encrypted packet (len=1432)"
"281","0.931632","172.16.2.2","172.16.3.2","SSH","1514","Client: Encrypted packet (len=1432)"
"282","0.948401","172.16.3.2","172.16.2.2","TCP","66","22  >  33921 [ACK] Seq=517 Ack=193085 Win=65728 Len=0 TSval=4991732 TSecr=1819614952"
"283","0.949348","172.16.3.2","172.16.2.2","TCP","66","22  >  33921 [ACK] Seq=517 Ack=195949 Win=65728 Len=0 TSval=4991752 TSecr=1819614952"
"284","0.949642","172.16.3.2","172.16.2.2","MPTCP","74","22  >  33921 [ACK] Seq=517 Ack=197381 Win=65728 Len=0 TSval=4991752 TSecr=1819614952"
"285","0.949752","172.16.2.2","172.16.3.2","SSH","1514","Client: Encrypted packet (len=1432)"
"286","0.949785","172.16.2.2","172.16.3.2","SSH","1514","Client: Encrypted packet (len=1432)"
"287","0.969308","172.16.3.2","172.16.2.2","TCP","66","22  >  33921 [ACK] Seq=517 Ack=200245 Win=65728 Len=0 TSval=4991756 TSecr=1819614952"
"288","0.970114","172.16.3.2","172.16.2.2","TCP","66","22  >  33921 [ACK] Seq=517 Ack=203109 Win=65728 Len=0 TSval=4991762 TSecr=1819614952"
"289","0.970124","172.16.3.2","172.16.2.2","MPTCP","74","22  >  33921 [ACK] Seq=517 Ack=204541 Win=65728 Len=0 TSval=4991762 TSecr=1819614952"
"290","0.989327","172.16.3.2","172.16.2.2","TCP","66","22  >  33921 [ACK] Seq=517 Ack=207405 Win=65728 Len=0 TSval=4991781 TSecr=1819614952"
"291","0.990313","172.16.3.2","172.16.2.2","TCP","66","22  >  33921 [ACK] Seq=517 Ack=210269 Win=65728 Len=0 TSval=4991792 TSecr=1819614952"
"292","0.990348","172.16.3.2","172.16.2.2","MPTCP","74","22  >  33921 [ACK] Seq=517 Ack=211701 Win=65728 Len=0 TSval=4991792 TSecr=1819614952"
"293","0.991571","172.16.2.2","172.16.3.2","SSH","1514","Client: Encrypted packet (len=1432)"
"294","0.991607","172.16.2.2","172.16.3.2","SSH","1514","Client: Encrypted packet (len=1432)"
"295","0.991619","172.16.2.2","172.16.3.2","SSH","1514","Client: Encrypted packet (len=1432)"
"296","1.009239","172.16.3.2","172.16.2.2","TCP","66","22  >  33921 [ACK] Seq=517 Ack=214397 Win=65728 Len=0 TSval=4991792 TSecr=1819614967"
"297","1.009266","172.16.3.2","172.16.2.2","MPTCP","74","[TCP Dup ACK 296#1] 22  >  33921 [ACK] Seq=517 Ack=214397 Win=65728 Len=0 TSval=4991792 TSecr=1819614967"
"298","1.009752","172.16.3.2","172.16.2.2","TCP","66","22  >  33921 [ACK] Seq=517 Ack=217261 Win=65728 Len=0 TSval=4991812 TSecr=1819614967"
"299","1.010165","172.16.3.2","172.16.2.2","MPTCP","74","22  >  33921 [ACK] Seq=517 Ack=218693 Win=65728 Len=0 TSval=4991812 TSecr=1819614967"
"300","1.029662","172.16.3.2","172.16.2.2","TCP","66","22  >  33921 [ACK] Seq=517 Ack=221557 Win=65728 Len=0 TSval=4991826 TSecr=1819614986"
"301","1.030178","172.16.3.2","172.16.2.2","TCP","66","22  >  33921 [ACK] Seq=517 Ack=224421 Win=65728 Len=0 TSval=4991826 TSecr=1819615023"
"302","1.030312","172.16.3.2","172.16.2.2","MPTCP","74","22  >  33921 [ACK] Seq=517 Ack=225853 Win=65728 Len=0 TSval=4991832 TSecr=1819615023"
"303","1.030341","172.16.2.2","172.16.3.2","SSH","1514","Client: Encrypted packet (len=1432)"
"304","1.030640","172.16.2.2","172.16.3.2","SSH","1514","Client: Encrypted packet (len=1432)"
"305","1.048501","172.16.3.2","172.16.2.2","TCP","66","22  >  33921 [ACK] Seq=517 Ack=228717 Win=65728 Len=0 TSval=4991832 TSecr=1819615062"
"306","1.048594","172.16.2.2","172.16.3.2","SSH","1514","Client: Encrypted packet (len=1432)"
"307","1.048618","172.16.3.2","172.16.2.2","MPTCP","74","[TCP Dup ACK 305#1] 22  >  33921 [ACK] Seq=517 Ack=228717 Win=65728 Len=0 TSval=4991832 TSecr=1819615062"
"308","1.049914","172.16.2.2","172.16.3.2","SSH","1514","Client: Encrypted packet (len=1432)"
"309","1.049949","172.16.2.2","172.16.3.2","SSH","1514","Client: Encrypted packet (len=1432)"
"310","1.050049","172.16.2.2","172.16.3.2","SSH","1514","Client: Encrypted packet (len=1432)"
"311","1.050112","172.16.2.2","172.16.3.2","SSH","1514","Client: Encrypted packet (len=1432)"
"312","1.050180","172.16.2.2","172.16.3.2","SSH","1514","Client: Encrypted packet (len=1432)"
"313","1.050249","172.16.2.2","172.16.3.2","SSH","1514","Client: Encrypted packet (len=1432)"
"314","1.050281","172.16.2.2","172.16.3.2","SSH","1514","Client: Encrypted packet (len=1432)"
"315","1.050389","172.16.2.2","172.16.3.2","SSH","1514","Client: Encrypted packet (len=1432)"
"316","1.068883","172.16.3.2","172.16.2.2","TCP","66","22  >  33921 [ACK] Seq=517 Ack=231581 Win=65728 Len=0 TSval=4991852 TSecr=1819615087"
"317","1.069843","172.16.3.2","172.16.2.2","TCP","66","22  >  33921 [ACK] Seq=517 Ack=234445 Win=65728 Len=0 TSval=4991865 TSecr=1819615087"
"318","1.070039","172.16.3.2","172.16.2.2","MPTCP","74","22  >  33921 [ACK] Seq=517 Ack=235877 Win=65728 Len=0 TSval=4991865 TSecr=1819615087"
"319","1.071062","172.16.2.2","172.16.3.2","SSH","1346","Client: Encrypted packet (len=1264)"
"320","1.071197","172.16.2.2","172.16.3.2","SSH","1514","Client: Encrypted packet (len=1432)"
"321","1.071285","172.16.2.2","172.16.3.2","SSH","1514","Client: Encrypted packet (len=1432)"
"322","1.071340","172.16.2.2","172.16.3.2","SSH","1514","Client: Encrypted packet (len=1432)"
"323","1.071359","172.16.2.2","172.16.3.2","SSH","1514","Client: Encrypted packet (len=1432)"
"324","1.071438","172.16.2.2","172.16.3.2","SSH","1514","Client: Encrypted packet (len=1432)"
"325","1.071475","172.16.2.2","172.16.3.2","SSH","1514","Client: Encrypted packet (len=1432)"
"326","1.071567","172.16.2.2","172.16.3.2","SSH","1514","Client: Encrypted packet (len=1432)"
"327","1.071584","172.16.2.2","172.16.3.2","SSH","1514","Client: Encrypted packet (len=1432)"
"328","1.071599","172.16.2.2","172.16.3.2","SSH","1514","Client: Encrypted packet (len=1432)"
"329","1.071615","172.16.2.2","172.16.3.2","SSH","1514","Client: Encrypted packet (len=1432)"
"330","1.071763","172.16.2.2","172.16.3.2","SSH","1514","Client: Encrypted packet (len=1432)"
"331","1.071801","172.16.2.2","172.16.3.2","SSH","1514","Client: Encrypted packet (len=1432)"
"332","1.071944","172.16.2.2","172.16.3.2","SSH","1514","Client: Encrypted packet (len=1432)"
"333","1.072065","172.16.2.2","172.16.3.2","SSH","1514","Client: Encrypted packet (len=1432)"
"334","1.072104","172.16.2.2","172.16.3.2","SSH","1514","Client: Encrypted packet (len=1432)"
"335","1.072216","172.16.2.2","172.16.3.2","SSH","1514","Client: Encrypted packet (len=1432)"
"336","1.072255","172.16.2.2","172.16.3.2","SSH","1514","Client: Encrypted packet (len=1432)"
"337","1.088394","172.16.3.2","172.16.2.2","TCP","66","22  >  33921 [ACK] Seq=517 Ack=238741 Win=65728 Len=0 TSval=4991882 TSecr=1819615087"
"338","1.088446","172.16.3.2","172.16.2.2","MPTCP","74","[TCP Dup ACK 337#1] 22  >  33921 [ACK] Seq=517 Ack=238741 Win=65728 Len=0 TSval=4991882 TSecr=1819615087"
"339","1.089239","172.16.3.2","172.16.2.2","TCP","66","22  >  33921 [ACK] Seq=517 Ack=241605 Win=65728 Len=0 TSval=4991882 TSecr=1819615087"
"340","1.109489","172.16.3.2","172.16.2.2","TCP","66","22  >  33921 [ACK] Seq=517 Ack=244301 Win=65728 Len=0 TSval=4991902 TSecr=1819615103"
"341","1.109503","172.16.3.2","172.16.2.2","MPTCP","74","22  >  33921 [ACK] Seq=517 Ack=245733 Win=65728 Len=0 TSval=4991902 TSecr=1819615103"
"342","1.110012","172.16.3.2","172.16.2.2","TCP","66","22  >  33921 [ACK] Seq=517 Ack=248597 Win=65728 Len=0 TSval=4991912 TSecr=1819615103"
"343","1.129358","172.16.3.2","172.16.2.2","TCP","66","22  >  33921 [ACK] Seq=517 Ack=251461 Win=65728 Len=0 TSval=4991922 TSecr=1819615103"
"344","1.129385","172.16.3.2","172.16.2.2","MPTCP","74","22  >  33921 [ACK] Seq=517 Ack=252893 Win=65728 Len=0 TSval=4991922 TSecr=1819615103"
"345","1.130129","172.16.3.2","172.16.2.2","TCP","66","22  >  33921 [ACK] Seq=517 Ack=255757 Win=65728 Len=0 TSval=4991932 TSecr=1819615103"
"346","1.130281","172.16.2.2","172.16.3.2","SSH","1514","Client: Encrypted packet (len=1432)"
"347","1.130317","172.16.2.2","172.16.3.2","SSH","1514","Client: Encrypted packet (len=1432)"
"348","1.149777","172.16.3.2","172.16.2.2","TCP","66","22  >  33921 [ACK] Seq=517 Ack=258621 Win=65728 Len=0 TSval=4991932 TSecr=1819615103"
