"No.","Time","Source","Destination","Protocol","Length","Info"
"1","0.000000","172.16.1.2","172.16.3.2","MPTCP","86","42610  >  22 [SYN] Seq=0 Win=65535 Len=0 MSS=1460 WS=64 SACK_PERM TSval=361667362 TSecr=0"
"2","0.018491","172.16.3.2","172.16.1.2","MPTCP","86","22  >  42610 [SYN, ACK] Seq=0 Ack=1 Win=65535 Len=0 MSS=1460 WS=64 SACK_PERM TSval=2117458638 TSecr=361667362"
"3","0.018587","172.16.1.2","172.16.3.2","MPTCP","86","42610  >  22 [ACK] Seq=1 Ack=1 Win=65728 Len=0 TSval=361667385 TSecr=2117458638"
"4","0.019460","172.16.1.2","172.16.3.2","SSHv2","128","Client: Protocol (SSH-2.0-OpenSSH_8.8 FreeBSD-20211221)"
"5","0.068409","172.16.3.2","172.16.1.2","TCP","66","22  >  42610 [ACK] Seq=1 Ack=39 Win=65728 Len=0 TSval=2117458693 TSecr=361667385"
"6","0.071582","172.16.3.2","172.16.1.2","SSHv2","124","Server: Protocol (SSH-2.0-OpenSSH_8.8 FreeBSD-20211221)"
"7","0.071935","172.16.1.2","172.16.3.2","MPTCP","74","42610  >  22 [ACK] Seq=39 Ack=39 Win=65728 Len=0 TSval=361667435 TSecr=2117458693"
"8","0.072646","172.16.1.2","172.16.3.2","MPTCP","1514","42610  >  22 [ACK] Seq=39 Ack=39 Win=65728 Len=1432 TSval=361667435 TSecr=2117458693 [TCP segment of a reassembled PDU]"
"9","0.072681","172.16.1.2","172.16.3.2","SSHv2","162","Client: Key Exchange Init"
"10","0.088044","172.16.3.2","172.16.1.2","SSHv2","1138","Server: Key Exchange Init"
"11","0.088067","172.16.3.2","172.16.1.2","TCP","66","22  >  42610 [ACK] Seq=1095 Ack=1551 Win=65728 Len=0 TSval=2117458701 TSecr=361667435"
"12","0.089403","172.16.1.2","172.16.3.2","MPTCP","74","42610  >  22 [ACK] Seq=1551 Ack=1095 Win=65728 Len=0 TSval=361667453 TSecr=2117458701"
"13","0.108996","172.16.3.2","172.16.1.2","MPTCP","74","[TCP Dup ACK 11#1] 22  >  42610 [ACK] Seq=1095 Ack=1551 Win=65728 Len=0 TSval=2117458726 TSecr=361667435"
"14","0.109028","172.16.3.2","172.16.1.2","SSHv2","566","Server: Elliptic Curve Diffie-Hellman Key Exchange Reply, New Keys"
"15","0.110842","172.16.1.2","172.16.3.2","MPTCP","74","42610  >  22 [ACK] Seq=1551 Ack=1579 Win=65728 Len=0 TSval=361667473 TSecr=2117458730"
"16","0.114302","172.16.1.2","172.16.3.2","SSHv2","98","Client: New Keys"
"17","0.129377","172.16.3.2","172.16.1.2","MPTCP","74","22  >  42610 [ACK] Seq=1579 Ack=1567 Win=65728 Len=0 TSval=2117458748 TSecr=361667473"
"18","0.129415","172.16.1.2","172.16.3.2","SSHv2","126","Client: "
"19","0.149601","172.16.3.2","172.16.1.2","SSHv2","126","Server: "
"20","0.149641","172.16.1.2","172.16.3.2","TCP","66","42610  >  22 [ACK] Seq=1611 Ack=1623 Win=65728 Len=0 TSval=361667512 TSecr=2117458765"
"21","0.150987","172.16.1.2","172.16.3.2","MPTCP","74","[TCP Dup ACK 20#1] 42610  >  22 [ACK] Seq=1611 Ack=1623 Win=65728 Len=0 TSval=361667512 TSecr=2117458765"
"22","0.166804","172.16.1.2","172.16.3.2","SSHv2","582","Client: "
"23","0.178980","172.16.3.2","172.16.1.2","MPTCP","74","22  >  42610 [ACK] Seq=1623 Ack=2111 Win=65728 Len=0 TSval=2117458790 TSecr=361667531"
"24","0.218971","172.16.3.2","172.16.1.2","SSHv2","110","Server: "
"25","0.258302","172.16.1.2","172.16.3.2","TCP","66","42610  >  22 [ACK] Seq=2111 Ack=1651 Win=65728 Len=0 TSval=361667623 TSecr=2117458836"
"26","0.278999","172.16.3.2","172.16.1.2","SSHv2","222","Server: "
"27","0.279849","172.16.1.2","172.16.3.2","MPTCP","74","42610  >  22 [ACK] Seq=2111 Ack=1791 Win=65728 Len=0 TSval=361667646 TSecr=2117458898"
"28","0.298120","172.16.3.2","172.16.1.2","SSHv2","126","Server: "
"29","0.298909","172.16.1.2","172.16.3.2","MPTCP","74","42610  >  22 [ACK] Seq=2111 Ack=1835 Win=65728 Len=0 TSval=361667663 TSecr=2117458918"
"30","0.299497","172.16.1.2","172.16.3.2","SSHv2","174","Client: "
"31","0.315298","172.16.1.2","172.16.3.2","MPTCP","74","[TCP Dup ACK 29#1] 42610  >  22 [ACK] Seq=2203 Ack=1835 Win=65728 Len=0 TSval=361667681 TSecr=2117458918"
"32","0.318575","172.16.3.2","172.16.1.2","MPTCP","74","22  >  42610 [ACK] Seq=1835 Ack=2203 Win=65728 Len=0 TSval=2117458939 TSecr=361667663"
"33","0.325833","172.16.3.2","172.16.1.2","MPTCP","74","[TCP Dup ACK 32#1] 22  >  42610 [ACK] Seq=1835 Ack=2203 Win=65728 Len=0 TSval=2117458950 TSecr=361667681"
"34","0.326525","172.16.3.2","172.16.1.2","SSHv2","158","Server: "
"35","0.335972","172.16.1.2","172.16.3.2","MPTCP","74","42610  >  22 [ACK] Seq=2203 Ack=1911 Win=65728 Len=0 TSval=361667702 TSecr=2117458950"
"36","0.368482","172.16.3.2","172.16.1.2","MPTCP","74","[TCP Dup ACK 32#2] 22  >  42610 [ACK] Seq=1911 Ack=2203 Win=65728 Len=0 TSval=2117458996 TSecr=361667702"
"37","0.378664","172.16.1.2","172.16.3.2","SSHv2","158","Client: "
"38","0.399472","172.16.3.2","172.16.1.2","SSHv2","142","Server: "
"39","0.399502","172.16.1.2","172.16.3.2","TCP","66","42610  >  22 [ACK] Seq=2279 Ack=1971 Win=65728 Len=0 TSval=361667762 TSecr=2117459014"
"40","0.400111","172.16.1.2","172.16.3.2","MPTCP","74","[TCP Dup ACK 39#1] 42610  >  22 [ACK] Seq=2279 Ack=1971 Win=65728 Len=0 TSval=361667762 TSecr=2117459014"
"41","0.401688","172.16.1.2","172.16.3.2","SSHv2","1514","Client: "
"42","0.401728","172.16.1.2","172.16.3.2","SSHv2","1514","Client: "
"43","0.401741","172.16.1.2","172.16.3.2","SSHv2","1514","Client: "
"44","0.401873","172.16.1.2","172.16.3.2","SSHv2","1514","Client: "
"45","0.401886","172.16.1.2","172.16.3.2","SSHv2","1514","Client: "
"46","0.401948","172.16.1.2","172.16.3.2","SSHv2","1150","Client: "
"47","0.403414","172.16.1.2","172.16.3.2","SSHv2","1514","Client: "
"48","0.403429","172.16.1.2","172.16.3.2","SSHv2","1514","Client: "
"49","0.403440","172.16.1.2","172.16.3.2","SSHv2","1514","Client: "
"50","0.403452","172.16.1.2","172.16.3.2","SSHv2","1514","Client: "
"51","0.403529","172.16.1.2","172.16.3.2","SSHv2","1514","Client: "
"52","0.403628","172.16.1.2","172.16.3.2","SSHv2","1150","Client: "
"53","0.418436","172.16.3.2","172.16.1.2","TCP","66","22  >  42610 [ACK] Seq=1971 Ack=5143 Win=65728 Len=0 TSval=2117459036 TSecr=361667762"
"54","0.418463","172.16.3.2","172.16.1.2","MPTCP","74","[TCP Dup ACK 53#1] 22  >  42610 [ACK] Seq=1971 Ack=5143 Win=65728 Len=0 TSval=2117459036 TSecr=361667762"
"55","0.418500","172.16.3.2","172.16.1.2","TCP","66","22  >  42610 [ACK] Seq=1971 Ack=8007 Win=65728 Len=0 TSval=2117459036 TSecr=361667762"
"56","0.418993","172.16.3.2","172.16.1.2","TCP","66","22  >  42610 [ACK] Seq=1971 Ack=10507 Win=65728 Len=0 TSval=2117459046 TSecr=361667762"
"57","0.419003","172.16.3.2","172.16.1.2","TCP","66","22  >  42610 [ACK] Seq=1971 Ack=13371 Win=65728 Len=0 TSval=2117459046 TSecr=361667762"
"58","0.419008","172.16.3.2","172.16.1.2","TCP","66","22  >  42610 [ACK] Seq=1971 Ack=16235 Win=65728 Len=0 TSval=2117459046 TSecr=361667762"
"59","0.419288","172.16.3.2","172.16.1.2","MPTCP","74","[TCP Dup ACK 58#1] 22  >  42610 [ACK] Seq=1971 Ack=16235 Win=65728 Len=0 TSval=2117459046 TSecr=361667762"
"60","0.438396","172.16.3.2","172.16.1.2","TCP","66","22  >  42610 [ACK] Seq=1971 Ack=18735 Win=65728 Len=0 TSval=2117459055 TSecr=361667762"
"61","0.438420","172.16.3.2","172.16.1.2","MPTCP","74","[TCP Dup ACK 60#1] 22  >  42610 [ACK] Seq=1971 Ack=18735 Win=65728 Len=0 TSval=2117459055 TSecr=361667762"
"62","0.438652","172.16.1.2","172.16.3.2","SSHv2","1514","Client: "
"63","0.438689","172.16.1.2","172.16.3.2","SSHv2","1514","Client: "
"64","0.438785","172.16.1.2","172.16.3.2","SSHv2","1514","Client: "
"65","0.438851","172.16.1.2","172.16.3.2","SSHv2","1514","Client: "
"66","0.439025","172.16.1.2","172.16.3.2","SSHv2","1514","Client: "
"67","0.439100","172.16.1.2","172.16.3.2","SSHv2","1514","Client: "
"68","0.439258","172.16.1.2","172.16.3.2","SSHv2","1514","Client: "
"69","0.439285","172.16.1.2","172.16.3.2","SSHv2","1514","Client: "
"70","0.439470","172.16.1.2","172.16.3.2","SSHv2","1514","Client: "
"71","0.439498","172.16.1.2","172.16.3.2","SSHv2","1514","Client: "
"72","0.439522","172.16.1.2","172.16.3.2","SSHv2","1514","Client: "
"73","0.439545","172.16.1.2","172.16.3.2","SSHv2","1514","Client: "
"74","0.439571","172.16.1.2","172.16.3.2","SSHv2","1514","Client: "
"75","0.439781","172.16.1.2","172.16.3.2","SSHv2","1514","Client: "
"76","0.439923","172.16.1.2","172.16.3.2","SSHv2","1514","Client: "
"77","0.440188","172.16.1.2","172.16.3.2","SSHv2","642","Client: "
"78","0.450906","172.16.3.2","172.16.1.2","MPTCP","74","[TCP Dup ACK 60#2] 22  >  42610 [ACK] Seq=1971 Ack=18735 Win=65728 Len=0 TSval=2117459073 TSecr=361667762"
"79","0.452752","172.16.1.2","172.16.3.2","SSHv2","1514","Client: "
"80","0.452770","172.16.1.2","172.16.3.2","SSHv2","1514","Client: "
"81","0.452781","172.16.1.2","172.16.3.2","SSHv2","1514","Client: "
"82","0.452792","172.16.1.2","172.16.3.2","SSHv2","1514","Client: "
"83","0.452804","172.16.1.2","172.16.3.2","SSHv2","1514","Client: "
"84","0.458928","172.16.3.2","172.16.1.2","TCP","66","22  >  42610 [ACK] Seq=1971 Ack=21599 Win=65728 Len=0 TSval=2117459073 TSecr=361667801"
"85","0.458949","172.16.3.2","172.16.1.2","TCP","66","22  >  42610 [ACK] Seq=1971 Ack=24463 Win=65728 Len=0 TSval=2117459073 TSecr=361667801"
"86","0.458956","172.16.3.2","172.16.1.2","MPTCP","74","22  >  42610 [ACK] Seq=1971 Ack=25895 Win=65728 Len=0 TSval=2117459085 TSecr=361667801"
"87","0.459258","172.16.3.2","172.16.1.2","TCP","66","22  >  42610 [ACK] Seq=1971 Ack=28759 Win=65728 Len=0 TSval=2117459085 TSecr=361667801"
"88","0.459439","172.16.3.2","172.16.1.2","TCP","66","22  >  42610 [ACK] Seq=1971 Ack=31623 Win=65728 Len=0 TSval=2117459085 TSecr=361667801"
"89","0.460540","172.16.1.2","172.16.3.2","SSHv2","1514","Client: "
"90","0.460571","172.16.1.2","172.16.3.2","SSHv2","1514","Client: "
"91","0.460632","172.16.1.2","172.16.3.2","SSHv2","1514","Client: "
"92","0.460662","172.16.1.2","172.16.3.2","SSHv2","1514","Client: "
"93","0.460716","172.16.1.2","172.16.3.2","SSHv2","1514","Client: "
"94","0.460744","172.16.1.2","172.16.3.2","SSHv2","1514","Client: "
"95","0.460818","172.16.1.2","172.16.3.2","SSHv2","1514","Client: "
"96","0.460860","172.16.1.2","172.16.3.2","SSHv2","1514","Client: "
"97","0.460915","172.16.1.2","172.16.3.2","SSHv2","1514","Client: "
"98","0.460943","172.16.1.2","172.16.3.2","SSHv2","1514","Client: "
"99","0.460956","172.16.1.2","172.16.3.2","SSHv2","786","Client: "
"100","0.479137","172.16.3.2","172.16.1.2","TCP","66","22  >  42610 [ACK] Seq=1971 Ack=34487 Win=65728 Len=0 TSval=2117459097 TSecr=361667801"
"101","0.479175","172.16.3.2","172.16.1.2","TCP","66","22  >  42610 [ACK] Seq=1971 Ack=37351 Win=65728 Len=0 TSval=2117459097 TSecr=361667801"
"102","0.479182","172.16.3.2","172.16.1.2","TCP","66","22  >  42610 [ACK] Seq=1971 Ack=40215 Win=65728 Len=0 TSval=2117459097 TSecr=361667801"
"103","0.479188","172.16.3.2","172.16.1.2","MPTCP","74","[TCP Dup ACK 102#1] 22  >  42610 [ACK] Seq=1971 Ack=40215 Win=65728 Len=0 TSval=2117459097 TSecr=361667801"
"104","0.479532","172.16.3.2","172.16.1.2","TCP","66","22  >  42610 [ACK] Seq=1971 Ack=42207 Win=65728 Len=0 TSval=2117459108 TSecr=361667801"
"105","0.479557","172.16.3.2","172.16.1.2","TCP","66","22  >  42610 [ACK] Seq=1971 Ack=45071 Win=65728 Len=0 TSval=2117459108 TSecr=361667816"
"106","0.498161","172.16.3.2","172.16.1.2","TCP","66","22  >  42610 [ACK] Seq=1971 Ack=47935 Win=65728 Len=0 TSval=2117459114 TSecr=361667816"
"107","0.498193","172.16.3.2","172.16.1.2","TCP","66","22  >  42610 [ACK] Seq=1971 Ack=50799 Win=65728 Len=0 TSval=2117459114 TSecr=361667821"
"108","0.498197","172.16.3.2","172.16.1.2","TCP","66","22  >  42610 [ACK] Seq=1971 Ack=53663 Win=65728 Len=0 TSval=2117459114 TSecr=361667821"
"109","0.498200","172.16.3.2","172.16.1.2","MPTCP","74","[TCP Dup ACK 108#1] 22  >  42610 [ACK] Seq=1971 Ack=53663 Win=65728 Len=0 TSval=2117459114 TSecr=361667821"
"110","0.526708","172.16.3.2","172.16.1.2","TCP","66","22  >  42610 [ACK] Seq=1971 Ack=56527 Win=65728 Len=0 TSval=2117459125 TSecr=361667821"
"111","0.526713","172.16.3.2","172.16.1.2","TCP","66","22  >  42610 [ACK] Seq=1971 Ack=59391 Win=65728 Len=0 TSval=2117459125 TSecr=361667821"
"112","0.526716","172.16.3.2","172.16.1.2","TCP","66","22  >  42610 [ACK] Seq=1971 Ack=62255 Win=65728 Len=0 TSval=2117459136 TSecr=361667821"
"113","0.526720","172.16.3.2","172.16.1.2","MPTCP","74","22  >  42610 [ACK] Seq=1971 Ack=62959 Win=65728 Len=0 TSval=2117459136 TSecr=361667821"
"114","0.526866","172.16.3.2","172.16.1.2","MPTCP","74","[TCP Dup ACK 113#1] 22  >  42610 [ACK] Seq=1971 Ack=62959 Win=65728 Len=0 TSval=2117459146 TSecr=361667821"
"115","0.527704","172.16.1.2","172.16.3.2","MPTCP","74","[TCP Dup ACK 39#2] 42610  >  22 [ACK] Seq=62959 Ack=1971 Win=65728 Len=0 TSval=361667893 TSecr=2117459146"
"116","0.528448","172.16.1.2","172.16.3.2","SSHv2","1514","Client: "
"117","0.528474","172.16.1.2","172.16.3.2","SSHv2","1514","Client: "
"118","0.528495","172.16.1.2","172.16.3.2","SSHv2","1514","Client: "
"119","0.528523","172.16.1.2","172.16.3.2","SSHv2","1514","Client: "
"120","0.528580","172.16.1.2","172.16.3.2","SSHv2","1514","Client: "
"121","0.528606","172.16.1.2","172.16.3.2","SSHv2","1514","Client: "
"122","0.528640","172.16.1.2","172.16.3.2","SSHv2","1514","Client: "
"123","0.528670","172.16.1.2","172.16.3.2","SSHv2","1514","Client: "
"124","0.528768","172.16.1.2","172.16.3.2","SSHv2","1514","Client: "
"125","0.528797","172.16.1.2","172.16.3.2","SSHv2","1514","Client: "
"126","0.528830","172.16.1.2","172.16.3.2","SSHv2","1514","Client: "
"127","0.528856","172.16.1.2","172.16.3.2","SSHv2","1514","Client: "
"128","0.528900","172.16.1.2","172.16.3.2","SSHv2","1514","Client: "
"129","0.528951","172.16.1.2","172.16.3.2","SSHv2","1514","Client: "
"130","0.529008","172.16.1.2","172.16.3.2","SSHv2","1514","Client: "
"131","0.529036","172.16.1.2","172.16.3.2","SSHv2","1514","Client: "
"132","0.529067","172.16.1.2","172.16.3.2","SSHv2","1514","Client: "
"133","0.529171","172.16.1.2","172.16.3.2","SSHv2","1514","Client: "
"134","0.529199","172.16.1.2","172.16.3.2","SSHv2","1514","Client: "
"135","0.529253","172.16.1.2","172.16.3.2","SSHv2","1514","Client: "
"136","0.529305","172.16.1.2","172.16.3.2","SSHv2","1514","Client: "
"137","0.529381","172.16.1.2","172.16.3.2","SSHv2","1346","Client: "
"138","0.548412","172.16.3.2","172.16.1.2","TCP","66","22  >  42610 [ACK] Seq=1971 Ack=65823 Win=65728 Len=0 TSval=2117459164 TSecr=361667893"
"139","0.548428","172.16.3.2","172.16.1.2","TCP","66","22  >  42610 [ACK] Seq=1971 Ack=68687 Win=65728 Len=0 TSval=2117459164 TSecr=361667893"
"140","0.548988","172.16.3.2","172.16.1.2","TCP","66","22  >  42610 [ACK] Seq=1971 Ack=71551 Win=65728 Len=0 TSval=2117459178 TSecr=361667893"
"141","0.549014","172.16.3.2","172.16.1.2","TCP","66","22  >  42610 [ACK] Seq=1971 Ack=74415 Win=65728 Len=0 TSval=2117459178 TSecr=361667893"
"142","0.556544","172.16.3.2","172.16.1.2","MPTCP","74","22  >  42610 [ACK] Seq=1971 Ack=75847 Win=65728 Len=0 TSval=2117459183 TSecr=361667893"
"143","0.568758","172.16.3.2","172.16.1.2","TCP","66","22  >  42610 [ACK] Seq=1971 Ack=78711 Win=65728 Len=0 TSval=2117459183 TSecr=361667893"
"144","0.568782","172.16.3.2","172.16.1.2","TCP","66","22  >  42610 [ACK] Seq=1971 Ack=81575 Win=65728 Len=0 TSval=2117459183 TSecr=361667893"
"145","0.569145","172.16.3.2","172.16.1.2","TCP","66","22  >  42610 [ACK] Seq=1971 Ack=84439 Win=65728 Len=0 TSval=2117459195 TSecr=361667893"
"146","0.569160","172.16.3.2","172.16.1.2","TCP","66","22  >  42610 [ACK] Seq=1971 Ack=87303 Win=65728 Len=0 TSval=2117459195 TSecr=361667893"
"147","0.569337","172.16.3.2","172.16.1.2","TCP","66","22  >  42610 [ACK] Seq=1971 Ack=90167 Win=65728 Len=0 TSval=2117459195 TSecr=361667893"
"148","0.569365","172.16.3.2","172.16.1.2","MPTCP","74","[TCP Dup ACK 147#1] 22  >  42610 [ACK] Seq=1971 Ack=90167 Win=65728 Len=0 TSval=2117459195 TSecr=361667893"
"149","0.570480","172.16.1.2","172.16.3.2","SSHv2","1514","Client: "
"150","0.570509","172.16.1.2","172.16.3.2","SSHv2","1514","Client: "
"151","0.570630","172.16.1.2","172.16.3.2","SSHv2","1514","Client: "
"152","0.570667","172.16.1.2","172.16.3.2","SSHv2","1514","Client: "
"153","0.570760","172.16.1.2","172.16.3.2","SSHv2","1514","Client: "
"154","0.581182","172.16.1.2","172.16.3.2","SSHv2","1514","Client: "
"155","0.581209","172.16.1.2","172.16.3.2","SSHv2","1514","Client: "
"156","0.581242","172.16.1.2","172.16.3.2","SSHv2","1514","Client: "
"157","0.581284","172.16.1.2","172.16.3.2","SSHv2","1514","Client: "
"158","0.581314","172.16.1.2","172.16.3.2","SSHv2","1514","Client: "
"159","0.581374","172.16.1.2","172.16.3.2","SSHv2","1514","Client: "
"160","0.581399","172.16.1.2","172.16.3.2","SSHv2","1514","Client: "
"161","0.581431","172.16.1.2","172.16.3.2","SSHv2","1514","Client: "
"162","0.581488","172.16.1.2","172.16.3.2","SSHv2","1514","Client: "
"163","0.581515","172.16.1.2","172.16.3.2","SSHv2","1514","Client: "
"164","0.581627","172.16.1.2","172.16.3.2","SSHv2","1514","Client: "
"165","0.581658","172.16.1.2","172.16.3.2","SSHv2","1514","Client: "
"166","0.581692","172.16.1.2","172.16.3.2","SSHv2","1514","Client: "
"167","0.581724","172.16.1.2","172.16.3.2","SSHv2","1514","Client: "
"168","0.581762","172.16.1.2","172.16.3.2","SSHv2","1514","Client: "
"169","0.581806","172.16.1.2","172.16.3.2","SSHv2","1514","Client: "
"170","0.581839","172.16.1.2","172.16.3.2","SSHv2","1346","Client: "
"171","0.588410","172.16.3.2","172.16.1.2","TCP","66","22  >  42610 [ACK] Seq=1971 Ack=93031 Win=65728 Len=0 TSval=2117459205 TSecr=361667893"
"172","0.588439","172.16.3.2","172.16.1.2","TCP","66","22  >  42610 [ACK] Seq=1971 Ack=95727 Win=65728 Len=0 TSval=2117459205 TSecr=361667893"
"173","0.588448","172.16.3.2","172.16.1.2","TCP","66","22  >  42610 [ACK] Seq=1971 Ack=98591 Win=65728 Len=0 TSval=2117459205 TSecr=361667935"
"174","0.588923","172.16.3.2","172.16.1.2","TCP","66","22  >  42610 [ACK] Seq=1971 Ack=101455 Win=65728 Len=0 TSval=2117459213 TSecr=361667935"
"175","0.588987","172.16.3.2","172.16.1.2","TCP","66","22  >  42610 [ACK] Seq=1971 Ack=104319 Win=65728 Len=0 TSval=2117459213 TSecr=361667942"
"176","0.589179","172.16.3.2","172.16.1.2","MPTCP","74","22  >  42610 [ACK] Seq=1971 Ack=105751 Win=65728 Len=0 TSval=2117459213 TSecr=361667942"
"177","0.609163","172.16.3.2","172.16.1.2","TCP","66","22  >  42610 [ACK] Seq=1971 Ack=108615 Win=65728 Len=0 TSval=2117459225 TSecr=361667942"
"178","0.609189","172.16.3.2","172.16.1.2","TCP","66","22  >  42610 [ACK] Seq=1971 Ack=111479 Win=65728 Len=0 TSval=2117459225 TSecr=361667942"
"179","0.609198","172.16.3.2","172.16.1.2","MPTCP","74","22  >  42610 [ACK] Seq=1971 Ack=112911 Win=65728 Len=0 TSval=2117459225 TSecr=361667942"
"180","0.609724","172.16.3.2","172.16.1.2","TCP","66","22  >  42610 [ACK] Seq=1971 Ack=115775 Win=65728 Len=0 TSval=2117459234 TSecr=361667942"
"181","0.609921","172.16.3.2","172.16.1.2","TCP","66","22  >  42610 [ACK] Seq=1971 Ack=118639 Win=65728 Len=0 TSval=2117459234 TSecr=361667942"
"182","0.616316","172.16.1.2","172.16.3.2","MPTCP","74","[TCP Dup ACK 39#3] 42610  >  22 [ACK] Seq=125631 Ack=1971 Win=65728 Len=0 TSval=361667982 TSecr=2117459234"
"183","0.628778","172.16.3.2","172.16.1.2","TCP","66","22  >  42610 [ACK] Seq=1971 Ack=121503 Win=65728 Len=0 TSval=2117459247 TSecr=361667942"
"184","0.628862","172.16.3.2","172.16.1.2","TCP","66","22  >  42610 [ACK] Seq=1971 Ack=124367 Win=65728 Len=0 TSval=2117459247 TSecr=361667942"
"185","0.628926","172.16.3.2","172.16.1.2","MPTCP","74","22  >  42610 [ACK] Seq=1971 Ack=125631 Win=65728 Len=0 TSval=2117459247 TSecr=361667942"
"186","0.636771","172.16.3.2","172.16.1.2","MPTCP","74","[TCP Dup ACK 185#1] 22  >  42610 [ACK] Seq=1971 Ack=125631 Win=65728 Len=0 TSval=2117459265 TSecr=361667942"
"187","0.637767","172.16.1.2","172.16.3.2","SSHv2","1514","Client: "
"188","0.637787","172.16.1.2","172.16.3.2","SSHv2","1514","Client: "
"189","0.637803","172.16.1.2","172.16.3.2","SSHv2","1514","Client: "
"190","0.637841","172.16.1.2","172.16.3.2","SSHv2","1514","Client: "
"191","0.637865","172.16.1.2","172.16.3.2","SSHv2","1514","Client: "
"192","0.647751","172.16.3.2","172.16.1.2","MPTCP","74","[TCP Dup ACK 185#2] 22  >  42610 [ACK] Seq=1971 Ack=125631 Win=65728 Len=0 TSval=2117459273 TSecr=361667942"
"193","0.648187","172.16.3.2","172.16.1.2","TCP","66","22  >  42610 [ACK] Seq=1971 Ack=128495 Win=65728 Len=0 TSval=2117459273 TSecr=361668003"
"194","0.648198","172.16.3.2","172.16.1.2","TCP","66","22  >  42610 [ACK] Seq=1971 Ack=131359 Win=65728 Len=0 TSval=2117459273 TSecr=361668003"
"195","0.657755","172.16.1.2","172.16.3.2","SSHv2","1514","Client: "
"196","0.657797","172.16.1.2","172.16.3.2","SSHv2","1514","Client: "
"197","0.657814","172.16.1.2","172.16.3.2","SSHv2","1514","Client: "
"198","0.657877","172.16.1.2","172.16.3.2","SSHv2","1514","Client: "
"199","0.657912","172.16.1.2","172.16.3.2","SSHv2","1514","Client: "
"200","0.668096","172.16.3.2","172.16.1.2","MPTCP","74","22  >  42610 [ACK] Seq=1971 Ack=132791 Win=65728 Len=0 TSval=2117459295 TSecr=361668003"
"201","0.668427","172.16.3.2","172.16.1.2","TCP","66","22  >  42610 [ACK] Seq=1971 Ack=135655 Win=65728 Len=0 TSval=2117459295 TSecr=361668022"
"202","0.668452","172.16.3.2","172.16.1.2","TCP","66","22  >  42610 [ACK] Seq=1971 Ack=138519 Win=65728 Len=0 TSval=2117459295 TSecr=361668022"
"203","0.669086","172.16.1.2","172.16.3.2","SSHv2","1514","Client: "
"204","0.669118","172.16.1.2","172.16.3.2","SSHv2","1514","Client: "
"205","0.669163","172.16.1.2","172.16.3.2","SSHv2","1346","Client: "
"206","0.676674","172.16.3.2","172.16.1.2","MPTCP","74","22  >  42610 [ACK] Seq=1971 Ack=139951 Win=65728 Len=0 TSval=2117459306 TSecr=361668022"
"207","0.689665","172.16.3.2","172.16.1.2","TCP","66","22  >  42610 [ACK] Seq=1971 Ack=142815 Win=65728 Len=0 TSval=2117459306 TSecr=361668035"
"208","0.709456","172.16.3.2","172.16.1.2","MPTCP","74","22  >  42610 [ACK] Seq=1971 Ack=144079 Win=65728 Len=0 TSval=2117459335 TSecr=361668035"
"209","0.710215","172.16.1.2","172.16.3.2","SSHv2","1514","Client: "
"210","0.710238","172.16.1.2","172.16.3.2","SSHv2","1514","Client: "
"211","0.710313","172.16.1.2","172.16.3.2","SSHv2","1514","Client: "
"212","0.710331","172.16.1.2","172.16.3.2","SSHv2","1514","Client: "
"213","0.710443","172.16.1.2","172.16.3.2","SSHv2","1514","Client: "
"214","0.716885","172.16.3.2","172.16.1.2","MPTCP","74","[TCP Dup ACK 208#1] 22  >  42610 [ACK] Seq=1971 Ack=144079 Win=65728 Len=0 TSval=2117459344 TSecr=361668035"
"215","0.729324","172.16.3.2","172.16.1.2","TCP","66","22  >  42610 [ACK] Seq=1971 Ack=146943 Win=65728 Len=0 TSval=2117459344 TSecr=361668076"
"216","0.729343","172.16.3.2","172.16.1.2","TCP","66","22  >  42610 [ACK] Seq=1971 Ack=149807 Win=65728 Len=0 TSval=2117459344 TSecr=361668076"
"217","0.737445","172.16.3.2","172.16.1.2","MPTCP","74","22  >  42610 [ACK] Seq=1971 Ack=151239 Win=65728 Len=0 TSval=2117459366 TSecr=361668076"
"218","0.748787","172.16.3.2","172.16.1.2","MPTCP","74","[TCP Dup ACK 217#1] 22  >  42610 [ACK] Seq=1971 Ack=151239 Win=65728 Len=0 TSval=2117459373 TSecr=361668076"
"219","0.769281","172.16.3.2","172.16.1.2","MPTCP","74","[TCP Dup ACK 217#2] 22  >  42610 [ACK] Seq=1971 Ack=151239 Win=65728 Len=0 TSval=2117459395 TSecr=361668076"
"220","0.769313","172.16.3.2","172.16.1.2","MPTCP","74","[TCP Dup ACK 217#3] 22  >  42610 [ACK] Seq=1971 Ack=151239 Win=65728 Len=0 TSval=2117459395 TSecr=361668076"
"221","0.777306","172.16.1.2","172.16.3.2","SSHv2","1514","Client: "
"222","0.777338","172.16.1.2","172.16.3.2","SSHv2","1514","Client: "
"223","0.777351","172.16.1.2","172.16.3.2","SSHv2","1514","Client: "
"224","0.777382","172.16.1.2","172.16.3.2","SSHv2","1514","Client: "
"225","0.777397","172.16.1.2","172.16.3.2","SSHv2","1346","Client: "
"226","0.797982","172.16.1.2","172.16.3.2","SSHv2","1514","Client: "
"227","0.798003","172.16.1.2","172.16.3.2","SSHv2","1514","Client: "
"228","0.798018","172.16.1.2","172.16.3.2","SSHv2","1514","Client: "
"229","0.798036","172.16.1.2","172.16.3.2","SSHv2","1514","Client: "
"230","0.798131","172.16.1.2","172.16.3.2","SSHv2","1514","Client: "
"231","0.798405","172.16.3.2","172.16.1.2","TCP","66","22  >  42610 [ACK] Seq=1971 Ack=154103 Win=65728 Len=0 TSval=2117459414 TSecr=361668142"
"232","0.798417","172.16.3.2","172.16.1.2","TCP","66","22  >  42610 [ACK] Seq=1971 Ack=156967 Win=65728 Len=0 TSval=2117459414 TSecr=361668142"
"233","0.798428","172.16.3.2","172.16.1.2","MPTCP","74","22  >  42610 [ACK] Seq=1971 Ack=158231 Win=65728 Len=0 TSval=2117459426 TSecr=361668142"
"234","0.806477","172.16.3.2","172.16.1.2","MPTCP","74","[TCP Dup ACK 233#1] 22  >  42610 [ACK] Seq=1971 Ack=158231 Win=65728 Len=0 TSval=2117459435 TSecr=361668142"
"235","0.818613","172.16.3.2","172.16.1.2","TCP","66","22  >  42610 [ACK] Seq=1971 Ack=161095 Win=65728 Len=0 TSval=2117459435 TSecr=361668163"
"236","0.818625","172.16.3.2","172.16.1.2","TCP","66","22  >  42610 [ACK] Seq=1971 Ack=163959 Win=65728 Len=0 TSval=2117459435 TSecr=361668163"
"237","0.825797","172.16.3.2","172.16.1.2","MPTCP","74","22  >  42610 [ACK] Seq=1971 Ack=165391 Win=65728 Len=0 TSval=2117459455 TSecr=361668163"
"238","0.838120","172.16.1.2","172.16.3.2","SSHv2","1514","Client: "
"239","0.838140","172.16.1.2","172.16.3.2","SSHv2","1514","Client: "
"240","0.838150","172.16.1.2","172.16.3.2","SSHv2","1514","Client: "
"241","0.838161","172.16.1.2","172.16.3.2","SSHv2","1514","Client: "
"242","0.838173","172.16.1.2","172.16.3.2","SSHv2","1514","Client: "
"243","0.849456","172.16.3.2","172.16.1.2","MPTCP","74","[TCP Dup ACK 237#1] 22  >  42610 [ACK] Seq=1971 Ack=165391 Win=65728 Len=0 TSval=2117459474 TSecr=361668163"
"244","0.849811","172.16.3.2","172.16.1.2","TCP","66","22  >  42610 [ACK] Seq=1971 Ack=168255 Win=65728 Len=0 TSval=2117459474 TSecr=361668202"
"245","0.849821","172.16.3.2","172.16.1.2","TCP","66","22  >  42610 [ACK] Seq=1971 Ack=171119 Win=65728 Len=0 TSval=2117459474 TSecr=361668202"
"246","0.850282","172.16.1.2","172.16.3.2","SSHv2","1514","Client: "
"247","0.850304","172.16.1.2","172.16.3.2","SSHv2","1514","Client: "
"248","0.850319","172.16.1.2","172.16.3.2","SSHv2","1514","Client: "
"249","0.850334","172.16.1.2","172.16.3.2","SSHv2","1514","Client: "
"250","0.850372","172.16.1.2","172.16.3.2","SSHv2","1514","Client: "
"251","0.868483","172.16.3.2","172.16.1.2","TCP","66","22  >  42610 [ACK] Seq=1971 Ack=173983 Win=65728 Len=0 TSval=2117459486 TSecr=361668202"
"252","0.868505","172.16.3.2","172.16.1.2","TCP","66","22  >  42610 [ACK] Seq=1971 Ack=176847 Win=65728 Len=0 TSval=2117459486 TSecr=361668216"
"253","0.868510","172.16.3.2","172.16.1.2","TCP","66","22  >  42610 [ACK] Seq=1971 Ack=179711 Win=65728 Len=0 TSval=2117459486 TSecr=361668216"
"254","0.868515","172.16.3.2","172.16.1.2","MPTCP","74","[TCP Dup ACK 253#1] 22  >  42610 [ACK] Seq=1971 Ack=179711 Win=65728 Len=0 TSval=2117459495 TSecr=361668216"
"255","0.879301","172.16.1.2","172.16.3.2","MPTCP","74","[TCP Dup ACK 39#4] 42610  >  22 [ACK] Seq=179711 Ack=1971 Win=65728 Len=0 TSval=361668242 TSecr=2117459495"
"256","0.899116","172.16.3.2","172.16.1.2","MPTCP","74","[TCP Dup ACK 253#2] 22  >  42610 [ACK] Seq=1971 Ack=179711 Win=65728 Len=0 TSval=2117459513 TSecr=361668216"
"257","0.917900","172.16.3.2","172.16.1.2","MPTCP","74","[TCP Dup ACK 253#3] 22  >  42610 [ACK] Seq=1971 Ack=179711 Win=65728 Len=0 TSval=2117459544 TSecr=361668242"
"258","0.949027","172.16.3.2","172.16.1.2","MPTCP","74","[TCP Dup ACK 253#4] 22  >  42610 [ACK] Seq=1971 Ack=179711 Win=65728 Len=0 TSval=2117459566 TSecr=361668242"
"259","0.949060","172.16.3.2","172.16.1.2","MPTCP","74","[TCP Dup ACK 253#5] 22  >  42610 [ACK] Seq=1971 Ack=179711 Win=65728 Len=0 TSval=2117459573 TSecr=361668242"
"260","0.949899","172.16.1.2","172.16.3.2","SSHv2","1514","Client: "
"261","0.949924","172.16.1.2","172.16.3.2","SSHv2","1514","Client: "
"262","0.949970","172.16.1.2","172.16.3.2","SSHv2","1514","Client: "
"263","0.949989","172.16.1.2","172.16.3.2","SSHv2","1514","Client: "
"264","0.950028","172.16.1.2","172.16.3.2","SSHv2","1514","Client: "
"265","0.968535","172.16.3.2","172.16.1.2","TCP","66","22  >  42610 [ACK] Seq=1971 Ack=182575 Win=65728 Len=0 TSval=2117459585 TSecr=361668316"
"266","0.968565","172.16.3.2","172.16.1.2","TCP","66","22  >  42610 [ACK] Seq=1971 Ack=185439 Win=65728 Len=0 TSval=2117459585 TSecr=361668316"
"267","0.968570","172.16.3.2","172.16.1.2","MPTCP","74","22  >  42610 [ACK] Seq=1971 Ack=186871 Win=65728 Len=0 TSval=2117459595 TSecr=361668316"
"268","0.977444","172.16.1.2","172.16.3.2","SSHv2","1514","Client: "
"269","0.977490","172.16.1.2","172.16.3.2","SSHv2","1514","Client: "
"270","0.977525","172.16.1.2","172.16.3.2","SSHv2","1514","Client: "
"271","0.977573","172.16.1.2","172.16.3.2","SSHv2","1514","Client: "
"272","0.977608","172.16.1.2","172.16.3.2","SSHv2","1514","Client: "
"273","0.988291","172.16.3.2","172.16.1.2","MPTCP","74","[TCP Dup ACK 267#1] 22  >  42610 [ACK] Seq=1971 Ack=186871 Win=65728 Len=0 TSval=2117459614 TSecr=361668316"
"274","0.989596","172.16.3.2","172.16.1.2","TCP","66","22  >  42610 [ACK] Seq=1971 Ack=189735 Win=65728 Len=0 TSval=2117459614 TSecr=361668342"
"275","0.990221","172.16.3.2","172.16.1.2","TCP","66","22  >  42610 [ACK] Seq=1971 Ack=192599 Win=65728 Len=0 TSval=2117459614 TSecr=361668342"
"276","0.996647","172.16.3.2","172.16.1.2","MPTCP","74","22  >  42610 [ACK] Seq=1971 Ack=194031 Win=65728 Len=0 TSval=2117459626 TSecr=361668342"
"277","1.008745","172.16.3.2","172.16.1.2","MPTCP","74","[TCP Dup ACK 276#1] 22  >  42610 [ACK] Seq=1971 Ack=194031 Win=65728 Len=0 TSval=2117459635 TSecr=361668342"
"278","1.009659","172.16.1.2","172.16.3.2","SSHv2","1514","Client: "
"279","1.009692","172.16.1.2","172.16.3.2","SSHv2","1514","Client: "
"280","1.009959","172.16.1.2","172.16.3.2","SSHv2","1514","Client: "
"281","1.010018","172.16.1.2","172.16.3.2","SSHv2","1514","Client: "
"282","1.010145","172.16.1.2","172.16.3.2","SSHv2","1514","Client: "
"283","1.010317","172.16.1.2","172.16.3.2","SSHv2","1514","Client: "
"284","1.010404","172.16.1.2","172.16.3.2","SSHv2","1514","Client: "
"285","1.010544","172.16.1.2","172.16.3.2","SSHv2","1514","Client: "
"286","1.010718","172.16.1.2","172.16.3.2","SSHv2","1514","Client: "
"287","1.010766","172.16.1.2","172.16.3.2","SSHv2","1514","Client: "
"288","1.028173","172.16.3.2","172.16.1.2","TCP","66","22  >  42610 [ACK] Seq=1971 Ack=196895 Win=65728 Len=0 TSval=2117459645 TSecr=361668375"
"289","1.028220","172.16.3.2","172.16.1.2","TCP","66","22  >  42610 [ACK] Seq=1971 Ack=199759 Win=65728 Len=0 TSval=2117459645 TSecr=361668375"
"290","1.028229","172.16.3.2","172.16.1.2","MPTCP","74","22  >  42610 [ACK] Seq=1971 Ack=201191 Win=65728 Len=0 TSval=2117459656 TSecr=361668375"
"291","1.028397","172.16.3.2","172.16.1.2","TCP","66","22  >  42610 [ACK] Seq=1971 Ack=204055 Win=65728 Len=0 TSval=2117459656 TSecr=361668375"
"292","1.028558","172.16.3.2","172.16.1.2","TCP","66","22  >  42610 [ACK] Seq=1971 Ack=206919 Win=65728 Len=0 TSval=2117459656 TSecr=361668375"
"293","1.037158","172.16.1.2","172.16.3.2","SSHv2","1514","Client: "
"294","1.037179","172.16.1.2","172.16.3.2","SSHv2","1514","Client: "
"295","1.037193","172.16.1.2","172.16.3.2","SSHv2","1514","Client: "
"296","1.037272","172.16.1.2","172.16.3.2","SSHv2","1514","Client: "
"297","1.037286","172.16.1.2","172.16.3.2","SSHv2","1514","Client: "
"298","1.037348","172.16.1.2","172.16.3.2","SSHv2","1514","Client: "
"299","1.037370","172.16.1.2","172.16.3.2","SSHv2","1514","Client: "
"300","1.037435","172.16.1.2","172.16.3.2","SSHv2","1514","Client: "
"301","1.037457","172.16.1.2","172.16.3.2","SSHv2","1514","Client: "
"302","1.037520","172.16.1.2","172.16.3.2","SSHv2","1514","Client: "
"303","1.037534","172.16.1.2","172.16.3.2","SSHv2","1514","Client: "
"304","1.037591","172.16.1.2","172.16.3.2","SSHv2","1514","Client: "
"305","1.037612","172.16.1.2","172.16.3.2","SSHv2","1514","Client: "
"306","1.037677","172.16.1.2","172.16.3.2","SSHv2","1514","Client: "
"307","1.037693","172.16.1.2","172.16.3.2","SSHv2","1514","Client: "
"308","1.038520","172.16.1.2","172.16.3.2","MPTCP","74","[TCP Dup ACK 39#5] 42610  >  22 [ACK] Seq=229831 Ack=1971 Win=65728 Len=0 TSval=361668402 TSecr=2117459656"
"309","1.048610","172.16.3.2","172.16.1.2","MPTCP","74","22  >  42610 [ACK] Seq=1971 Ack=208351 Win=65728 Len=0 TSval=2117459673 TSecr=361668375"
"310","1.049204","172.16.3.2","172.16.1.2","TCP","66","22  >  42610 [ACK] Seq=1971 Ack=211215 Win=65728 Len=0 TSval=2117459673 TSecr=361668402"
"311","1.049215","172.16.3.2","172.16.1.2","TCP","66","22  >  42610 [ACK] Seq=1971 Ack=214079 Win=65728 Len=0 TSval=2117459673 TSecr=361668402"
"312","1.056642","172.16.3.2","172.16.1.2","MPTCP","74","22  >  42610 [ACK] Seq=1971 Ack=215511 Win=65728 Len=0 TSval=2117459685 TSecr=361668402"
"313","1.068369","172.16.3.2","172.16.1.2","TCP","66","22  >  42610 [ACK] Seq=1971 Ack=218375 Win=65728 Len=0 TSval=2117459685 TSecr=361668402"
"314","1.068397","172.16.3.2","172.16.1.2","TCP","66","22  >  42610 [ACK] Seq=1971 Ack=221239 Win=65728 Len=0 TSval=2117459685 TSecr=361668402"
"315","1.068849","172.16.3.2","172.16.1.2","TCP","66","22  >  42610 [ACK] Seq=1971 Ack=224103 Win=65728 Len=0 TSval=2117459694 TSecr=361668402"
"316","1.068863","172.16.3.2","172.16.1.2","TCP","66","22  >  42610 [ACK] Seq=1971 Ack=226967 Win=65728 Len=0 TSval=2117459694 TSecr=361668402"
"317","1.068962","172.16.3.2","172.16.1.2","TCP","66","22  >  42610 [ACK] Seq=1971 Ack=229831 Win=65728 Len=0 TSval=2117459694 TSecr=361668402"
"318","1.068980","172.16.3.2","172.16.1.2","MPTCP","74","[TCP Dup ACK 317#1] 22  >  42610 [ACK] Seq=1971 Ack=229831 Win=65728 Len=0 TSval=2117459694 TSecr=361668402"
"319","1.088199","172.16.3.2","172.16.1.2","MPTCP","74","[TCP Dup ACK 317#2] 22  >  42610 [ACK] Seq=1971 Ack=229831 Win=65728 Len=0 TSval=2117459714 TSecr=361668402"
"320","1.089088","172.16.1.2","172.16.3.2","SSHv2","1514","Client: "
"321","1.089115","172.16.1.2","172.16.3.2","SSHv2","1514","Client: "
"322","1.089213","172.16.1.2","172.16.3.2","SSHv2","1514","Client: "
"323","1.089218","172.16.1.2","172.16.3.2","SSHv2","1514","Client: "
"324","1.089376","172.16.1.2","172.16.3.2","SSHv2","1514","Client: "
"325","1.089397","172.16.1.2","172.16.3.2","SSHv2","1514","Client: "
"326","1.089456","172.16.1.2","172.16.3.2","SSHv2","1514","Client: "
"327","1.089569","172.16.1.2","172.16.3.2","SSHv2","1346","Client: "
"328","1.090517","172.16.1.2","172.16.3.2","SSHv2","1514","Client: "
"329","1.090550","172.16.1.2","172.16.3.2","SSHv2","1514","Client: "
"330","1.090598","172.16.1.2","172.16.3.2","SSHv2","1514","Client: "
"331","1.090632","172.16.1.2","172.16.3.2","SSHv2","1514","Client: "
"332","1.090691","172.16.1.2","172.16.3.2","SSHv2","1514","Client: "
"333","1.090734","172.16.1.2","172.16.3.2","SSHv2","1514","Client: "
"334","1.090766","172.16.1.2","172.16.3.2","SSHv2","1514","Client: "
"335","1.090790","172.16.1.2","172.16.3.2","SSHv2","1514","Client: "
"336","1.090833","172.16.1.2","172.16.3.2","SSHv2","1514","Client: "
"337","1.090857","172.16.1.2","172.16.3.2","SSHv2","1514","Client: "
"338","1.090875","172.16.1.2","172.16.3.2","SSHv2","1514","Client: "
"339","1.090896","172.16.1.2","172.16.3.2","SSHv2","1514","Client: "
"340","1.090928","172.16.1.2","172.16.3.2","SSHv2","1514","Client: "
"341","1.090954","172.16.1.2","172.16.3.2","SSHv2","1514","Client: "
"342","1.090977","172.16.1.2","172.16.3.2","SSHv2","1514","Client: "
"343","1.106669","172.16.1.2","172.16.3.2","SSHv2","1514","Client: "
"344","1.106763","172.16.1.2","172.16.3.2","SSHv2","1514","Client: "
"345","1.106868","172.16.1.2","172.16.3.2","SSHv2","1514","Client: "
"346","1.106888","172.16.1.2","172.16.3.2","SSHv2","1514","Client: "
"347","1.107025","172.16.1.2","172.16.3.2","SSHv2","1514","Client: "
"348","1.107173","172.16.3.2","172.16.1.2","TCP","66","22  >  42610 [ACK] Seq=1971 Ack=232695 Win=65728 Len=0 TSval=2117459724 TSecr=361668455"
"349","1.107190","172.16.3.2","172.16.1.2","TCP","66","22  >  42610 [ACK] Seq=1971 Ack=235559 Win=65728 Len=0 TSval=2117459724 TSecr=361668455"
"350","1.107504","172.16.3.2","172.16.1.2","TCP","66","22  >  42610 [ACK] Seq=1971 Ack=238423 Win=65728 Len=0 TSval=2117459737 TSecr=361668455"
"351","1.107517","172.16.3.2","172.16.1.2","TCP","66","22  >  42610 [ACK] Seq=1971 Ack=241119 Win=65728 Len=0 TSval=2117459737 TSecr=361668455"
"352","1.107674","172.16.3.2","172.16.1.2","TCP","66","22  >  42610 [ACK] Seq=1971 Ack=243983 Win=65728 Len=0 TSval=2117459737 TSecr=361668455"
"353","1.107697","172.16.3.2","172.16.1.2","MPTCP","74","[TCP Dup ACK 352#1] 22  >  42610 [ACK] Seq=1971 Ack=243983 Win=65728 Len=0 TSval=2117459737 TSecr=361668455"
"354","1.108362","172.16.1.2","172.16.3.2","SSHv2","1514","Client: "
"355","1.108392","172.16.1.2","172.16.3.2","SSHv2","1514","Client: "
"356","1.108483","172.16.1.2","172.16.3.2","SSHv2","1514","Client: "
"357","1.108517","172.16.1.2","172.16.3.2","SSHv2","1514","Client: "
"358","1.108650","172.16.1.2","172.16.3.2","SSHv2","1346","Client: "
"359","1.128543","172.16.3.2","172.16.1.2","TCP","66","22  >  42610 [ACK] Seq=1971 Ack=246847 Win=65728 Len=0 TSval=2117459748 TSecr=361668455"
"360","1.128559","172.16.3.2","172.16.1.2","TCP","66","22  >  42610 [ACK] Seq=1971 Ack=249711 Win=65728 Len=0 TSval=2117459748 TSecr=361668455"
"361","1.129203","172.16.3.2","172.16.1.2","TCP","66","22  >  42610 [ACK] Seq=1971 Ack=252575 Win=65728 Len=0 TSval=2117459758 TSecr=361668455"
"362","1.129215","172.16.3.2","172.16.1.2","TCP","66","22  >  42610 [ACK] Seq=1971 Ack=255439 Win=65728 Len=0 TSval=2117459758 TSecr=361668455"
"363","1.129220","172.16.3.2","172.16.1.2","TCP","66","22  >  42610 [ACK] Seq=1971 Ack=258303 Win=65728 Len=0 TSval=2117459758 TSecr=361668455"
"364","1.129225","172.16.3.2","172.16.1.2","MPTCP","74","[TCP Dup ACK 363#1] 22  >  42610 [ACK] Seq=1971 Ack=258303 Win=65728 Len=0 TSval=2117459758 TSecr=361668455"
"365","1.147115","172.16.1.2","172.16.3.2","SSHv2","1514","Client: "
"366","1.147137","172.16.1.2","172.16.3.2","SSHv2","1514","Client: "
"367","1.147152","172.16.1.2","172.16.3.2","SSHv2","1514","Client: "
"368","1.147170","172.16.1.2","172.16.3.2","SSHv2","1514","Client: "
"369","1.147275","172.16.1.2","172.16.3.2","SSHv2","1514","Client: "
"370","1.149576","172.16.3.2","172.16.1.2","TCP","66","22  >  42610 [ACK] Seq=1971 Ack=261167 Win=65728 Len=0 TSval=2117459763 TSecr=361668455"
"371","1.149590","172.16.3.2","172.16.1.2","TCP","66","22  >  42610 [ACK] Seq=1971 Ack=264031 Win=65728 Len=0 TSval=2117459763 TSecr=361668455"
"372","1.150015","172.16.3.2","172.16.1.2","TCP","66","22  >  42610 [ACK] Seq=1971 Ack=266895 Win=65728 Len=0 TSval=2117459776 TSecr=361668472"
"373","1.150028","172.16.3.2","172.16.1.2","TCP","66","22  >  42610 [ACK] Seq=1971 Ack=269759 Win=65728 Len=0 TSval=2117459776 TSecr=361668472"
"374","1.150164","172.16.3.2","172.16.1.2","TCP","66","22  >  42610 [ACK] Seq=1971 Ack=272623 Win=65728 Len=0 TSval=2117459776 TSecr=361668472"
"375","1.150176","172.16.3.2","172.16.1.2","MPTCP","74","[TCP Dup ACK 374#1] 22  >  42610 [ACK] Seq=1971 Ack=272623 Win=65728 Len=0 TSval=2117459776 TSecr=361668472"
"376","1.169323","172.16.3.2","172.16.1.2","TCP","66","22  >  42610 [ACK] Seq=1971 Ack=275487 Win=65728 Len=0 TSval=2117459786 TSecr=361668472"
"377","1.169359","172.16.3.2","172.16.1.2","TCP","66","22  >  42610 [ACK] Seq=1971 Ack=278183 Win=65728 Len=0 TSval=2117459786 TSecr=361668472"
"378","1.169370","172.16.3.2","172.16.1.2","MPTCP","74","22  >  42610 [ACK] Seq=1971 Ack=279615 Win=65728 Len=0 TSval=2117459786 TSecr=361668513"
"379","1.170074","172.16.3.2","172.16.1.2","TCP","66","22  >  42610 [ACK] Seq=1971 Ack=282479 Win=65728 Len=0 TSval=2117459799 TSecr=361668513"
"380","1.170090","172.16.3.2","172.16.1.2","MPTCP","74","22  >  42610 [ACK] Seq=1971 Ack=283911 Win=65728 Len=0 TSval=2117459799 TSecr=361668513"
"381","1.170786","172.16.1.2","172.16.3.2","SSHv2","1514","Client: "
"382","1.170824","172.16.1.2","172.16.3.2","SSHv2","1514","Client: "
"383","1.170861","172.16.1.2","172.16.3.2","SSHv2","1514","Client: "
"384","1.170934","172.16.1.2","172.16.3.2","SSHv2","1514","Client: "
"385","1.170966","172.16.1.2","172.16.3.2","SSHv2","1514","Client: "
"386","1.171026","172.16.1.2","172.16.3.2","SSHv2","1514","Client: "
